title,date,url,player,textblob_sentiment,relevance_score
Premiership Rugby Cup: Sale 40-19 Harlequins - Sharks all but secure semi-final spot,2023,https://www.bbc.co.uk/sport/rugby-union/63682014,Harrison Barnes,0.1236607142857142,0.024208453821156745
Super Bowl 57: Kansas City Chiefs fight back to beat Philadelphia Eagles 38-35 in thriller,2023,https://www.bbc.co.uk/sport/american-football/64613767,Harrison Barnes,0.2111051646765933,0.007041816686100194
Star Wars: Chewbacca script auction halted after family plea,2023,https://www.bbc.co.uk/news/uk-england-york-north-yorkshire-64602578,Harrison Barnes,0.0,0.0
The Archers: 09/12/2022,2023,https://www.bbc.co.uk/programmes/m001fwhh,Harrison Barnes,0.0,0.0
Saracens 33-22 Sale: Alex Goode stars as Sarries maintain winning run,2023,https://www.bbc.co.uk/sport/rugby-union/63384555,Harrison Barnes,0.2019179894179894,0.0061431923874883995
NBA: Luka Doncic inspires Dallas Mavericks to Christmas Day win over Los Angeles Lakers,2023,https://www.bbc.co.uk/sport/basketball/64093917,Tyrese Maxey,0.1617079889807162,0.010654227130692513
NBA: Kyrie Irving and Kevin Durant score high in Brooklyn Nets defeat at Memphis Grizzlies,2023,https://www.bbc.co.uk/sport/basketball/63383489,Desmond Bane,0.2637310606060606,0.01350449078319528
LeBron James breaks NBA all-time scoring record,2023,https://www.bbc.co.uk/sport/basketball/64563131,P.J. Washington,0.1825086125086125,0.008391127522778003
NBA: Nikola Jokic sets career high for rebounds in Denver Nuggets win,2023,https://www.bbc.co.uk/sport/basketball/64023967,P.J. Washington,0.2039848484848485,0.006883636942005422
Super Bowl 2023: Patrick Mahomes and Jalen Hurts making NFL history in Arizona,2023,https://www.bbc.co.uk/sport/american-football/64549158,P.J. Washington,0.1788398756631839,0.00778046690219018
NFL week 13: San Francisco 49ers beat Miami Dolphins while Deshaun Watson wins on return from suspension,2023,https://www.bbc.co.uk/sport/american-football/63855156,P.J. Washington,0.0954148199683913,0.010729714402430418
NFL week seven review: Tom Brady & Aaron Rodgers both lose and Chiefs beat 49ers,2023,https://www.bbc.co.uk/sport/american-football/63369025,P.J. Washington,0.0935811032401941,0.010941412763233349
World Baseball Classic: Great Britain to make historic debut against USA,2023,https://www.bbc.co.uk/sport/baseball/64880237,P.J. Washington,0.156074384720218,0.002015232174690667
"NFL: Tom Brady breaks 100,000-yard mark as Tampa Bay Buccaneers beat LA Rams",2023,https://www.bbc.co.uk/sport/american-football/63538136,P.J. Washington,0.0765265697605147,0.005573274486562574
"NFL: Jaguars stun Cowboys in overtime, Chiefs make play-offs & Tom Brady blows lead",2023,https://www.bbc.co.uk/sport/american-football/64022849,P.J. Washington,0.1247225954122505,0.006138005059160843
NFL week 12 review & results: Aaron Rodgers hurt as Eagles beat Packers while Chiefs beat Rams,2023,https://www.bbc.co.uk/sport/american-football/63777983,P.J. Washington,0.1556811375207601,0.0018132752575141843
NBA: Los Angeles Lakers continue losing start with defeat by LA Clippers,2023,https://www.bbc.co.uk/sport/basketball/63341374,Kawhi Leonard,0.3214285714285714,0.02750083800588486
NBA: Sacramento Kings beat LA Clippers in 'crazy' 176-175 history-making game,2023,https://www.bbc.co.uk/sport/basketball/64769116,Kawhi Leonard,0.0563492063492063,0.017296180689051144
NBA: Golden State Warriors v LA Lakers & other key talking points for new season,2023,https://www.bbc.co.uk/sport/basketball/63287260,Kawhi Leonard,0.1064141414141414,0.013875117362277069
NBA: Nikola Jokic sets career high for rebounds in Denver Nuggets win,2023,https://www.bbc.co.uk/sport/basketball/64023967,Aaron Gordon,0.2039848484848485,0.015391754817947686
"Scottish Gossip: Rangers, Jack, Cantwell, Celtic, Mooy, Starfelt, Hearts, St Johnstone",2023,https://www.bbc.co.uk/sport/football/64931096,Aaron Gordon,0.134280303030303,0.016661849898464882
"Newscast: Tinker, Tailor, Soldier, Balloon",2023,https://www.bbc.co.uk/programmes/p0f0yx2l,Aaron Gordon,0.0,0.0
Super Bowl 57: Patrick Mahomes wins second title to show he's Tom Brady's NFL successor,2023,https://www.bbc.co.uk/sport/american-football/64623240,Aaron Gordon,0.1739121306744257,0.008609873146184128
Euro 2024 qualifiers: Scotland squad for matches with Cyprus & Spain,2023,https://www.bbc.co.uk/sport/football/64938719,Aaron Gordon,0.0914795918367347,0.01425949540295683
NFL week 10: Minnesota Vikings stun Buffalo Bills plus more magic from Mahomes,2023,https://www.bbc.co.uk/sport/american-football/63618573,Aaron Gordon,0.1424561945990518,0.00868704384058473
Scott McKenna: Scotland defender doubtful for start of Euro qualifying,2023,https://www.bbc.co.uk/sport/football/64668544,Aaron Gordon,-0.025,0.02276778607261594
Leyton Orient 1-0 Crawley Town,2023,https://www.bbc.co.uk/sport/football/64607067,Aaron Gordon,0.1074244751664106,0.009268565962323238
NFL week 13: San Francisco 49ers beat Miami Dolphins while Deshaun Watson wins on return from suspension,2023,https://www.bbc.co.uk/sport/american-football/63855156,Aaron Gordon,0.0954148199683913,0.010729714402430418
"NFL week eight review: MVP shouts for Josh Allen as Buffalo Bills beat Packers, Eagles go 7-0",2023,https://www.bbc.co.uk/sport/american-football/63452643,Aaron Gordon,0.1804866627439443,0.005889355663712499
Aaron Rodgers: Green Bay Packers quarterback says he intends to join New York Jets,2023,https://www.bbc.co.uk/sport/american-football/64929406,Aaron Gordon,0.1054625569235958,0.002321150421052894
Nikola Jokic achieves 79th career triple-double to move above Wilt Chamberlain on the all-time list,2023,https://www.bbc.co.uk/sport/basketball/63511616,Aaron Gordon,0.2192307692307692,0.020460688677107205
"NFL play-offs: Patrick Mahomes, Josh Allen and Tom Brady aim for Super Bowl 57",2023,https://www.bbc.co.uk/sport/american-football/64233581,Aaron Gordon,0.0964555293191656,0.006722701829529507
Scotland: Steve Clarke disappointed with Celtic not releasing players,2023,https://www.bbc.co.uk/sport/football/63569441,Aaron Gordon,-0.0542207792207792,0.007907423209059072
Question marks and potential answers as Scotland target Germany 2024,2023,https://www.bbc.co.uk/sport/football/63664995,Aaron Gordon,0.1262894107414655,0.0071874600482423785
"Irish Premiership: Larne beat Cliftonville as Linfield, Crusaders and Portadown win",2023,https://www.bbc.co.uk/sport/football/64685477,Aaron Gordon,0.0657221242406427,0.00346612029164375
NBA: Luka Doncic inspires Dallas Mavericks to Christmas Day win over Los Angeles Lakers,2023,https://www.bbc.co.uk/sport/basketball/64093917,Aaron Gordon,0.1617079889807162,0.0047675621345752905
NFL week seven review: Tom Brady & Aaron Rodgers both lose and Chiefs beat 49ers,2023,https://www.bbc.co.uk/sport/american-football/63369025,Aaron Gordon,0.0935811032401941,0.004747075257281758
"NFL: Tom Brady breaks 100,000-yard mark as Tampa Bay Buccaneers beat LA Rams",2023,https://www.bbc.co.uk/sport/american-football/63538136,Aaron Gordon,0.0765265697605147,0.0
"Scottish Premiership team news, stats & selectors",2023,https://www.bbc.co.uk/sport/football/64856307,Aaron Gordon,0.0388888888888888,0.00175750127656449
NFL week 12 review & results: Aaron Rodgers hurt as Eagles beat Packers while Chiefs beat Rams,2023,https://www.bbc.co.uk/sport/american-football/63777983,Aaron Gordon,0.1556811375207601,0.0018132752575141843
"Tuesday's transfer gossip: Rice, Bellingham, Elanga, Dumfries Raphinha, Ziyech, Nkunku, Keita, Saliba",2023,https://www.bbc.co.uk/sport/64253569,Aaron Gordon,0.1824050024050024,0.0034716623331106336
NBA: Dallas Mavericks stars Luka Doncic and Kyrie Irving combine for second win together,2023,https://www.bbc.co.uk/sport/basketball/64833608,Tobias Harris,0.1416112657184086,0.009268565962323254
Under-20 Six Nations: Wales 21-37 England,2023,https://www.bbc.co.uk/sport/rugby-union/64736011,Tobias Harris,0.1265079365079364,0.009793011607367301
In pictures: Yorkshire and Lincolnshire 2022,2023,https://www.bbc.co.uk/news/uk-england-leeds-64116640,Tobias Harris,0.0,0.0
World Baseball Classic: Great Britain to make historic debut against USA,2023,https://www.bbc.co.uk/sport/baseball/64880237,Tobias Harris,0.156074384720218,0.0
"NFL divisional round play-offs: Injured Mahomes leads Chiefs over Jaguars, Eagles dominate Giants",2023,https://www.bbc.co.uk/sport/american-football/64362953,Tobias Harris,0.0827472226568612,0.002142498732765443
NBA: Kevin Durant traded to Phoenix Suns as Russell Westbrook joins Utah Jazz,2023,https://www.bbc.co.uk/sport/basketball/64593463,D'Angelo Russell,0.0884722222222222,0.013939838887819895
Kyrie Irving: Dallas Mavericks guard scores 24 points in debut win,2023,https://www.bbc.co.uk/sport/basketball/64579610,D'Angelo Russell,0.1592613636363636,0.021488958062410368
NBA: Zion Williamson scores 43 points as Pelicans beat Timberwolves,2023,https://www.bbc.co.uk/sport/basketball/64114841,D'Angelo Russell,0.1515151515151515,0.019216611636442435
NBA on the BBC: The big questions as NBA returns after All-Star break,2023,https://www.bbc.co.uk/sport/basketball/64722489,D'Angelo Russell,0.0630533543669136,0.0026758638644327824
LeBron James breaks NBA all-time scoring record,2023,https://www.bbc.co.uk/sport/basketball/64563131,D'Angelo Russell,0.1825086125086125,0.01092882749343662
Super Bowl 2023: Patrick Mahomes and Jalen Hurts making NFL history in Arizona,2023,https://www.bbc.co.uk/sport/american-football/64549158,D'Angelo Russell,0.1788398756631839,0.0058326485923160375
"NFL play-offs: Patrick Mahomes, Josh Allen and Tom Brady aim for Super Bowl 57",2023,https://www.bbc.co.uk/sport/american-football/64233581,D'Angelo Russell,0.0964555293191656,0.006722701829529507
NFL London: Russell Wilson under scrutiny as Denver Broncos face Jacksonville Jaguars,2023,https://www.bbc.co.uk/sport/american-football/63441203,D'Angelo Russell,0.1107524828113063,0.004594066615539929
NFL week seven review: Tom Brady & Aaron Rodgers both lose and Chiefs beat 49ers,2023,https://www.bbc.co.uk/sport/american-football/63369025,D'Angelo Russell,0.0935811032401941,0.004747075257281759
"NFL: Jaguars stun Cowboys in overtime, Chiefs make play-offs & Tom Brady blows lead",2023,https://www.bbc.co.uk/sport/american-football/64022849,D'Angelo Russell,0.1247225954122505,0.004090010693154795
NFL week 14: Eagles make play-offs & rookie Brock Purdy beats Tom Brady,2023,https://www.bbc.co.uk/sport/american-football/63939620,D'Angelo Russell,0.1955689814194968,0.004153104015151214
NFL week 12 review & results: Aaron Rodgers hurt as Eagles beat Packers while Chiefs beat Rams,2023,https://www.bbc.co.uk/sport/american-football/63777983,D'Angelo Russell,0.1556811375207601,0.0018132752575141843
NBA: Mikal Bridges leads Brooklyn Nets to huge comeback win over Boston Celtics,2023,https://www.bbc.co.uk/sport/av/basketball/64847824,Mikal Bridges,0.6000000000000001,0.23246787325868903
NBA: Brooklyn Nets stun Boston Celtics 115-105 in biggest comeback win this season,2023,https://www.bbc.co.uk/sport/basketball/64846501,Mikal Bridges,0.2053030303030302,0.017462382627084157
NBA: Kevin Durant traded to Phoenix Suns as Russell Westbrook joins Utah Jazz,2023,https://www.bbc.co.uk/sport/basketball/64593463,Mikal Bridges,0.0884722222222222,0.013939838887819895
Kyrie Irving: Dallas Mavericks guard scores 24 points in debut win,2023,https://www.bbc.co.uk/sport/basketball/64579610,Mikal Bridges,0.1592613636363636,0.014301577924269051
NBA: Miami Heat set free-throw record in 112-111 win over Oklahoma City Thunder,2023,https://www.bbc.co.uk/sport/basketball/64233233,Mikal Bridges,0.2002430555555555,0.01285945060007805
"NBA: Brooklyn Nets find 'solace' in wins after tumultuous week, says Kevin Durant",2023,https://www.bbc.co.uk/sport/basketball/63532635,Kelly Oubre Jr.,0.089537037037037,0.0164801289905115
Cam Thomas: Brooklyn Nets guard fined for 'derogatory language' in live TV interview,2023,https://www.bbc.co.uk/sport/basketball/64606067,Spencer Dinwiddie,0.1619146005509642,0.02487108857826069
World Baseball Classic: Great Britain to make historic debut against USA,2023,https://www.bbc.co.uk/sport/baseball/64880237,Spencer Dinwiddie,0.156074384720218,0.012123855994892883
NBA: Kyrie Irving can make Dallas Mavericks title contenders - Jason Kidd,2023,https://www.bbc.co.uk/sport/basketball/64551113,Spencer Dinwiddie,0.1579545454545454,0.012997410502706192
LeBron James breaks NBA all-time scoring record,2023,https://www.bbc.co.uk/sport/basketball/64563131,Kevin Porter Jr.,0.1825086125086125,0.011168701390815473
NBA: Memphis Grizzlies lose to in-form LA Lakers in second game without Ja Morant,2023,https://www.bbc.co.uk/sport/basketball/64885558,Dillon Brooks,0.1226430976430976,0.020289359152183824
Kevin Durant: Phoenix Suns forward out for three weeks after missing home debut with warm-up injury,2023,https://www.bbc.co.uk/sport/basketball/64912266,Dillon Brooks,0.1091379634857895,0.01438649255306405
"NFL: Jaguars stun Cowboys in overtime, Chiefs make play-offs & Tom Brady blows lead",2023,https://www.bbc.co.uk/sport/american-football/64022849,Dillon Brooks,0.1247225954122505,0.0040900106931547955
NBA: Mac McClung stuns crowd with perfect slam dunks at All-Star Weekend,2023,https://www.bbc.co.uk/sport/av/basketball/64696407,Trey Murphy III,1.0,0.0
NBA: Klay Thompson ejected in Phoenix Suns win over Golden State Warriors,2023,https://www.bbc.co.uk/sport/basketball/63397347,Trey Murphy III,0.1150285320739866,0.01056665256775145
Luka Doncic: Dallas Mavericks point guard scores 10th triple-double of the season,2023,https://www.bbc.co.uk/sport/basketball/64259791,Tim Hardaway Jr.,0.082253086419753,0.015915007029400817
"NFL week eight review: MVP shouts for Josh Allen as Buffalo Bills beat Packers, Eagles go 7-0",2023,https://www.bbc.co.uk/sport/american-football/63452643,Jarrett Allen,0.1804866627439443,0.007856146729764448
NFL week 10: Minnesota Vikings stun Buffalo Bills plus more magic from Mahomes,2023,https://www.bbc.co.uk/sport/american-football/63618573,Jarrett Allen,0.1424561945990518,0.017410102429774938
Arts & Ideas: Gwendolyn Brooks,2023,https://www.bbc.co.uk/programmes/p0f1ly5z,Jarrett Allen,0.0,0.0
Free Thinking: Gwendolyn Brooks,2023,https://www.bbc.co.uk/programmes/m001hpgm,Jarrett Allen,0.4,0.0
Super Bowl 57: Patrick Mahomes wins second title to show he's Tom Brady's NFL successor,2023,https://www.bbc.co.uk/sport/american-football/64623240,Jarrett Allen,0.1739121306744257,0.008609873146184128
"NFL play-offs: Patrick Mahomes, Josh Allen and Tom Brady aim for Super Bowl 57",2023,https://www.bbc.co.uk/sport/american-football/64233581,Jarrett Allen,0.0964555293191656,0.006722701829529507
"NFL: Tom Brady breaks 100,000-yard mark as Tampa Bay Buccaneers beat LA Rams",2023,https://www.bbc.co.uk/sport/american-football/63538136,Jarrett Allen,0.0765265697605147,0.005573274486562574
NBA: Giannis Antetokounmpo leads Milwaukee Bucks to win on injury return,2023,https://www.bbc.co.uk/sport/basketball/64948897,Jabari Smith Jr.,0.0838888888888888,0.02301918968721679
NBA: Kyrie Irving 'requests trade from Brooklyn Nets',2023,https://www.bbc.co.uk/sport/basketball/64521840,Jaden McDaniels,0.0740530303030303,0.009675693977238985
NBA: Kevin Durant scores 23 points on Phoenix Suns debut in win at Charlotte Hornets,2023,https://www.bbc.co.uk/sport/basketball/64820742,LaMelo Ball,0.1631146631146631,0.015656976113009837
LeBron James breaks NBA all-time scoring record,2023,https://www.bbc.co.uk/sport/basketball/64563131,LaMelo Ball,0.1825086125086125,0.01092882749343662
Super Bowl 57: Patrick Mahomes wins second title to show he's Tom Brady's NFL successor,2023,https://www.bbc.co.uk/sport/american-football/64623240,LaMelo Ball,0.1739121306744257,0.010336086058040286
NBA: Los Angeles Lakers continue losing start with defeat by LA Clippers,2023,https://www.bbc.co.uk/sport/basketball/63341374,LaMelo Ball,0.3214285714285714,0.007109017367538334
NFL week 10: Minnesota Vikings stun Buffalo Bills plus more magic from Mahomes,2023,https://www.bbc.co.uk/sport/american-football/63618573,LaMelo Ball,0.1424561945990518,0.005835306988978069
Tom Brady retires 'for good' after 23 seasons in NFL,2023,https://www.bbc.co.uk/sport/american-football/64487463,LaMelo Ball,0.1553198537573538,0.004986547441011381
Nigeria polo: The Kent University student with a mission,2023,https://www.bbc.co.uk/news/world-africa-64903233,LaMelo Ball,0.0,0.0
"NFL play-offs: Patrick Mahomes, Josh Allen and Tom Brady aim for Super Bowl 57",2023,https://www.bbc.co.uk/sport/american-football/64233581,LaMelo Ball,0.0964555293191656,0.006722701829529507
Aaron Rodgers: Green Bay Packers quarterback says he intends to join New York Jets,2023,https://www.bbc.co.uk/sport/american-football/64929406,LaMelo Ball,0.1054625569235958,0.005183776551119796
"NFL: Tom Brady breaks 100,000-yard mark as Tampa Bay Buccaneers beat LA Rams",2023,https://www.bbc.co.uk/sport/american-football/63538136,LaMelo Ball,0.0765265697605147,0.007434321449491329
World Baseball Classic: Great Britain to make historic debut against USA,2023,https://www.bbc.co.uk/sport/baseball/64880237,LaMelo Ball,0.156074384720218,0.0
Pakistan v England: Why Will Jacks should fit perfectly into Ben Stokes' team,2023,https://www.bbc.co.uk/sport/cricket/63201385,LaMelo Ball,0.1581755050505049,0.01056134868026918
"NFL divisional round play-offs: Injured Mahomes leads Chiefs over Jaguars, Eagles dominate Giants",2023,https://www.bbc.co.uk/sport/american-football/64362953,LaMelo Ball,0.0827472226568612,0.00478457019809508
NFL play-offs: Remarkable rise of San Francisco 49ers' 'Mr Irrelevant' Brock Purdy,2023,https://www.bbc.co.uk/sport/american-football/64348673,LaMelo Ball,0.1655313051146385,0.003943563973489212
NBA: Chicago Bulls end Boston Celtics' nine-game winning streak,2023,https://www.bbc.co.uk/sport/basketball/63713182,Brandon Ingram,0.1553719008264463,0.00843458972046208
NBA: Klay Thompson ejected in Phoenix Suns win over Golden State Warriors,2023,https://www.bbc.co.uk/sport/basketball/63397347,Brandon Ingram,0.1150285320739866,0.012928062507207306
NBA: Los Angeles Lakers beaten by Portland Trail Blazers as losing start continues,2023,https://www.bbc.co.uk/sport/basketball/63370829,Brandon Ingram,0.0082491582491582,0.012089512047525069
NBA: Zion Williamson returns as New Orleans Pelicans win season opener,2023,https://www.bbc.co.uk/sport/basketball/63325545,Brandon Ingram,0.0682416267942583,0.005814471612004942
Kyrie Irving: Nike suspend sponsorship deal with Brooklyn Nets player,2023,https://www.bbc.co.uk/sport/basketball/63525097,Brandon Ingram,0.1093344155844155,0.0
"Loose Ends: Includes Cerys Matthews, Brian Bilston, Imelda May, Luke Wright, Polarbear, Salena Godden, Judy Collins and John Shuttleworth",2023,https://www.bbc.co.uk/programmes/m001ghnm,John Collins,-0.0769230769230769,0.13906986061241056
"The Scene with Kim Davis and Raffaella Coleman: MERON T,JOHNELL YOUNG,LIAM JAMES COLLINS",2023,https://www.bbc.co.uk/programmes/p0dyfrbm,John Collins,0.0,0.11178786424086445
Andy Collins: Will you read Boris Johnson's book?,2023,https://www.bbc.co.uk/programmes/p0dt0c35,John Collins,0.0,0.1900774225287333
"Classical Connections: Celebrations, Siblings and Singing out of Tune!",2023,https://www.bbc.co.uk/programmes/m001j3v2,John Collins,0.0,0.0
NBA: Eleven Orlando Magic & Detroit Pistons players suspended after scuffle,2023,https://www.bbc.co.uk/sport/basketball/64124245,Wendell Carter Jr.,0.1034902597402597,0.01631461144387159
NBA: Zion Williamson scores 43 points as Pelicans beat Timberwolves,2023,https://www.bbc.co.uk/sport/basketball/64114841,Zion Williamson,0.1515151515151515,0.005722524555138474
NBA: Zion Williamson returns as New Orleans Pelicans win season opener,2023,https://www.bbc.co.uk/sport/basketball/63325545,Zion Williamson,0.0682416267942583,0.011646939147508124
NBA: Golden State Warriors v LA Lakers & other key talking points for new season,2023,https://www.bbc.co.uk/sport/basketball/63287260,Zion Williamson,0.1064141414141414,0.01109372556740151
NBA: Kyrie Irving scores 33 points as Brooklyn Nets beat Charlotte Hornets,2023,https://www.bbc.co.uk/sport/basketball/63899643,Zion Williamson,0.2189118457300275,0.010997995914282823
NBA: Los Angeles Lakers beaten by Portland Trail Blazers as losing start continues,2023,https://www.bbc.co.uk/sport/basketball/63370829,Zion Williamson,0.0082491582491582,0.018160408423583962
NBA: Klay Thompson ejected in Phoenix Suns win over Golden State Warriors,2023,https://www.bbc.co.uk/sport/basketball/63397347,Zion Williamson,0.1150285320739866,0.012928062507207306
NBA round-up: Dennis Schroder leads LA Lakers to late victory over Memphis Grizzlies,2023,https://www.bbc.co.uk/sport/basketball/64357720,Dennis Schröder,0.0656784188034188,0.00946399172120473
NBA: LA Lakers rally to topple Golden State Warriors despite LeBron James absence,2023,https://www.bbc.co.uk/sport/basketball/64615897,Dennis Schröder,0.1351239669421487,0.0
NBA: Golden State Warriors lose to Detroit Pistons after late three-pointer,2023,https://www.bbc.co.uk/sport/basketball/64172182,Dennis Schröder,-0.0105842911877394,0.012859450600078046
Bellator 292: Britons Michael 'MVP' Page and Linton Vassell earn stunning knockouts,2023,https://www.bbc.co.uk/sport/mixed-martial-arts/64924283,Devin Vassell,0.1452457264957264,0.027569301191678643
Bellator 292: Britain's Linton Vassell stops Valentin Moldavsky with TKO,2023,https://www.bbc.co.uk/sport/av/mixed-martial-arts/64924373,Devin Vassell,0.0,0.12462006977989486
Bellator 292: Michael 'Venom' Page beats Goiti Yamauchi after just 26 seconds,2023,https://www.bbc.co.uk/sport/av/mixed-martial-arts/64924371,Devin Vassell,0.0,0.0
Bellator 292: 'This tournament will crown the best lightweight on the planet' - Scott Coker,2023,https://www.bbc.co.uk/sport/mixed-martial-arts/64901767,Devin Vassell,0.2731209611644395,0.009015662230847247
Boxing and Bellator 292 MMA: BBC coverage and schedule,2023,https://www.bbc.co.uk/sport/boxing/64891365,Devin Vassell,0.1779430247172182,0.017133112648025466
NBA: Kevin Durant scores 23 points on Phoenix Suns debut in win at Charlotte Hornets,2023,https://www.bbc.co.uk/sport/basketball/64820742,Devin Vassell,0.1631146631146631,0.015656976113009837
Bellator 292: Michael 'Venom' Page to face Goiti Yamauchi,2023,https://www.bbc.co.uk/sport/mixed-martial-arts/64363294,Devin Vassell,0.2623333333333333,0.018436774145678337
NBA: Kevin Durant traded to Phoenix Suns as Russell Westbrook joins Utah Jazz,2023,https://www.bbc.co.uk/sport/basketball/64593463,Devin Vassell,0.0884722222222222,0.008065348989218934
FA Cup & Premier League predictions: Chris Sutton faces Paul Olima and Adele Nicoll from Go Hard or Go Home,2023,https://www.bbc.co.uk/sport/football/64720424,Chris Paul,0.2108367222003584,0.004845163885473478
Paula's Hamely Christmas Supper,2023,https://www.bbc.co.uk/programmes/m001g8p8,Chris Paul,0.0,0.0
"SAG Awards: Zendaya, Paul Mescal and Christina Applegate among stars on red carpet",2023,https://www.bbc.co.uk/news/entertainment-arts-64781316,Chris Paul,0.0,0.10135162484519329
Cooking with Paula McIntyre: Christmas Cake,2023,https://www.bbc.co.uk/programmes/p0djzsjd,Chris Paul,0.0,0.0
The John Toal Show: Captain Matt Neill; Lonesome George; Let Them Lie; Psychology of Christmas; Chef Paula McIntyre,2023,https://www.bbc.co.uk/programmes/m001g1y5,Chris Paul,0.0,0.0
Paula White: Christmas Eve (24/12/2022),2023,https://www.bbc.co.uk/programmes/p0dmx308,Chris Paul,0.0,0.0
Paul Shuttleworth: Christmas Day (25/12/2022),2023,https://www.bbc.co.uk/programmes/p0dmwnrp,Chris Paul,0.0,0.23042064448714697
Paul Shuttleworth: Christmas Eve (24/12/2022),2023,https://www.bbc.co.uk/programmes/p0dmwldg,Chris Paul,0.0,0.23042064448714697
Paulette Edwards: Christmas Day (25/12/2022),2023,https://www.bbc.co.uk/programmes/p0dm3sh9,Chris Paul,0.0,0.0
Paula White: 100yr old penpals; tips for a creative thrifty Christmas and a Senegal factbox for footy fans,2023,https://www.bbc.co.uk/programmes/p0dg3mm3,Chris Paul,0.1999999999999999,0.0
"The Ticket: Paddy Anderson, Paul Currie, Calla Hughes, Christina Nelson & Michael Cameron",2023,https://www.bbc.co.uk/programmes/m001fmrf,Chris Paul,0.0,0.10135162484519329
Paul Shuttleworth: Paul is live from 10am in Oswestry Square for the Christmas Parade (03/12/2022),2023,https://www.bbc.co.uk/programmes/p0dg2xjb,Chris Paul,-0.0568181818181818,0.23042064448714697
Paul Shuttleworth: Live from Oakengates Theatre Square ahead of the Christmas Lights Switch on (6/11/2022),2023,https://www.bbc.co.uk/programmes/p0dcbl1d,Chris Paul,0.1363636363636363,0.10135162484519329
Rugby Union Weekly: France run riot at Twickenham,2023,https://www.bbc.co.uk/programmes/p0f87z68,Chris Paul,0.0,0.0
Debate Night: Series 4: 08/03/2023,2023,https://www.bbc.co.uk/programmes/m001jxyx,Chris Paul,0.0,0.0
Rams Daily: A Derby County Podcast: The Rams head coach previews Morecambe & reflects on the transfer window,2023,https://www.bbc.co.uk/programmes/p0f0q3vg,Chris Paul,0.0,0.0
Rugby Union Weekly: England booed off after Springboks defeat,2023,https://www.bbc.co.uk/programmes/p0dk1kzw,Chris Paul,0.0,0.0
Rugby Union Weekly: Wiggy and a Christmas cracker,2023,https://www.bbc.co.uk/programmes/p0drlhxn,Chris Paul,0.0,0.0
Chris Baxter: Chris Baxter's Late Show,2023,https://www.bbc.co.uk/programmes/p0dstb09,Chris Paul,-0.3,0.40037819166890176
Rugby Union Weekly: Argentina stun England at Twickenham,2023,https://www.bbc.co.uk/programmes/p0dd81sp,Chris Paul,0.0,0.0
FC Isle of Man: Ravens sack manager Chris Bass after poor run,2023,https://www.bbc.co.uk/sport/football/63545135,Chris Paul,0.0404298941798941,0.02255584093441085
606: Twas the night before the World Cup Final,2023,https://www.bbc.co.uk/programmes/m001g8ys,Chris Paul,0.0,0.0
NBA: Nikola Jokic sets career high for rebounds in Denver Nuggets win,2023,https://www.bbc.co.uk/sport/basketball/64023967,Gordon Hayward,0.2039848484848485,0.006883636942005422
