title,date,url,player,textblob_sentiment,relevance_score
NFL week 13: San Francisco 49ers beat Miami Dolphins while Deshaun Watson wins on return from suspension,2023,https://www.bbc.co.uk/sport/american-football/63855156,Tyler Herro,0.0954148199683913,0.008579387411509532
"NFL play-offs: Patrick Mahomes, Josh Allen and Tom Brady aim for Super Bowl 57",2023,https://www.bbc.co.uk/sport/american-football/64233581,Tyler Herro,0.0964555293191656,0.006722701829529507
NFL week 14: Eagles make play-offs & rookie Brock Purdy beats Tom Brady,2023,https://www.bbc.co.uk/sport/american-football/63939620,Tyler Herro,0.1955689814194968,0.004153104015151214
Anthony Davis scores 55 points as Los Angeles Lakers beat Washington Wizards 130-119,2023,https://www.bbc.co.uk/sport/av/basketball/63858982,Anthony Davis,0.0,0.2121170426507163
NBA: Los Angeles Lakers win as LeBron James and Anthony Davis star,2023,https://www.bbc.co.uk/sport/basketball/63453775,Anthony Davis,0.1636363636363636,0.019318754566700604
Morriston house blast pair 'so lucky to come out of it',2023,https://www.bbc.co.uk/news/uk-wales-64956264,Anthony Davis,0.3333333333333333,0.0
NBA All-Star Game: Team Giannis beats Team LeBron as Jayson Tatum scores record 55 points,2023,https://www.bbc.co.uk/sport/basketball/64701884,Anthony Davis,0.0767339544513457,0.022477436282507163
NBA: Los Angeles Lakers continue losing start with defeat by LA Clippers,2023,https://www.bbc.co.uk/sport/basketball/63341374,Anthony Davis,0.3214285714285714,0.02750083800588486
Troi'r Tir: CFfI Uwchaled yn ennill gwobr Ysbryd y Gymuned,2023,https://www.bbc.co.uk/programmes/m001js30,Anthony Davis,0.0,0.0
Swansea: Man named as Morriston explosion victim,2023,https://www.bbc.co.uk/news/uk-wales-64950915,Anthony Davis,-0.075,0.0
Eleri Sion: 10/02/2023,2023,https://www.bbc.co.uk/programmes/m001hvbr,Anthony Davis,0.0,0.0
Diego Pacheco stops Jack Cullen in fourth round of super-middleweight contest,2023,https://www.bbc.co.uk/sport/boxing/64928977,Anthony Davis,0.11610582010582,0.0032146632193372202
NBA: Joel Embiid scores 38 points as Philadelphia 76ers beat Cleveland Cavaliers,2023,https://www.bbc.co.uk/sport/basketball/64974061,Anthony Davis,0.2004464285714285,0.007883355415817025
NBA: Milwaukee Bucks beat Phoenix Suns to become first team to clinch play-off place,2023,https://www.bbc.co.uk/sport/basketball/64961517,Anthony Davis,0.1592697157914549,0.007607156407297912
Anthony Hughes: Tributes after unexpected death of Paralympic coach,2023,https://www.bbc.co.uk/sport/wales/64146578,Anthony Davis,0.1246880570409981,0.0065910923644586054
LA Lakers beat Denver Nuggets 121-110 to claim first win of season,2023,https://www.bbc.co.uk/sport/av/basketball/63456003,Anthony Davis,0.525,0.0
Rangers' road to the final,2023,https://www.bbc.com/sport/articles/c3g37ez3k30o,Anthony Davis,0.0,0.0
"Walescast: ""Fighting off a lion with a celery stick""",2023,https://www.bbc.co.uk/programmes/p0f24k0d,Anthony Davis,0.0,0.0
NBA: LA Lakers rally to topple Golden State Warriors despite LeBron James absence,2023,https://www.bbc.co.uk/sport/basketball/64615897,Anthony Davis,0.1351239669421487,0.008775487258642736
World Cup 2022: Canada name Alphonso Davies in World Cup squad,2023,https://www.bbc.co.uk/sport/football/63614785,Anthony Davis,-0.09375,0.0
Anthony Yarde: Briton's world title shot against Artur Beterbiev hinges on beating Stefani Koykov,2023,https://www.bbc.co.uk/sport/boxing/63668724,Anthony Davis,0.1101190476190476,0.0
Ex-West Midlands Police officer accused of misusing police systems,2023,https://www.bbc.co.uk/news/uk-england-birmingham-64416177,Anthony Davis,0.0,0.0
LeBron James' LA Lakers accuse NBA of cheating after 'gut-wrenching' referee error,2023,https://www.bbc.co.uk/sport/basketball/64450359,Anthony Davis,-0.032161753590325,0.020871936305857562
European Challenge Cup: Lions 31-31 Dragons - Late misses round off dramatic draw,2023,https://www.bbc.co.uk/sport/rugby-union/63873009,Anthony Davis,0.0946150097465887,0.004365012186098296
Fight Talk: Chris Eubank Jr trolls Liam Smith with Manchester billboard,2023,https://www.bbc.co.uk/sport/boxing/64296519,Anthony Davis,0.1016666666666666,0.01605465176140404
NBA: Milwaukee Bucks beat Phoenix Suns to become first team to clinch play-off place,2023,https://www.bbc.co.uk/sport/basketball/64961517,Fred VanVleet,0.1592697157914549,0.017012815289688305
NBA: Kyrie Irving buzzer-beater gives Brooklyn Nets win at Toronto Raptors,2023,https://www.bbc.co.uk/sport/basketball/64010284,Fred VanVleet,0.2775,0.01024864883460691
NBA: LeBron James scores first triple-double of season to move close to all-time scoring record,2023,https://www.bbc.co.uk/sport/basketball/64481152,Jamal Murray,0.106060606060606,0.017892205736970448
Judy Murray's Saudi role branded 'sportswashing',2023,https://www.bbc.co.uk/news/uk-scotland-63819000,Jamal Murray,0.0,0.0
Nikola Jokic achieves 79th career triple-double to move above Wilt Chamberlain on the all-time list,2023,https://www.bbc.co.uk/sport/basketball/63511616,Jamal Murray,0.2192307692307692,0.020460688677107205
NFL week 10: Minnesota Vikings stun Buffalo Bills plus more magic from Mahomes,2023,https://www.bbc.co.uk/sport/american-football/63618573,Jamal Murray,0.1424561945990518,0.008687043840584737
NBA: Luka Doncic inspires Dallas Mavericks to Christmas Day win over Los Angeles Lakers,2023,https://www.bbc.co.uk/sport/basketball/64093917,Jamal Murray,0.1617079889807162,0.010654227130692513
NFL week 14: Eagles make play-offs & rookie Brock Purdy beats Tom Brady,2023,https://www.bbc.co.uk/sport/american-football/63939620,Jamal Murray,0.1955689814194968,0.004153104015151214
Kevin Durant: Phoenix Suns forward out for three weeks after missing home debut with warm-up injury,2023,https://www.bbc.co.uk/sport/basketball/64912266,Kevin Durant,0.1091379634857895,0.006434823419124198
NBA: Kevin Durant scores 23 points on Phoenix Suns debut in win at Charlotte Hornets,2023,https://www.bbc.co.uk/sport/basketball/64820742,Kevin Durant,0.1631146631146631,0.03143113804056529
NBA: Kevin Durant traded to Phoenix Suns as Russell Westbrook joins Utah Jazz,2023,https://www.bbc.co.uk/sport/basketball/64593463,Kevin Durant,0.0884722222222222,0.02327781446494847
"NBA: Brooklyn Nets find 'solace' in wins after tumultuous week, says Kevin Durant",2023,https://www.bbc.co.uk/sport/basketball/63532635,Kevin Durant,0.089537037037037,0.016521135999078954
Kevin Durant found out about Brooklyn Nets sacking Steve Nash on TV,2023,https://www.bbc.co.uk/sport/basketball/63482350,Kevin Durant,0.1112619047619047,0.018596483464605774
NBA: Kyrie Irving and Kevin Durant score high in Brooklyn Nets defeat at Memphis Grizzlies,2023,https://www.bbc.co.uk/sport/basketball/63383489,Kevin Durant,0.2637310606060606,0.01350449078319528
NBA: Brooklyn Nets beat New York Knicks 112-85 in Jacque Vaughn's first game as head coach,2023,https://www.bbc.co.uk/sport/basketball/63580568,Kevin Durant,0.0275974025974026,0.01026973110485433
NBA: Brooklyn Nets stun Boston Celtics 115-105 in biggest comeback win this season,2023,https://www.bbc.co.uk/sport/basketball/64846501,Kevin Durant,0.2053030303030302,0.023315494050248884
NBA: Ja Morant inspires Memphis Grizzlies win while Stephen Curry stars in Golden State Warriors loss,2023,https://www.bbc.co.uk/sport/basketball/63355733,Kevin Durant,0.1306998556998557,0.015391754817947686
NBA: Golden State Warriors v LA Lakers & other key talking points for new season,2023,https://www.bbc.co.uk/sport/basketball/63287260,Kevin Durant,0.1064141414141414,0.013875117362277069
NBA: Nikola Jokic sets career high for rebounds in Denver Nuggets win,2023,https://www.bbc.co.uk/sport/basketball/64023967,Kevin Durant,0.2039848484848485,0.015391754817947686
NBA: Dallas Mavericks stars Luka Doncic and Kyrie Irving combine for second win together,2023,https://www.bbc.co.uk/sport/basketball/64833608,Kevin Durant,0.1416112657184086,0.01602173027017214
NBA on the BBC: The big questions as NBA returns after All-Star break,2023,https://www.bbc.co.uk/sport/basketball/64722489,Kevin Durant,0.0630533543669136,0.010327006621118592
Kyrie Irving: Dallas Mavericks guard scores 24 points in debut win,2023,https://www.bbc.co.uk/sport/basketball/64579610,Kevin Durant,0.1592613636363636,0.021488958062410368
LeBron James breaks NBA all-time scoring record,2023,https://www.bbc.co.uk/sport/basketball/64563131,Kevin Durant,0.1825086125086125,0.014383119635881717
NBA: Stephen Curry inspires Golden State Warriors against Milwaukee Bucks,2023,https://www.bbc.co.uk/sport/basketball/64930824,Kevin Durant,0.1688311688311688,0.013580178836509272
NBA round-up: Dennis Schroder leads LA Lakers to late victory over Memphis Grizzlies,2023,https://www.bbc.co.uk/sport/basketball/64357720,Kevin Durant,0.0656784188034188,0.021175953465885834
NBA: Zion Williamson scores 43 points as Pelicans beat Timberwolves,2023,https://www.bbc.co.uk/sport/basketball/64114841,Kevin Durant,0.1515151515151515,0.019216611636442435
NBA: San Antonio Spurs beat Cleveland Cavaliers as Keldon Johnson blocks late shot,2023,https://www.bbc.co.uk/sport/basketball/63954218,Kevin Durant,0.1923076923076923,0.009805925161440061
NBA: Damien Lillard hits 42 points as Portland Trail Blazers beat Memphis Grizzlies,2023,https://www.bbc.co.uk/sport/basketball/64494837,Kevin Durant,0.1312499999999999,0.006551317864578551
NBA: Kyrie Irving buzzer-beater gives Brooklyn Nets win at Toronto Raptors,2023,https://www.bbc.co.uk/sport/basketball/64010284,Kevin Durant,0.2775,0.01024864883460691
NBA: Boston Celtics beat Miami Heat in front of Prince and Princess of Wales,2023,https://www.bbc.co.uk/sport/basketball/63818629,Kevin Durant,0.3702479338842975,0.007554222884432086
NBA: Brooklyn Nets fans wear 'Fight Anti-Semitism' T-shirts after Kyrie Irving tweet,2023,https://www.bbc.co.uk/sport/basketball/63467880,Kevin Durant,-0.0399184149184149,0.008567720323007571
Nikola Jokic scores 100th career triple-double as Denver Nuggets beat Houston Rockets,2023,https://www.bbc.co.uk/sport/basketball/64808299,Kevin Durant,0.2544456845238095,0.0095990314437469
NBA: Kyrie Irving helps Brooklyn Nets beat Memphis Grizzlies 127-115 on return from suspension,2023,https://www.bbc.co.uk/sport/basketball/63699344,Kevin Durant,0.2286096256684492,0.015793044146546763
Luka Doncic: Dallas Mavericks point guard scores 10th triple-double of the season,2023,https://www.bbc.co.uk/sport/basketball/64259791,Kevin Durant,0.082253086419753,0.011852953322266945
NBA: Kyrie Irving scores 33 points as Brooklyn Nets beat Charlotte Hornets,2023,https://www.bbc.co.uk/sport/basketball/63899643,Kevin Durant,0.2189118457300275,0.005490974065996314
Luka Doncic scores magical 60-point triple-double in Dallas Mavericks win,2023,https://www.bbc.co.uk/sport/basketball/64107654,Kevin Durant,0.2051156728576083,0.005752848750035873
NBA Slam Dunk Contest: Mac McClung signs for Philadelphia 76ers and 'saves' event,2023,https://www.bbc.co.uk/sport/basketball/64695886,Kevin Durant,0.1954793233082707,0.009753590897698573
NBA: Defending champions Golden State Warriors beat Boston Celtics in Finals rematch,2023,https://www.bbc.co.uk/sport/basketball/63933734,Kevin Durant,0.0985780423280423,0.011795253101883575
NBA: Zion Williamson returns as New Orleans Pelicans win season opener,2023,https://www.bbc.co.uk/sport/basketball/63325545,Kevin Durant,0.0682416267942583,0.012997410502706173
Kyrie Irving: Nike suspend sponsorship deal with Brooklyn Nets player,2023,https://www.bbc.co.uk/sport/basketball/63525097,Kevin Durant,0.1093344155844155,0.005127868453248009
"Scottish transfer gossip: Rangers, Celtic, Adams, Jenz, Postecoglou, Beale, McGarvey",2023,https://www.bbc.co.uk/sport/football/64142383,Bradley Beal,0.1222451790633608,0.003060596397540288
NBA on the BBC: The big questions as NBA returns after All-Star break,2023,https://www.bbc.co.uk/sport/basketball/64722489,Jrue Holiday,0.0630533543669136,0.01032700662111859
NBA: Sacramento Kings beat LA Clippers in 'crazy' 176-175 history-making game,2023,https://www.bbc.co.uk/sport/basketball/64769116,Jrue Holiday,0.0563492063492063,0.011514978317793119
NBA: LeBron James passes Magic Johnson on all-time assists list,2023,https://www.bbc.co.uk/sport/basketball/63844768,Jrue Holiday,0.0868421052631579,0.015490153091840304
NBA: Kyrie Irving scores 33 points as Brooklyn Nets beat Charlotte Hornets,2023,https://www.bbc.co.uk/sport/basketball/63899643,Jrue Holiday,0.2189118457300275,0.012273221813441258
Nigeria polo: The Kent University student with a mission,2023,https://www.bbc.co.uk/news/world-africa-64903233,Jrue Holiday,0.0,0.0
NBA: Los Angeles Lakers continue losing start with defeat by LA Clippers,2023,https://www.bbc.co.uk/sport/basketball/63341374,James Harden,0.3214285714285714,0.03673744900653507
NBA: Kevin Durant traded to Phoenix Suns as Russell Westbrook joins Utah Jazz,2023,https://www.bbc.co.uk/sport/basketball/64593463,James Harden,0.0884722222222222,0.027960304797714507
LeBron James breaks NBA all-time scoring record,2023,https://www.bbc.co.uk/sport/basketball/64563131,James Harden,0.1825086125086125,0.028218098525044644
NBA on the BBC: The big questions as NBA returns after All-Star break,2023,https://www.bbc.co.uk/sport/basketball/64722489,James Harden,0.0630533543669136,0.00897115522548973
LeBron James: LA Lakers player becomes NBA's all-time leading points scorer,2023,https://www.bbc.co.uk/newsround/64553059,James Harden,0.0,0.10135162484519329
NBA: Kevin Durant scores 23 points on Phoenix Suns debut in win at Charlotte Hornets,2023,https://www.bbc.co.uk/sport/basketball/64820742,James Harden,0.1631146631146631,0.015656976113009837
NBA: Golden State Warriors v LA Lakers & other key talking points for new season,2023,https://www.bbc.co.uk/sport/basketball/63287260,James Harden,0.1064141414141414,0.025032691039792346
NBA All-Star Game: Team Giannis beats Team LeBron as Jayson Tatum scores record 55 points,2023,https://www.bbc.co.uk/sport/basketball/64701884,James Harden,0.0767339544513457,0.026075525356694496
NBA: Kyrie Irving 'requests trade from Brooklyn Nets',2023,https://www.bbc.co.uk/sport/basketball/64521840,James Harden,0.0740530303030303,0.009675693977238985
Bellator 292: Michael 'Venom' Page to face Goiti Yamauchi,2023,https://www.bbc.co.uk/sport/mixed-martial-arts/64363294,James Harden,0.2623333333333333,0.018436774145678337
NBA: Kyrie Irving buzzer-beater gives Brooklyn Nets win at Toronto Raptors,2023,https://www.bbc.co.uk/sport/basketball/64010284,James Harden,0.2775,0.025715759938085867
NBA: Nikola Jokic sets career high for rebounds in Denver Nuggets win,2023,https://www.bbc.co.uk/sport/basketball/64023967,James Harden,0.2039848484848485,0.006883636942005422
NBA: Kyrie Irving and Kevin Durant score high in Brooklyn Nets defeat at Memphis Grizzlies,2023,https://www.bbc.co.uk/sport/basketball/63383489,James Harden,0.2637310606060606,0.013504490783195284
NBA: Damien Lillard hits 42 points as Portland Trail Blazers beat Memphis Grizzlies,2023,https://www.bbc.co.uk/sport/basketball/64494837,James Harden,0.1312499999999999,0.014647396256669457
NBA: Golden State Warriors lose to Detroit Pistons after late three-pointer,2023,https://www.bbc.co.uk/sport/basketball/64172182,James Harden,-0.0105842911877394,0.012859450600078046
The Repair Shop: Series 9: Episode 33,2023,https://www.bbc.co.uk/programmes/m001f0tt,James Harden,0.0,0.0
NBA: Luka Doncic inspires Dallas Mavericks to Christmas Day win over Los Angeles Lakers,2023,https://www.bbc.co.uk/sport/basketball/64093917,James Harden,0.1617079889807162,0.01600163917409912
NBA: Miami Heat set free-throw record in 112-111 win over Oklahoma City Thunder,2023,https://www.bbc.co.uk/sport/basketball/64233233,James Harden,0.2002430555555555,0.005752848750035898
Iran's Revolutionary Guards set to be labelled as terrorist group by UK,2023,https://www.bbc.co.uk/news/uk-64156965,James Harden,0.0,0.0
Stephen Curry injured as Golden State Warriors lose again,2023,https://www.bbc.co.uk/sport/basketball/63982850,Tyrese Haliburton,0.0890873015873015,0.017504433395499452
NBA: Kevin Durant traded to Phoenix Suns as Russell Westbrook joins Utah Jazz,2023,https://www.bbc.co.uk/sport/basketball/64593463,Deandre Ayton,0.0884722222222222,0.013939838887819895
NBA: Boston Celtics beat Miami Heat in front of Prince and Princess of Wales,2023,https://www.bbc.co.uk/sport/basketball/63818629,Deandre Ayton,0.3702479338842975,0.01689419544952494
NBA: Klay Thompson ejected in Phoenix Suns win over Golden State Warriors,2023,https://www.bbc.co.uk/sport/basketball/63397347,Deandre Ayton,0.1150285320739866,0.012928062507207306
NBA: Dallas Mavericks stars Luka Doncic and Kyrie Irving combine for second win together,2023,https://www.bbc.co.uk/sport/basketball/64833608,Kyrie Irving,0.1416112657184086,0.032150014982443076
Kyrie Irving: Dallas Mavericks guard scores 24 points in debut win,2023,https://www.bbc.co.uk/sport/basketball/64579610,Kyrie Irving,0.1592613636363636,0.0063969071723946405
"NBA: Stephen Curry ruled out indefinitely with knee injury, Kyrie Irving reportedly set for Dallas Mavericks trade",2023,https://www.bbc.co.uk/sport/basketball/64535246,Kyrie Irving,0.0503787878787878,0.02298375206215493
NBA: Kyrie Irving 'requests trade from Brooklyn Nets',2023,https://www.bbc.co.uk/sport/basketball/64521840,Kyrie Irving,0.0740530303030303,0.029161460011728698
Kyrie Irving scores 24 on Dallas Mavericks debut against LA Clippers,2023,https://www.bbc.co.uk/sport/av/basketball/64583448,Kyrie Irving,0.0,0.28766612059081087
NBA: Kyrie Irving can make Dallas Mavericks title contenders - Jason Kidd,2023,https://www.bbc.co.uk/sport/basketball/64551113,Kyrie Irving,0.1579545454545454,0.005814471612004974
NBA: Kyrie Irving buzzer-beater gives Brooklyn Nets win at Toronto Raptors,2023,https://www.bbc.co.uk/sport/basketball/64010284,Kyrie Irving,0.2775,0.02304381254007885
NBA: Kyrie Irving scores 33 points as Brooklyn Nets beat Charlotte Hornets,2023,https://www.bbc.co.uk/sport/basketball/63899643,Kyrie Irving,0.2189118457300275,0.005490974065996314
Kyrie Irving: Nike ends sponsorship deal with Brooklyn Nets guard after social media post,2023,https://www.bbc.co.uk/sport/basketball/63866184,Kyrie Irving,0.0208333333333333,0.06763853831572152
NBA: Kyrie Irving helps Brooklyn Nets beat Memphis Grizzlies 127-115 on return from suspension,2023,https://www.bbc.co.uk/sport/basketball/63699344,Kyrie Irving,0.2286096256684492,0.0070627682776093145
Kyrie Irving: Brooklyn Nets star apologises as anti-Semitism suspension ends,2023,https://www.bbc.co.uk/sport/basketball/63697302,Kyrie Irving,0.073,0.0385076337418021
Kyrie Irving: Nike suspend sponsorship deal with Brooklyn Nets player,2023,https://www.bbc.co.uk/sport/basketball/63525097,Kyrie Irving,0.1093344155844155,0.04038734703652532
Kyrie Irving: NBA commissioner to meet Brooklyn Nets guard after he shared anti-Semitic material,2023,https://www.bbc.co.uk/sport/basketball/63506629,Kyrie Irving,-0.0379166666666666,0.05580027987671865
NBA: Kyrie Irving and Brooklyn Nets pledge $1m after criticism over anti-Semitism,2023,https://www.bbc.co.uk/sport/basketball/63495933,Kyrie Irving,-0.0063095238095238,0.022725078997115813
NBA: Brooklyn Nets fans wear 'Fight Anti-Semitism' T-shirts after Kyrie Irving tweet,2023,https://www.bbc.co.uk/sport/basketball/63467880,Kyrie Irving,-0.0399184149184149,0.048245140225331995
Kyrie Irving says he embraces 'all religions' after criticism from Brooklyn Nets owner,2023,https://www.bbc.co.uk/sport/basketball/63444993,Kyrie Irving,-0.0953892668178382,0.04592843290280861
NBA: Kyrie Irving and Kevin Durant score high in Brooklyn Nets defeat at Memphis Grizzlies,2023,https://www.bbc.co.uk/sport/basketball/63383489,Kyrie Irving,0.2637310606060606,0.00604095294135065
Kyrie Irving: Why his tweets have got him in trouble,2023,https://www.bbc.co.uk/news/newsbeat-63541365,Kyrie Irving,-0.2,0.5478199069455449
Kyrie Irving suspended over anti-Semitic posts,2023,https://www.bbc.co.uk/news/world-us-canada-63509715,Kyrie Irving,0.0,0.5478199069455449
Newsbeat: Kyrie Irving,2023,https://www.bbc.co.uk/programmes/m001dlyh,Kyrie Irving,0.0,1.0
Steve Nash: Brooklyn Nets part ways with head coach,2023,https://www.bbc.co.uk/sport/basketball/63477309,Kyrie Irving,0.1284313725490196,0.01569077283682014
NBA round-up: LeBron James inspires comeback win for the Los Angeles Lakers,2023,https://www.bbc.co.uk/sport/basketball/64370555,Kyrie Irving,0.064,0.014736479868994134
NBA: Brooklyn Nets beat New York Knicks 112-85 in Jacque Vaughn's first game as head coach,2023,https://www.bbc.co.uk/sport/basketball/63580568,Kyrie Irving,0.0275974025974026,0.02298375206215492
NBA: Nikola Jokic sets career high for rebounds in Denver Nuggets win,2023,https://www.bbc.co.uk/sport/basketball/64023967,Kyrie Irving,0.2039848484848485,0.015391754817947686
NBA: LA Lakers rally to topple Golden State Warriors despite LeBron James absence,2023,https://www.bbc.co.uk/sport/basketball/64615897,Kyrie Irving,0.1351239669421487,0.01963180403055069
NBA: Kevin Durant traded to Phoenix Suns as Russell Westbrook joins Utah Jazz,2023,https://www.bbc.co.uk/sport/basketball/64593463,Kyrie Irving,0.0884722222222222,0.01860433448914583
NBA: Ja Morant inspires Memphis Grizzlies win while Stephen Curry stars in Golden State Warriors loss,2023,https://www.bbc.co.uk/sport/basketball/63355733,Kyrie Irving,0.1306998556998557,0.02662576494167681
Cam Thomas: Brooklyn Nets guard fined for 'derogatory language' in live TV interview,2023,https://www.bbc.co.uk/sport/basketball/64606067,Kyrie Irving,0.1619146005509642,0.02487108857826069
NBA on the BBC: The big questions as NBA returns after All-Star break,2023,https://www.bbc.co.uk/sport/basketball/64722489,Kyrie Irving,0.0630533543669136,0.010327006621118592
NBA round-up: Dennis Schroder leads LA Lakers to late victory over Memphis Grizzlies,2023,https://www.bbc.co.uk/sport/basketball/64357720,Kyrie Irving,0.0656784188034188,0.021175953465885834
NBA: Brooklyn Nets stun Boston Celtics 115-105 in biggest comeback win this season,2023,https://www.bbc.co.uk/sport/basketball/64846501,Kyrie Irving,0.2053030303030302,0.011625474543331892
NBA: Damien Lillard hits 42 points as Portland Trail Blazers beat Memphis Grizzlies,2023,https://www.bbc.co.uk/sport/basketball/64494837,Kyrie Irving,0.1312499999999999,0.006551317864578551
NBA: Zion Williamson scores 43 points as Pelicans beat Timberwolves,2023,https://www.bbc.co.uk/sport/basketball/64114841,Kyrie Irving,0.1515151515151515,0.005722524555138476
Brooklyn Nets: Jacque Vaughn appointed as permanent head coach,2023,https://www.bbc.co.uk/sport/basketball/63576644,Kyrie Irving,0.0857954545454545,0.023428213127904683
"NBA: Brooklyn Nets find 'solace' in wins after tumultuous week, says Kevin Durant",2023,https://www.bbc.co.uk/sport/basketball/63532635,Kyrie Irving,0.089537037037037,0.018436774145678264
BBC OS: Twitter staff emailed job news,2023,https://www.bbc.co.uk/programmes/w172yg1vr8ky2g7,Kyrie Irving,0.0,0.0
NBA: Zion Williamson returns as New Orleans Pelicans win season opener,2023,https://www.bbc.co.uk/sport/basketball/63325545,Kyrie Irving,0.0682416267942583,0.01952633297910922
Nikola Jokic scores 100th career triple-double as Denver Nuggets beat Houston Rockets,2023,https://www.bbc.co.uk/sport/basketball/64808299,Kyrie Irving,0.2544456845238095,0.0095990314437469
NBA: Memphis Grizzlies lose to in-form LA Lakers in second game without Ja Morant,2023,https://www.bbc.co.uk/sport/basketball/64885558,Kyrie Irving,0.1226430976430976,0.004528897140825591
NBA: Golden State Warriors v LA Lakers & other key talking points for new season,2023,https://www.bbc.co.uk/sport/basketball/63287260,Kyrie Irving,0.1064141414141414,0.013875117362277069
NBA: Officials miss foul on LeBron James as LA Lakers lose to Boston Celtics,2023,https://www.bbc.co.uk/sport/basketball/64443930,Kyrie Irving,0.1354545454545454,0.0052519028743840965
NBA: Defending champions Golden State Warriors beat Boston Celtics in Finals rematch,2023,https://www.bbc.co.uk/sport/basketball/63933734,Kyrie Irving,0.0985780423280423,0.011795253101883575
FBI identifies 'source of threat' to New Jersey synagogue,2023,https://www.bbc.co.uk/news/world-us-canada-63508402,Kyrie Irving,0.1363636363636363,0.0
Through the Night: A Saxon Christmas,2023,https://www.bbc.co.uk/programmes/m001g9zg,Kyrie Irving,0.0,0.0
NBA: Milwaukee Bucks beat Phoenix Suns to become first team to clinch play-off place,2023,https://www.bbc.co.uk/sport/basketball/64961517,Brook Lopez,0.1592697157914549,0.0170128152896883
NBA: Giannis Antetokounmpo stars as Milwaukee Bucks beat LA Clippers,2023,https://www.bbc.co.uk/sport/basketball/64608767,Brook Lopez,0.142436974789916,0.014628846523633176
NBA: Giannis Antetokounmpo leads Milwaukee Bucks to win on injury return,2023,https://www.bbc.co.uk/sport/basketball/64948897,Brook Lopez,0.0838888888888888,0.007660836990491062
"NFL week eight review: MVP shouts for Josh Allen as Buffalo Bills beat Packers, Eagles go 7-0",2023,https://www.bbc.co.uk/sport/american-football/63452643,Josh Giddey,0.1804866627439443,0.003516644942964689
NFL week 10: Minnesota Vikings stun Buffalo Bills plus more magic from Mahomes,2023,https://www.bbc.co.uk/sport/american-football/63618573,Josh Giddey,0.1424561945990518,0.013044057308288864
Super Bowl 57: Patrick Mahomes wins second title to show he's Tom Brady's NFL successor,2023,https://www.bbc.co.uk/sport/american-football/64623240,Josh Giddey,0.1739121306744257,0.008609873146184128
"NFL: Tom Brady breaks 100,000-yard mark as Tampa Bay Buccaneers beat LA Rams",2023,https://www.bbc.co.uk/sport/american-football/63538136,Josh Giddey,0.0765265697605147,0.005573274486562574
NFL week 12 review & results: Aaron Rodgers hurt as Eagles beat Packers while Chiefs beat Rams,2023,https://www.bbc.co.uk/sport/american-football/63777983,Josh Giddey,0.1556811375207601,0.0
