title,date,url,player,textblob_sentiment,sentiment_bert_average_score,sentiment_xlnet_average_score,bert_relevance,relevance_score
Prince Andrew loses military titles and use of HRH,2022,https://www.bbc.co.uk/news/uk-59987935,Tobias Harris,-0.2,0.5471335053443909,0.6864683628082275,0.661996603012085,0.0
Please Use Other Door: Series 1: Episode 4,2022,https://www.bbc.co.uk/programmes/m0014wv7,Andrew Wiggins,-0.125,0.580838680267334,0.656956672668457,0.6645632386207581,0.0
Please Use Other Door: Series 1: Episode 3,2022,https://www.bbc.co.uk/programmes/m0014p8w,Andrew Wiggins,-0.125,0.5506014227867126,0.5445733666419983,0.6645632386207581,0.0
Please Use Other Door: Series 1: Episode 2,2022,https://www.bbc.co.uk/programmes/m0014g0j,Andrew Wiggins,-0.125,0.6798277497291565,0.5891709327697754,0.6645632386207581,0.0
Please Use Other Door: Series 1: Episode 1,2022,https://www.bbc.co.uk/programmes/m00146x2,Andrew Wiggins,-0.125,0.5534076690673828,0.6045913100242615,0.6645632386207581,0.0
NBA: LeBron James' comeback spoiled as Boston Celtics beat Los Angeles Lakers,2022,https://www.bbc.co.uk/sport/basketball/59358572,Andrew Wiggins,0.2504689754689754,0.5294065276781718,0.5759419798851013,0.6645632386207581,0.0309657847112739
ECB: Damian Collins MP questions Sir Dave Brailsford's suitability,2022,https://www.bbc.co.uk/sport/cricket/60839405,Andrew Wiggins,0.0232919254658385,0.5628417581319809,0.5905377566814423,0.6645632386207581,0.0606958361834945
NFL: Miami Dolphins claim upset win over Baltimore Ravens,2022,https://www.bbc.co.uk/sport/american-football/59258347,Andrew Wiggins,0.1828217237308146,0.6692665815353394,0.5728179216384888,0.6645632386207581,0.0190949090797466
NBA: Klay Thompson stars as Golden State Warriors beat Detroit Pistons,2022,https://www.bbc.co.uk/sport/basketball/60050561,Andrew Wiggins,0.2246880570409982,0.5471619069576263,0.5351088345050812,0.6645632386207581,0.0238404986325825
Comedy of the Week: Please Use Other Door,2022,https://www.bbc.co.uk/programmes/p0bndp1x,Andrew Wiggins,-0.125,0.5412131547927856,0.5243036150932312,0.6645632386207581,0.0
NBA: Oklahoma City Thunder earn late win as Golden State Warriors and Brooklyn Nets lose,2022,https://www.bbc.co.uk/sport/basketball/59709849,Andrew Wiggins,0.0735353535353535,0.6149245699246725,0.5711030960083008,0.6645632386207581,0.0388278282503707
NBA: Golden State Warriors end Phoenix Suns' 18-match winning streak,2022,https://www.bbc.co.uk/sport/basketball/59531498,Andrew Wiggins,0.2364152892561983,0.6211859385172526,0.5321462750434875,0.6645632386207581,0.0170576540813834
NBA: Stephen Curry scores 40 points as Golden State Warriors win sixth game in a row,2022,https://www.bbc.co.uk/sport/basketball/60200633,Andrew Wiggins,0.223063973063973,0.5492845773696899,0.6072022318840027,0.6645632386207581,0.0116647276311323
NBA: Giannis Antetokounmpo leads Milwaukee Bucks to win over Golden State Warriors,2022,https://www.bbc.co.uk/sport/basketball/59985184,Andrew Wiggins,0.139194577352472,0.5755797177553177,0.6382291913032532,0.6645632386207581,0.0270530488900321
NBA: James Harden and Kevin Durant shine in latest Brooklyn Nets win,2022,https://www.bbc.co.uk/sport/basketball/59244927,Andrew Wiggins,0.1732804232804232,0.5802769958972931,0.6031537055969238,0.6645632386207581,0.0120556506399919
NBA: Joel Embiid helps Philadelphia 76ers to win over Los Angeles Lakers,2022,https://www.bbc.co.uk/sport/basketball/60166399,Andrew Wiggins,0.0516645988420181,0.6054461151361465,0.5637509077787399,0.6645632386207581,0.0271674753502545
NBA: Stephen Curry passes Ray Allen's three-pointers mark as Golden State Warriors win,2022,https://www.bbc.co.uk/sport/basketball/59273283,Andrew Wiggins,0.253958944281525,0.6169140696525574,0.60682452917099,0.6645632386207581,0.0097981266186092
NBA: Minnesota Timberwolves take advantage of injury-hit Golden State Warriors,2022,https://www.bbc.co.uk/sport/basketball/60000308,Bojan Bogdanović,0.0780103668261563,0.600287675857544,0.5732165575027466,0.652100145816803,0.0357981746073038
NBA: Stephen Curry stars as Golden State Warriors beat Brooklyn Nets,2022,https://www.bbc.co.uk/sport/basketball/59316860,Bojan Bogdanović,0.3090909090909091,0.5818735361099243,0.5742124915122986,0.652100145816803,0.025993888014808
"NBA: Devin Booker stars as Phoenix Suns beat Chicago Bulls, Warriors keep winning",2022,https://www.bbc.co.uk/sport/basketball/60282914,Bojan Bogdanović,0.2116477272727273,0.5162729024887085,0.6255049109458923,0.652100145816803,0.019482724003061
NBA: Blazers beat Lakers as Jazz end Warriors' winning run,2022,https://www.bbc.co.uk/sport/basketball/60322237,Bojan Bogdanović,0.2576923076923076,0.5969219009081522,0.6154212156931559,0.652100145816803,0.0
Kyrie Irving: Brooklyn Nets point guard returns after vaccine controversy,2022,https://www.bbc.co.uk/sport/basketball/59891500,Bojan Bogdanović,0.1795900178253119,0.6101738810539246,0.5626941521962484,0.652100145816803,0.0144824150980758
NBA: Devin Booker sets franchise record as Phoenix Suns beat Utah Jazz,2022,https://www.bbc.co.uk/sport/basketball/60151709,Bojan Bogdanović,0.2280546202768425,0.5631285160779953,0.5099514871835709,0.652100145816803,0.0117600621555706
NBA: Stephen Curry leads Warriors win with 46 points,2022,https://www.bbc.co.uk/sport/basketball/59775265,Bojan Bogdanović,0.1395123106060606,0.5729987621307373,0.6078740656375885,0.652100145816803,0.0097648801170483
NBA plays of the week: Ja Morant's buzzer-beater and Brandon Ingram's stunning shot,2022,https://www.bbc.co.uk/sport/av/basketball/60660688,Brandon Ingram,0.5,0.579014241695404,0.5014796257019043,0.6674367189407349,0.2963311647449753
NBA: Darius Garland's half-court shot & Brandon Ingram's game-winner - plays of the week,2022,https://www.bbc.co.uk/sport/av/basketball/60040625,Brandon Ingram,0.0,0.5301315784454346,0.5096766352653503,0.6674367189407349,0.2963311647449753
NBA: Devonte Graham buzzer-beater helps New Orleans Pelicans beat Oklahoma City Thunder,2022,https://www.bbc.co.uk/sport/basketball/59679508,Brandon Ingram,0.2666233766233766,0.669304758310318,0.5374794900417328,0.6674367189407349,0.0769933376165993
NBA: Stephen Curry leads Warriors win with 46 points,2022,https://www.bbc.co.uk/sport/basketball/59775265,Brandon Ingram,0.1395123106060606,0.5624411553144455,0.5752667188644409,0.6674367189407349,0.0377059923684876
NBA: Golden State Warriors miss Stephen Curry in Pelicans defeat,2022,https://www.bbc.co.uk/sport/basketball/59905773,Brandon Ingram,0.1010348381776953,0.5420925170183182,0.5319438725709915,0.6674367189407349,0.0290078988832115
NBA: Cleveland Cavaliers fight back to stun Boston Celtics,2022,https://www.bbc.co.uk/sport/basketball/59280176,Brandon Ingram,0.1695481601731601,0.5644751340150833,0.5947694033384323,0.6674367189407349,0.0286201325211975
Brooklyn Nets' Kyrie Irving adamant on vaccine refusal,2022,https://www.bbc.co.uk/sport/basketball/60035898,Brandon Ingram,0.1553579270970575,0.5455846985181173,0.6102988719940186,0.6674367189407349,0.0
NBA: Giannis Antetokounmpo and LeBron James shine for Bucks and Lakers,2022,https://www.bbc.co.uk/sport/basketball/59619765,Brandon Ingram,0.253314393939394,0.5882138311862946,0.652643695473671,0.6674367189407349,0.0251465845206651
Hull City 0-2 West Bromwich Albion: Karlan Grant double gives Baggies first win under Steve Bruce,2022,https://www.bbc.co.uk/sport/football/60534054,Brandon Ingram,0.121581485408016,0.5377993211150169,0.5501197427511215,0.6674367189407349,0.0226223874064484
Peterborough United 0-3 Hull City: Posh fall to bottom of Championship,2022,https://www.bbc.co.uk/sport/football/60441762,Brandon Ingram,0.1628702200577201,0.615737361567361,0.5684337530817304,0.6674367189407349,0.0271101413779063
Scottish Premiership ins & outs: Who has moved in January 2022?,2022,https://www.bbc.co.uk/sport/football/60016331,Brandon Ingram,0.034090909090909,0.5657816181580225,0.5733613620201746,0.6674367189407349,0.007742086223524
Derby County 3-1 Hull City: Rams win to reignite hopes of Championship survival,2022,https://www.bbc.co.uk/sport/football/60210013,Brandon Ingram,0.1066875477463712,0.5913960710167885,0.5580243542790413,0.6674367189407349,0.0181737356450495
NBA: Jrue Holiday scores late as Milwaukee Bucks beat Miami Heat,2022,https://www.bbc.co.uk/sport/basketball/60599291,Jrue Holiday,0.2745395127748069,0.6082686384518942,0.5988839070002238,0.6974579095840454,0.0341737442698577
Karl-Anthony Towns records season-high NBA score in Minnesota Timberwolves win,2022,https://www.bbc.co.uk/sport/basketball/60747632,Jrue Holiday,0.2649999999999999,0.5543855875730515,0.5597016662359238,0.6974579095840454,0.0508430939980273
NBA: Stephen Curry leads Warriors win with 46 points,2022,https://www.bbc.co.uk/sport/basketball/59775265,Jrue Holiday,0.1395123106060606,0.5661842375993729,0.5424116849899292,0.6974579095840454,0.0377059923684876
NBA: Khris Middleton stars as Milwaukee Bucks beat Phoenix Suns,2022,https://www.bbc.co.uk/sport/basketball/60644402,Jrue Holiday,0.1574810606060606,0.6093091070652008,0.5218597054481506,0.6974579095840454,0.0462586847455549
Giannis Antetokounmpo becomes Milwaukee Bucks all-time leading scorer in win over Brooklyn Nets,2022,https://www.bbc.co.uk/sport/basketball/60951384,Jrue Holiday,0.0636363636363636,0.548663318157196,0.5072247385978699,0.6974579095840454,0.0240396482296752
NBA: Kevin Durant ejected as Nets beat Pistons while Carmelo Anthony inspires the Lakers,2022,https://www.bbc.co.uk/sport/basketball/59116897,Jrue Holiday,0.1428571428571428,0.5140024423599243,0.6113359034061432,0.6974579095840454,0.0571325754617902
NBA: Giannis Antetokounmpo stars as the Milwaukee Bucks beat the Philadelphia 76ers,2022,https://www.bbc.co.uk/sport/basketball/60925003,Jrue Holiday,0.0243197278911564,0.5667674243450165,0.517760843038559,0.6974579095840454,0.0504070351657517
NBA: Stephen Curry scores 45 as Golden State Warriors beat Los Angeles Clippers,2022,https://www.bbc.co.uk/sport/basketball/59006438,Jrue Holiday,0.0319444444444444,0.5149855315685272,0.5356264114379883,0.6974579095840454,0.0524657589506365
NBA: Khris Middleton helps Milwaukee Bucks beat Houston Rockets,2022,https://www.bbc.co.uk/sport/basketball/59766382,Jrue Holiday,0.2299999999999999,0.661864697933197,0.5478454530239105,0.6974579095840454,0.020746818945559
NBA: Phoenix Suns beat the Denver Nuggets to secure top spot in the Western Conference,2022,https://www.bbc.co.uk/sport/basketball/60871544,Jrue Holiday,0.1525974025974026,0.572341521581014,0.5263849298159281,0.6974579095840454,0.0186012183569956
NBA: Joel Embiid scores 34 points as Philadelphia 76ers beat Brooklyn Nets,2022,https://www.bbc.co.uk/sport/basketball/59836059,Jrue Holiday,0.1889914772727272,0.5793566107749939,0.6319170395533243,0.6974579095840454,0.0164718545223184
NBA: Giannis Antetokounmpo scores season-high 50 points for Bucks,2022,https://www.bbc.co.uk/sport/basketball/60400079,Jrue Holiday,0.1593434343434343,0.5774215459823608,0.5795937975247701,0.6974579095840454,0.0152498518714577
NBA: Milwaukee Bucks make franchise history in win over Orlando Magic,2022,https://www.bbc.co.uk/sport/basketball/59384765,Jrue Holiday,0.1595238095238095,0.559654156366984,0.5154528419176737,0.6974579095840454,0.0157506364805503
Kyrie Irving to return to Brooklyn Nets set up,2022,https://www.bbc.co.uk/sport/basketball/59688449,Jrue Holiday,0.0870454545454545,0.5378193557262421,0.5723264366388321,0.6974579095840454,0.0244758122156631
NBA: Golden State Warriors win fifth consecutive game as Toronto Raptors beat Miami Heat,2022,https://www.bbc.co.uk/sport/basketball/60180375,Jimmy Butler,0.2106691919191919,0.5465420683224996,0.5714796384175619,0.684836745262146,0.0286201325211976
NBA: Devin Booker sets franchise record as Phoenix Suns beat Utah Jazz,2022,https://www.bbc.co.uk/sport/basketball/60151709,Jimmy Butler,0.2280546202768425,0.5427580326795578,0.5786636769771576,0.684836745262146,0.0454283725630813
NBA: Golden State Warriors hold on to beat Utah Jazz,2022,https://www.bbc.co.uk/sport/basketball/60108574,Jimmy Butler,-0.0266666666666666,0.5582320094108582,0.6995835602283478,0.684836745262146,0.0257612003676242
NBA: Stephen Curry scores 45 as Golden State Warriors beat Los Angeles Clippers,2022,https://www.bbc.co.uk/sport/basketball/59006438,Jimmy Butler,0.0319444444444444,0.573627382516861,0.5598353743553162,0.684836745262146,0.0524657589506365
NBA preview: 75th anniversary season set up to be one of the greats,2022,https://www.bbc.co.uk/sport/basketball/58915171,Jimmy Butler,0.146480151054619,0.5551441013813019,0.5705442652106285,0.684836745262146,0.0210394759290301
NBA: LA Lakers fall to fifth defeat of the season with loss to Portland Trail Blazers,2022,https://www.bbc.co.uk/sport/basketball/59197184,Jimmy Butler,0.1892857142857143,0.5852450331052145,0.5488463242848715,0.684836745262146,0.048872843164417
NBA: Phoenix Suns beat Golden State Warriors 107-103 to equal win record,2022,https://www.bbc.co.uk/sport/basketball/60938026,Jimmy Butler,0.1769230769230769,0.5637405713399252,0.5722869435946146,0.684836745262146,0.0464013618250436
NFL 2021 awards: Aaron Rodgers named Most Valuable Player for fourth time,2022,https://www.bbc.co.uk/sport/american-football/60320432,Jimmy Butler,0.1884469696969697,0.569152295589447,0.5693019373076302,0.684836745262146,0.0134253918626324
NBA: LeBron James scores 56 points as LA Lakers beat Golden State Warriors,2022,https://www.bbc.co.uk/sport/basketball/60636947,Jimmy Butler,0.2023809523809524,0.5592384735743204,0.6300211548805237,0.684836745262146,0.0432750703018066
NBA: Nikola Jokic helps Denver beat LA Clippers as Covid hits teams,2022,https://www.bbc.co.uk/sport/basketball/59799852,Jimmy Butler,0.3395202020202019,0.638383130232493,0.5727758208910624,0.684836745262146,0.0421394131995293
NBA: Stephen Curry hits 40 points in Golden State Warriors win over Cleveland Cavaliers,2022,https://www.bbc.co.uk/sport/basketball/59344263,Jimmy Butler,0.3461352657004831,0.6092855135599772,0.5241918365160624,0.684836745262146,0.0397899668375168
NBA: LeBron James scores 29 points on return as LA Lakers beat New York Knicks,2022,https://www.bbc.co.uk/sport/basketball/60277691,Jimmy Butler,0.2476094276094276,0.6076444784800211,0.5738359093666077,0.684836745262146,0.0359988111356794
Gritty Fresh Prince of Bel-Air reboot reveals first (real) trailer,2022,https://www.bbc.co.uk/news/entertainment-arts-59950295,Jimmy Butler,0.1875,0.6080340147018433,0.6872930526733398,0.684836745262146,0.0
NFL play-offs: San Francisco 49ers and Cincinnati Bengals claim upsets in divisional round,2022,https://www.bbc.co.uk/sport/american-football/60099669,Jimmy Butler,0.0451743742368742,0.5642864789281573,0.610315876347678,0.684836745262146,0.0198186391187574
NBA: Wins for Bulls & Warriors as Bucks and Nets lose,2022,https://www.bbc.co.uk/sport/basketball/59865447,Jimmy Butler,0.2322333333333333,0.5490755041440328,0.6012476086616516,0.684836745262146,0.0320472996829286
NFL play-offs: Profiles and ones to watch for four teams in Conference Championships,2022,https://www.bbc.co.uk/sport/american-football/60169610,Jimmy Butler,0.1885224424698109,0.5703404491597955,0.5592316334897821,0.684836745262146,0.0158037714694269
NBA: Chicago Bulls record fifth win in six games to end Utah Jazz's unbeaten start to season,2022,https://www.bbc.co.uk/sport/basketball/59108938,Jimmy Butler,0.3551948051948052,0.5791855007410049,0.5887570381164551,0.684836745262146,0.0245694375304726
NFL play-offs: Profiles and ones to watch for eight teams in divisional round,2022,https://www.bbc.co.uk/sport/american-football/60088341,Jimmy Butler,0.1416967361476032,0.5755686014890671,0.568918451666832,0.684836745262146,0.0144524838592459
NBA: Brooklyn star James Harden joins Philadelphia 76ers as the Nets lose 10th straight game,2022,https://www.bbc.co.uk/sport/basketball/60337552,Jimmy Butler,0.1916083916083915,0.574198591709137,0.5715091347694397,0.684836745262146,0.018923338019323
"NFL play-offs: San Francisco 49ers, Kansas City Chiefs and Tampa Bay Buccaneers win",2022,https://www.bbc.co.uk/sport/american-football/60019066,Jimmy Butler,0.1108524808524807,0.5519113764166832,0.5601886212825775,0.684836745262146,0.012063746820715
NFL play-offs: Kansas City Chiefs target third straight Super Bowl in Conference Championships,2022,https://www.bbc.co.uk/sport/american-football/60169849,Jimmy Butler,0.0722063968526233,0.5607384204864502,0.5840649306774139,0.684836745262146,0.014207394487852
Stand News: Independent outlet to close after senior staff arrested,2022,https://www.bbc.co.uk/news/world-asia-59807734,Jimmy Butler,0.0,0.5912036299705505,0.780353844165802,0.684836745262146,0.0
League One - half-term reports for each club,2022,https://www.bbc.co.uk/sport/football/59759348,Jimmy Butler,0.127565818747375,0.5765079548864653,0.578242383219979,0.684836745262146,0.0028440271930435
God Squad,2022,https://www.bbc.co.uk/programmes/m0010znk,Christian Wood,0.0,0.7105783224105835,0.7335287928581238,0.695910632610321,0.0
Sunday Feature: A Tree Story,2022,https://www.bbc.co.uk/programmes/m0011cm1,Christian Wood,0.0,0.5750359296798706,0.5212935209274292,0.695910632610321,0.0
Transfer news: Benteke set to stay at Palace,2022,https://www.bbc.com/sport/articles/c7p07gq4q42o,Christian Wood,0.0,0.7008032202720642,0.5487114191055298,0.695910632610321,0.0
Newcastle United v Watford: Team news,2022,https://www.bbc.com/sport/articles/cl0ygjn57rzo,Christian Wood,0.0,0.5660297870635986,0.5693193078041077,0.695910632610321,0.0
Tom Brady retires: The rise and success of seven-time Super Bowl winner,2022,https://www.bbc.co.uk/sport/american-football/60224493,Christian Wood,0.1800222072299994,0.5646379806778647,0.5764022686264731,0.695910632610321,0.0140579421833035
Burnley v Brentford: Confirmed team news,2022,https://www.bbc.com/sport/articles/c4112538xveo,Christian Wood,0.4,0.6384162306785583,0.6636170744895935,0.695910632610321,0.0
"Benteke happy at Palace, despite Burnley interest",2022,https://www.bbc.com/sport/articles/czx7l5ev9p4o,Christian Wood,0.8,0.5031623244285583,0.8129233717918396,0.695910632610321,0.0
Extinction Rebellion vicar protester has conviction quashed,2022,https://www.bbc.co.uk/news/uk-england-bristol-60868573,Christian Wood,0.0,0.6568831205368042,0.5128662586212158,0.695910632610321,0.0
Transfer deadline day: How things played out on social media,2022,https://www.bbc.co.uk/sport/football/60209682,Christian Wood,0.1077392225829726,0.6044653654098511,0.5529593725999197,0.695910632610321,0.0257514986511169
Brentford v Newcastle: Confirmed team news,2022,https://www.bbc.com/sport/articles/cjrxw9519nlo,Christian Wood,0.4,0.5429112315177917,0.5451839566230774,0.695910632610321,0.0
"NBA: Los Angeles Lakers lose to Oklahoma City Thunder, Phoenix Suns beat Houston Rockets",2022,https://www.bbc.co.uk/sport/basketball/59173791,Christian Wood,0.0272727272727272,0.5987619757652283,0.603428453207016,0.695910632610321,0.0673109770545859
Winchester College sorry for 'horrific' summer camp abuse,2022,https://www.bbc.co.uk/news/uk-england-hampshire-60050300,Christian Wood,-0.75,0.5057855844497681,0.6579993963241577,0.695910632610321,0.0
NBA: LeBron James shines as LA Lakers beat Houston Rockets,2022,https://www.bbc.co.uk/sport/basketball/59146508,Christian Wood,0.1066433566433566,0.5349140167236328,0.5646228492259979,0.695910632610321,0.0225337762178763
"Ranieri on big week, Newcastle & 'belief' in players",2022,https://www.bbc.com/sport/articles/c5nyg80zn28o,Christian Wood,0.0,0.5343465209007263,0.6163952350616455,0.695910632610321,0.0
Burnley 3-1 Brentford: Clarets mark Sean Dyche's ninth anniversary with superb win,2022,https://www.bbc.co.uk/sport/football/59019336,Christian Wood,0.1536368625464371,0.5909228771924973,0.5531990677118301,0.695910632610321,0.0449628636729067
Burnley 3-3 Crystal Palace: Cornet stunner earns Clarets point in six-goal thriller,2022,https://www.bbc.co.uk/sport/football/59271457,Christian Wood,0.0575559904327027,0.5625418850353786,0.5652367302349636,0.695910632610321,0.0275757053533089
What can you do with your tree once Christmas is over?,2022,https://www.bbc.co.uk/newsround/59881577,Christian Wood,0.0,0.6572160124778748,0.5944653153419495,0.695910632610321,0.0
NBA: Khris Middleton helps Milwaukee Bucks beat Houston Rockets,2022,https://www.bbc.co.uk/sport/basketball/59766382,Franz Wagner,0.2299999999999999,0.606048971414566,0.5521295964717865,0.6659164428710938,0.0464013618250436
NBA: Phoenix Suns beat San Antonio Spurs to secure 10th consecutive win,2022,https://www.bbc.co.uk/sport/basketball/60195518,Franz Wagner,0.1352029914529914,0.6554345488548279,0.6461376349131266,0.6659164428710938,0.0163781107790219
Through the Night: Sebastian String Quartet Thirtieth Anniversary,2022,https://www.bbc.co.uk/programmes/m0013ryz,Franz Wagner,0.0,0.6039333343505859,0.5860698819160461,0.6659164428710938,0.0
NBA: Giannis Antetokounmpo stars as the Bucks beat the Lakers,2022,https://www.bbc.co.uk/sport/basketball/59316347,D'Angelo Russell,0.3303977272727272,0.5563480456670126,0.6191250681877136,0.6497820019721985,0.0190949090797467
NBA: Giannis Antetokounmpo leads Milwaukee Bucks to win over Golden State Warriors,2022,https://www.bbc.co.uk/sport/basketball/59985184,D'Angelo Russell,0.139194577352472,0.5464515089988708,0.5714017897844315,0.6497820019721985,0.0270530488900321
NFL: Russell Wilson joins Denver Broncos - 2022's biggest free-agency deals,2022,https://www.bbc.co.uk/sport/american-football/60743512,D'Angelo Russell,0.1278804528804528,0.6125702932476997,0.5857454612851143,0.6497820019721985,0.0172620117227078
NBA: Stephen Curry scores 50 as Golden State Warriors beat Atlanta Hawks,2022,https://www.bbc.co.uk/sport/basketball/59209614,D'Angelo Russell,0.1454545454545455,0.5889325141906738,0.5893688946962357,0.6497820019721985,0.0221924867985007
NBA preview: 75th anniversary season set up to be one of the greats,2022,https://www.bbc.co.uk/sport/basketball/58915171,D'Angelo Russell,0.146480151054619,0.5874373391270638,0.5489130094647408,0.6497820019721985,0.0121781118222786
NBA: LeBron James' comeback spoiled as Boston Celtics beat Los Angeles Lakers,2022,https://www.bbc.co.uk/sport/basketball/59358572,Mikal Bridges,0.2504689754689754,0.6017195582389832,0.604753315448761,0.6639429330825806,0.0309657847112739
"NBA: Los Angeles Lakers lose to Oklahoma City Thunder, Phoenix Suns beat Houston Rockets",2022,https://www.bbc.co.uk/sport/basketball/59173791,Mikal Bridges,0.0272727272727272,0.5932518541812897,0.647632360458374,0.6639429330825806,0.0673109770545859
NBA: Memphis Grizzlies beat Phoenix Suns by one point,2022,https://www.bbc.co.uk/sport/basketball/59807910,Mikal Bridges,0.253968253968254,0.5434445142745972,0.5983121693134308,0.6639429330825806,0.0485037770876397
NBA: Phoenix Suns beat Golden State Warriors 107-103 to equal win record,2022,https://www.bbc.co.uk/sport/basketball/60938026,Mikal Bridges,0.1769230769230769,0.587416390577952,0.5921019911766052,0.6639429330825806,0.0464013618250436
NBA: Giannis Antetokounmpo scores 44 in Milwaukee Bucks' win over LA Lakers,2022,https://www.bbc.co.uk/sport/basketball/60314854,Mikal Bridges,0.1077430145611963,0.6086241602897644,0.6067853371302286,0.6639429330825806,0.0322079997879106
Aaron Rodgers signs contract extension with Green Bay Packers,2022,https://www.bbc.co.uk/sport/american-football/60756892,Jalen Green,0.2103535353535353,0.553377240896225,0.613675981760025,0.6726215481758118,0.0859193431587725
Aaron Rodgers to remain with Green Bay Packers into 18th season,2022,https://www.bbc.co.uk/sport/american-football/60667621,Jalen Green,0.1727878787878787,0.5181496540705363,0.5869864424069723,0.6726215481758118,0.0784030758244694
The NFL Show: Jason Bell & Osi Umenyiora on whether Aaron Rodgers will win MVP,2022,https://www.bbc.co.uk/sport/av/american-football/59847261,Jalen Green,0.8,0.5935323238372803,0.5853232145309448,0.6726215481758118,0.2686664178005917
NFL play-offs: Green Bay Packers and Tennessee Titans enter divisional round,2022,https://www.bbc.co.uk/sport/american-football/60084688,Jalen Green,0.147789480860347,0.5734442412853241,0.617688775062561,0.6726215481758118,0.0507036287881362
NFL: Green Bay Packers end Arizona Cardinals' unbeaten start to the season,2022,https://www.bbc.co.uk/sport/american-football/59087320,Jalen Green,0.0595328282828282,0.5728843808174133,0.5252451499303182,0.6726215481758118,0.0762620093802902
NFL 2021 awards: Aaron Rodgers named Most Valuable Player for fourth time,2022,https://www.bbc.co.uk/sport/american-football/60320432,Jalen Green,0.1884469696969697,0.5642161199024746,0.6216890215873718,0.6726215481758118,0.0201502385008492
NBA: Minnesota Timberwolves take advantage of injury-hit Golden State Warriors,2022,https://www.bbc.co.uk/sport/basketball/60000308,Jalen Green,0.0780103668261563,0.6134995619455973,0.6053070624669393,0.6726215481758118,0.0537837400358697
NBA: LeBron James scores 32 points as Los Angeles Lakers beat Houston Rockets,2022,https://www.bbc.co.uk/sport/basketball/59816073,Jalen Green,0.2482954545454545,0.5489107171694437,0.5788143873214722,0.6726215481758118,0.014409898420264
NFL: Russell Wilson joins Denver Broncos - 2022's biggest free-agency deals,2022,https://www.bbc.co.uk/sport/american-football/60743512,Jalen Green,0.1278804528804528,0.6060653179883957,0.5789050832390785,0.6726215481758118,0.0230279184324026
NBA: Phoenix Suns qualify for play-offs with win over Miami Heat,2022,https://www.bbc.co.uk/sport/basketball/60688514,Jalen Green,0.1377224627224627,0.5640313029289246,0.6433462103207906,0.6726215481758118,0.0137885187614306
"NFL play-offs: San Francisco 49ers, Kansas City Chiefs and Tampa Bay Buccaneers win",2022,https://www.bbc.co.uk/sport/american-football/60019066,Jalen Green,0.1108524808524807,0.5823322609066963,0.58872901648283,0.6726215481758118,0.0278041223887315
