title,date,url,player,textblob_sentiment,sentiment_bert_average_score,sentiment_xlnet_average_score,bert_relevance,relevance_score
NBA: Brooklyn Nets beat Philadelphia 76ers in first meeting since James Harden's move,2022,https://www.bbc.co.uk/sport/basketball/60704111,James Harden,0.1008403361344537,0.5671915709972382,0.6326133906841278,0.6704015135765076,0.0687519704970228
NBA: James Harden scores 27 points on Philadelphia 76ers debut against Minnesota Timberwolves,2022,https://www.bbc.co.uk/sport/basketball/60536647,James Harden,0.2086363636363636,0.5267560879389445,0.532080352306366,0.6704015135765076,0.0383639992133781
NBA: Brooklyn star James Harden joins Philadelphia 76ers as the Nets lose 10th straight game,2022,https://www.bbc.co.uk/sport/basketball/60337552,James Harden,0.1916083916083915,0.6128939747810364,0.6182575583457947,0.6704015135765076,0.0569636786160391
NBA: James Harden shines as Brooklyn Nets beat Eastern Conference leaders Chicago Bulls,2022,https://www.bbc.co.uk/sport/basketball/59961498,James Harden,0.2496323232323232,0.6277070244153341,0.6280427575111389,0.6704015135765076,0.0456321613988605
NBA: James Harden gets 63rd triple-double on return for Brooklyn Nets against LA Lakers,2022,https://www.bbc.co.uk/sport/av/basketball/59795423,James Harden,0.0,0.5247510671615601,0.5105611681938171,0.6704015135765076,0.6162339366293444
NBA: James Harden and Kevin Durant shine in latest Brooklyn Nets win,2022,https://www.bbc.co.uk/sport/basketball/59244927,James Harden,0.1732804232804232,0.5730901509523392,0.5544434636831284,0.6704015135765076,0.0269395822906646
NBA: James Harden shines on Philadelphia 76ers debut,2022,https://www.bbc.co.uk/sport/av/basketball/60537804,James Harden,0.0,0.575737714767456,0.5595571398735046,0.6704015135765076,1.0
NBA: Kevin Durant ejected as Nets beat Pistons while Carmelo Anthony inspires the Lakers,2022,https://www.bbc.co.uk/sport/basketball/59116897,James Harden,0.1428571428571428,0.651759535074234,0.5364431440830231,0.6704015135765076,0.0571325754617902
NBA: Giannis Antetokounmpo stars as the Bucks beat the Lakers,2022,https://www.bbc.co.uk/sport/basketball/59316347,James Harden,0.3303977272727272,0.6123066544532776,0.5706887046496073,0.6704015135765076,0.0641726127090273
NBA: LeBron James' comeback spoiled as Boston Celtics beat Los Angeles Lakers,2022,https://www.bbc.co.uk/sport/basketball/59358572,James Harden,0.2504689754689754,0.6214762528737386,0.6083861390749613,0.6704015135765076,0.0309657847112739
Jess Fishlock: Wales midfielder surprised by team-mates during interview,2022,https://www.bbc.co.uk/sport/av/football/59423327,James Harden,0.1,0.6611881852149963,0.7313036918640137,0.6704015135765076,0.0
"NBA: Otto Porter Jr stars for Golden State Warriors, Harden helps Brooklyn win",2022,https://www.bbc.co.uk/sport/basketball/59793629,James Harden,0.1128226711560044,0.6368394295374552,0.5971526106198629,0.6704015135765076,0.1080897075503191
NBA: Golden State Warriors win fifth consecutive game as Toronto Raptors beat Miami Heat,2022,https://www.bbc.co.uk/sport/basketball/60180375,James Harden,0.2106691919191919,0.5943791468938192,0.5835161606470743,0.6704015135765076,0.0494820427972579
"Phoenix Suns stifle Stephen Curry to beat Golden State Warriors, Lakers win without James",2022,https://www.bbc.co.uk/sport/basketball/59487440,James Harden,0.167454719609892,0.5962306559085846,0.5948376655578613,0.6704015135765076,0.0558897309643264
NBA: Lebron James breaks all-time scoring record but LA Lakers lose to Warriors,2022,https://www.bbc.co.uk/sport/basketball/60365719,James Harden,0.1494949494949495,0.6020197868347168,0.6036196649074554,0.6704015135765076,0.0892154452797903
NBA: LeBron James says Los Angeles Lakers season is 'definitely different',2022,https://www.bbc.co.uk/sport/basketball/60552459,James Harden,0.1648894964684438,0.5600893894831339,0.5738326907157898,0.6704015135765076,0.098780659845032
NBA: Devin Booker sets franchise record as Phoenix Suns beat Utah Jazz,2022,https://www.bbc.co.uk/sport/basketball/60151709,James Harden,0.2280546202768425,0.5855017453432083,0.5578725785017014,0.6704015135765076,0.0454283725630813
NBA All-Star Game: Stephen Curry sets record as Team LeBron win 163-160 against Team Durant,2022,https://www.bbc.co.uk/sport/basketball/60459972,James Harden,0.0140350877192982,0.5656788349151611,0.5536698897679647,0.6704015135765076,0.0357981746073038
NBA preview: 75th anniversary season set up to be one of the greats,2022,https://www.bbc.co.uk/sport/basketball/58915171,James Harden,0.146480151054619,0.5854436233639717,0.5662217140197754,0.6704015135765076,0.0421481527604722
NBA: Jrue Holiday scores late as Milwaukee Bucks beat Miami Heat,2022,https://www.bbc.co.uk/sport/basketball/60599291,James Harden,0.2745395127748069,0.5374547839164734,0.5653207898139954,0.6704015135765076,0.0513485713662663
NBA: LeBron James stars as Los Angeles Lakers beat Boston Celtics,2022,https://www.bbc.co.uk/sport/basketball/59575321,James Harden,0.1918831168831169,0.5833050608634949,0.6289553940296173,0.6704015135765076,0.0997006477492395
NBA: Giannis Antetokounmpo stars as the Milwaukee Bucks beat the Philadelphia 76ers,2022,https://www.bbc.co.uk/sport/basketball/60925003,James Harden,0.0243197278911564,0.5226407051086426,0.6448833644390106,0.6704015135765076,0.0504070351657517
NBA: Phoenix Suns beat Minnesota Timberwolves as Deandre Ayton scores 35 points,2022,https://www.bbc.co.uk/sport/basketball/60858243,James Harden,0.1222222222222222,0.580167293548584,0.6238699555397034,0.6704015135765076,0.0454170518523988
NBA postpones more games over Covid-19 case number rise,2022,https://www.bbc.co.uk/sport/basketball/59720597,James Harden,0.067310606060606,0.6263374090194702,0.5557230114936829,0.6704015135765076,0.0743206698218577
NBA: Stephen Curry inspires Golden State Warriors to victory over LA Clippers,2022,https://www.bbc.co.uk/sport/basketball/59441291,James Harden,0.2884615384615384,0.5616262257099152,0.511681079864502,0.6704015135765076,0.0201653152055458
Assume Nothing: The Heiress and The General: Episode 1: A Knock on the Door,2022,https://www.bbc.co.uk/programmes/m0014nkk,James Harden,0.05,0.508484959602356,0.5945009589195251,0.6704015135765076,0.0
NBA: Phoenix Suns secure 16th win in a row against Brooklyn Nets despite Kevin Durant heroics,2022,https://www.bbc.co.uk/sport/basketball/59449866,James Harden,0.13125,0.5399258434772491,0.5776343047618866,0.6704015135765076,0.0524657589506365
NBA: Denver Nuggets beat Los Angeles Lakers 133-96,2022,https://www.bbc.co.uk/sport/basketball/60014693,James Harden,0.131060606060606,0.5745255947113037,0.5772780179977417,0.6704015135765076,0.0460685519131716
NBA: Memphis Grizzlies beat Phoenix Suns by one point,2022,https://www.bbc.co.uk/sport/basketball/59807910,James Harden,0.253968253968254,0.6180501878261566,0.6151099503040314,0.6704015135765076,0.0485037770876397
NBA: LeBron James scores 26 points against his former side as the LA Lakers win again,2022,https://www.bbc.co.uk/sport/basketball/59101077,James Harden,0.1506684491978609,0.5136234909296036,0.5731551796197891,0.6704015135765076,0.0558897309643265
Your thoughts on West Ham's transfer window,2022,https://www.bbc.com/sport/articles/cnw8xlge4w6o,James Harden,0.0,0.5664896965026855,0.54401695728302,0.6704015135765076,0.0
LA Clippers snatch win over Washington Wizards in huge comeback,2022,https://www.bbc.co.uk/sport/basketball/60137437,James Harden,0.1984312825221916,0.6225281953811646,0.5366145968437195,0.6704015135765076,0.0385173726801479
NBA: Brooklyn Nets must manage Kevin Durant game time - Steve Nash,2022,https://www.bbc.co.uk/sport/basketball/59694810,James Harden,0.0708994708994709,0.6464297920465469,0.5706144124269485,0.6704015135765076,0.0389849403669242
NFL: Green Bay Packers end Arizona Cardinals' unbeaten start to the season,2022,https://www.bbc.co.uk/sport/american-football/59087320,James Harden,0.0595328282828282,0.5837049086888632,0.5429805318514506,0.6704015135765076,0.0135931323290683
Sheffield United v Middlesbrough: Chris Wilder return can not be 'distraction' - Paul Heckingbottom,2022,https://www.bbc.co.uk/sport/football/60651914,Chris Paul,0.1193722943722944,0.554773211479187,0.5878775914510092,0.6582393646240234,0.0592403410385362
"Scott Mills and Chris Stark: Judy Murray, Paul Chowdhry and Real Life TMO with Nigel Owens",2022,https://www.bbc.co.uk/programmes/m0013qq9,Chris Paul,0.0,0.5777468681335449,0.6657431125640869,0.6582393646240234,0.5170255136177138
Christy Pym: Stevenage boss Paul Tisdale signs Peterborough keeper on loan,2022,https://www.bbc.co.uk/sport/football/59803014,Chris Paul,0.2053571428571428,0.6125630736351013,0.5701692402362823,0.6582393646240234,0.0203076135654781
Omicron: Paul Givan 'doesn't envisage more restrictions before Christmas',2022,https://www.bbc.co.uk/news/uk-northern-ireland-59578050,Chris Paul,0.5,0.5587538480758667,0.6772780418395996,0.6582393646240234,0.4287892446517202
Cooking with Paula McIntyre: Christmas Party Food,2022,https://www.bbc.co.uk/programmes/p0b6q2hk,Chris Paul,0.0,0.5365381240844727,0.5897833704948425,0.6582393646240234,0.0
Comedy Club Extra: Christmas Crackers: Paul Garner,2022,https://www.bbc.co.uk/programmes/m0012myp,Chris Paul,0.0,0.6660783290863037,0.5862406492233276,0.6582393646240234,0.4287892446517202
Daily Service: 25/01/2022 Christian Unity - Shared Paths/The Feast of the Conversion of Saint Paul the Apostle,2022,https://www.bbc.co.uk/programmes/m0013sbf,Chris Paul,0.0,0.5462059378623962,0.635434627532959,0.6582393646240234,0.2457260404910359
NBA: Darius Garland's half-court shot & Brandon Ingram's game-winner - plays of the week,2022,https://www.bbc.co.uk/sport/av/basketball/60040625,Chris Paul,0.0,0.5995448231697083,0.6056988835334778,0.6582393646240234,0.0
The Countryside Hour: Countryside Extra: With Anna Perrott and Paul Stancliffe,2022,https://www.bbc.co.uk/programmes/p0bwhts3,Chris Paul,0.0,0.7739689946174622,0.6537106037139893,0.6582393646240234,0.3731854338896128
Rugby Union Weekly: Maro and the Mona Lisa,2022,https://www.bbc.co.uk/programmes/p0bw9gpk,Chris Paul,0.0,0.5776417255401611,0.6160233616828918,0.6582393646240234,0.0
Rugby Union Weekly: Vive Les Bleus!,2022,https://www.bbc.co.uk/programmes/p0bwg7wh,Chris Paul,0.0,0.5861669182777405,0.5394487380981445,0.6582393646240234,0.0
Louisa life raft failure led to deaths of three fishermen,2022,https://www.bbc.co.uk/news/uk-scotland-highlands-islands-60592172,Chris Paul,-0.3166666666666667,0.570974588394165,0.5985111594200134,0.6582393646240234,0.0
The Countryside Hour: Countryside Extra: Snooping on seagulls!,2022,https://www.bbc.co.uk/programmes/p0b87d3q,Chris Paul,0.0,0.5805344581604004,0.5114122629165649,0.6582393646240234,0.0
NBA: Golden State Warriors win fifth consecutive game as Toronto Raptors beat Miami Heat,2022,https://www.bbc.co.uk/sport/basketball/60180375,Kevin Porter Jr.,0.2106691919191919,0.5350878039995829,0.6161611278851827,0.6314601302146912,0.0384235252296325
Kyrie Irving: Brooklyn Nets point guard returns after vaccine controversy,2022,https://www.bbc.co.uk/sport/basketball/59891500,Kevin Porter Jr.,0.1795900178253119,0.5190092325210571,0.606272836526235,0.6314601302146912,0.0264576320870977
NBA: Oklahoma City Thunder earn late win as Golden State Warriors and Brooklyn Nets lose,2022,https://www.bbc.co.uk/sport/basketball/59709849,Kevin Porter Jr.,0.0735353535353535,0.5380986928939819,0.5644067128499349,0.6314601302146912,0.0317356271176182
NBA: Joel Embiid scores 34 points as Philadelphia 76ers beat Brooklyn Nets,2022,https://www.bbc.co.uk/sport/basketball/59836059,Bradley Beal,0.1889914772727272,0.5616957545280457,0.636453906695048,0.658525824546814,0.0164718545223184
NBA: James Harden and Kevin Durant shine in latest Brooklyn Nets win,2022,https://www.bbc.co.uk/sport/basketball/59244927,Bradley Beal,0.1732804232804232,0.5574850738048553,0.5814887583255768,0.658525824546814,0.0269395822906646
NBA: Chicago Bulls record fifth win in six games to end Utah Jazz's unbeaten start to season,2022,https://www.bbc.co.uk/sport/basketball/59108938,Bradley Beal,0.3551948051948052,0.6335578709840775,0.6068146675825119,0.658525824546814,0.0245694375304726
LA Lakers: Anthony Davis & Dwight Howard row during defeat by Phoenix Suns,2022,https://www.bbc.co.uk/sport/basketball/59020374,Anthony Davis,0.0574927849927849,0.5123245120048523,0.5294763445854187,0.6598507165908813,0.0376886679111716
NBA: Los Angeles Lakers beaten by New Orleans Pelicans in 'must-win' game,2022,https://www.bbc.co.uk/sport/basketball/60965085,Anthony Davis,0.051103896103896,0.5708823998769125,0.6207779248555502,0.6598507165908813,0.0543910043749299
NBA: Los Angeles Lakers beat Portland Trail Blazers to end losing run,2022,https://www.bbc.co.uk/sport/basketball/60240801,Anthony Davis,0.1866477272727272,0.6110094587008158,0.5675925016403198,0.6598507165908813,0.0150112143684966
NBA: LA Lakers fall to fifth defeat of the season with loss to Portland Trail Blazers,2022,https://www.bbc.co.uk/sport/basketball/59197184,Anthony Davis,0.1892857142857143,0.5368487238883972,0.5296834508577982,0.6598507165908813,0.048872843164417
NBA All-Star Game: Stephen Curry sets record as Team LeBron win 163-160 against Team Durant,2022,https://www.bbc.co.uk/sport/basketball/60459972,Anthony Davis,0.0140350877192982,0.556593120098114,0.5245695114135742,0.6598507165908813,0.0619123207099146
NBA: Stephen Curry scores 50 as Golden State Warriors beat Atlanta Hawks,2022,https://www.bbc.co.uk/sport/basketball/59209614,Anthony Davis,0.1454545454545455,0.534316211938858,0.5358834713697433,0.6598507165908813,0.0511951368734633
Jess Fishlock: Wales midfielder signs new deal to stay at OL Reign,2022,https://www.bbc.co.uk/sport/football/60092288,Anthony Davis,0.2384995791245791,0.5462077856063843,0.5715441306432089,0.6598507165908813,0.0172622908729506
Karl-Anthony Towns records season-high NBA score in Minnesota Timberwolves win,2022,https://www.bbc.co.uk/sport/basketball/60747632,Anthony Davis,0.2649999999999999,0.5938571840524673,0.5789114534854889,0.6598507165908813,0.0131580755409235
Stormtrooper funeral procession in Ashbourne for Star Wars fan,2022,https://www.bbc.co.uk/news/uk-england-derbyshire-59898678,Anthony Davis,0.0,0.6317400336265564,0.6296647787094116,0.6598507165908813,0.0
Radio 3 in Concert: Sir Andrew Davisâs Half Century,2022,https://www.bbc.co.uk/programmes/m0014h1s,Anthony Davis,-0.1666666666666666,0.5335716009140015,0.5044471621513367,0.6598507165908813,0.0
Bournemouth 4-0 Swansea City,2022,https://www.bbc.co.uk/sport/football/59099842,Anthony Davis,0.0254172423321359,0.5562305375933647,0.573703721165657,0.6598507165908813,0.0633289828645585
NBA: Atlanta Hawks end Phoenix Suns' streak while Los Angeles Lakers beaten,2022,https://www.bbc.co.uk/sport/basketball/60256924,Anthony Davis,0.241111111111111,0.5552259286244711,0.5324150323867798,0.6598507165908813,0.046966861000414
Madchester icons feature in new photo book,2022,https://www.bbc.co.uk/news/uk-england-manchester-60794991,Anthony Davis,0.1363636363636363,0.5509871244430542,0.6927645206451416,0.6598507165908813,0.0
NBA: Minnesota Timberwolves take advantage of injury-hit Golden State Warriors,2022,https://www.bbc.co.uk/sport/basketball/60000308,Anthony Davis,0.0780103668261563,0.5669058561325073,0.5796586473782858,0.6598507165908813,0.0160135684981235
NBA: Joel Embiid helps Philadelphia 76ers to win over Los Angeles Lakers,2022,https://www.bbc.co.uk/sport/basketball/60166399,Anthony Davis,0.0516645988420181,0.6077397018671036,0.5471397042274475,0.6598507165908813,0.0408009998549038
NFL: How Buffalo Bills' Josh Allen was a nightmare for the New England Patriots,2022,https://www.bbc.co.uk/sport/av/american-football/60054585,Jarrett Allen,0.1363636363636363,0.718844473361969,0.5652702450752258,0.6522888541221619,0.330347222207479
NFL play-offs: Green Bay Packers and Tennessee Titans enter divisional round,2022,https://www.bbc.co.uk/sport/american-football/60084688,Jarrett Allen,0.147789480860347,0.5499774217605591,0.5699630796909332,0.6522888541221619,0.030796104659461
NBA All-Star Game: Stephen Curry sets record as Team LeBron win 163-160 against Team Durant,2022,https://www.bbc.co.uk/sport/basketball/60459972,Jarrett Allen,0.0140350877192982,0.6661035021146139,0.5796330571174622,0.6522888541221619,0.0357981746073038
NBA: Giannis Antetokounmpo stars as the Bucks beat the Lakers,2022,https://www.bbc.co.uk/sport/basketball/59316347,Jarrett Allen,0.3303977272727272,0.5786261757214864,0.6056493520736694,0.6522888541221619,0.0190949090797467
NFL: Green Bay Packers end Arizona Cardinals' unbeaten start to the season,2022,https://www.bbc.co.uk/sport/american-football/59087320,Jarrett Allen,0.0595328282828282,0.529852012793223,0.5711581905682882,0.6522888541221619,0.0303799301486446
NFL play-offs: Profiles and ones to watch for eight teams in divisional round,2022,https://www.bbc.co.uk/sport/american-football/60088341,Jarrett Allen,0.1416967361476032,0.5792244921127955,0.6040604213873545,0.6522888541221619,0.0216928074093996
NFL play-offs: Kansas City Chiefs and Los Angeles Rams win thrillers,2022,https://www.bbc.co.uk/sport/american-football/60106118,Jarrett Allen,0.1599968759762574,0.6037903353571892,0.56556436419487,0.6522888541221619,0.0161076217980584
NFL: Russell Wilson joins Denver Broncos - 2022's biggest free-agency deals,2022,https://www.bbc.co.uk/sport/american-football/60743512,Jarrett Allen,0.1278804528804528,0.5562881231307983,0.5660537630319595,0.6522888541221619,0.0103069625074569
Super Bowl 2022: Rams find recipe for success but are Bengals built better for the future?,2022,https://www.bbc.co.uk/sport/american-football/60362408,Jarrett Allen,0.1724153280145016,0.5913851062456766,0.5810731914308336,0.6522888541221619,0.0143342208355449
NFL play-offs: Profiles and ones to watch for four teams in Conference Championships,2022,https://www.bbc.co.uk/sport/american-football/60169610,Jarrett Allen,0.1885224424698109,0.5793671878901395,0.5976560061628168,0.6522888541221619,0.0118486233404236
"NFL play-offs: San Francisco 49ers, Kansas City Chiefs and Tampa Bay Buccaneers win",2022,https://www.bbc.co.uk/sport/american-football/60019066,Jarrett Allen,0.1108524808524807,0.5543090403079987,0.5836100876331329,0.6522888541221619,0.0054022158383044
NFL play-offs: Kansas City Chiefs target third straight Super Bowl in Conference Championships,2022,https://www.bbc.co.uk/sport/american-football/60169849,Jarrett Allen,0.0722063968526233,0.5602411746978759,0.5879958152770997,0.6522888541221619,0.0094675686353358
NBA: Cleveland Cavaliers fight back to stun Boston Celtics,2022,https://www.bbc.co.uk/sport/basketball/59280176,Jerami Grant,0.1695481601731601,0.5700976401567459,0.5573689788579941,0.6636868715286255,0.0128067430530361
NBA: Chicago Bulls record fifth win in six games to end Utah Jazz's unbeaten start to season,2022,https://www.bbc.co.uk/sport/basketball/59108938,Jerami Grant,0.3551948051948052,0.624375969171524,0.566466823220253,0.6636868715286255,0.0245694375304726
MVP to become champion? Leon Edwards to get UFC title shot? - Big MMA predictions for 2022,2022,https://www.bbc.co.uk/sport/mixed-martial-arts/59936475,Jerami Grant,0.2096969696969697,0.6265454813838005,0.5607557073235512,0.6636868715286255,0.0115641885225393
NBA: Los Angeles Lakers end lengthy away losing steak with victory over Toronto Raptors,2022,https://www.bbc.co.uk/sport/basketball/60804955,Lauri Markkanen,0.0719696969696969,0.655868262052536,0.5891197919845581,0.6593359112739563,0.0227116114952837
NBA: Blazers beat Lakers as Jazz end Warriors' winning run,2022,https://www.bbc.co.uk/sport/basketball/60322237,Domantas Sabonis,0.2576923076923076,0.619334896405538,0.5632441242535909,0.6425268054008484,0.0370367013727415
NBA round-up: Stephen Curry helps Golden State Warriors beat Orlando Magic,2022,https://www.bbc.co.uk/sport/basketball/59559633,Domantas Sabonis,0.1843749999999999,0.5841523557901382,0.6173583567142487,0.6425268054008484,0.0130981875739866
NBA: Phoenix Suns beat Golden State Warriors 107-103 to equal win record,2022,https://www.bbc.co.uk/sport/basketball/60938026,Dorian Finney-Smith,0.1769230769230769,0.5935041705767313,0.6535835663477579,0.6518751382827759,0.0464013618250436
NBA: Stephen Curry scores 40 points as Golden State Warriors win sixth game in a row,2022,https://www.bbc.co.uk/sport/basketball/60200633,Luguentz Dort,0.223063973063973,0.5772239863872528,0.5836659669876099,0.6398253440856934,0.0260650022233861
NBA: Stephen Curry passes Ray Allen's three-pointers mark as Golden State Warriors win,2022,https://www.bbc.co.uk/sport/basketball/59273283,Luguentz Dort,0.253958944281525,0.5999170899391174,0.5957743167877197,0.6398253440856934,0.0097981266186092
HARDtalk: Damian Collins: Can Boris Johnson be trusted?,2022,https://www.bbc.co.uk/programmes/w3ct1n2f,John Collins,0.0,0.5787655115127563,0.5147625207901001,0.6618726253509521,0.5038638531307786
NBA: Marcus Smart on Stephen Curry injury - 'I'm not a dirty player',2022,https://www.bbc.co.uk/sport/basketball/60776514,Marcus Smart,0.0506960359901536,0.5718098431825638,0.5372007191181183,0.6863147020339966,0.082960039080178
Leicester 4-2 Man Utd: In pictures,2022,https://www.bbc.com/sport/articles/c8zzj8ej457o,Marcus Smart,0.0,0.679931104183197,0.640936553478241,0.6863147020339966,0.0
Portsmouth 2-1 AFC Wimbledon,2022,https://www.bbc.co.uk/sport/football/59271173,Marcus Smart,0.1330782312925169,0.5915510296821594,0.6426433563232422,0.6863147020339966,0.0360661906913078
England v Australia: Maro Itoje - Rugby has to be the main thing,2022,https://www.bbc.co.uk/sport/rugby-union/59251939,Marcus Smart,0.1615221088435374,0.5475441614786783,0.5659695267677307,0.6863147020339966,0.0637480067969576
Cambridge United 0-0 Portsmouth: 27 minutes of stoppage time after fan taken ill,2022,https://www.bbc.co.uk/sport/football/59798461,Marcus Smart,0.077517006802721,0.6544396638870239,0.5641088128089905,0.6863147020339966,0.0459039308484082
NBA: Giannis Antetokounmpo scores 44 in Milwaukee Bucks' win over LA Lakers,2022,https://www.bbc.co.uk/sport/basketball/60314854,Marcus Smart,0.1077430145611963,0.6046958565711975,0.5478346745173136,0.6863147020339966,0.0144098984202639
Super League: Salford Red Devils 38-12 Toulouse Olympique - Ken Sio runs in four tries,2022,https://www.bbc.co.uk/sport/rugby-league/60425238,Marcus Smart,0.1101505312868949,0.5814947366714478,0.5408764481544495,0.6863147020339966,0.0278346250391558
Heineken Champions Cup: Cardiff 33-36 Harlequins,2022,https://www.bbc.co.uk/sport/rugby-union/59976805,Marcus Smart,0.1090960626674912,0.5944949189821879,0.5802743037541708,0.6863147020339966,0.0107692297159049
Middlesbrough 2-1 Reading: Matt Crooks double gives Boro victory,2022,https://www.bbc.co.uk/sport/football/59918618,Marcus Smart,0.1186677933938208,0.5507780654089791,0.5706781915255955,0.6863147020339966,0.0285565104584801
Cardiff City 0-2 Middlesbrough: Boro defeat ends Mick McCarthy tenure,2022,https://www.bbc.co.uk/sport/football/58935823,Marcus Smart,0.1012537310482516,0.5673388923917498,0.5572759338787624,0.6863147020339966,0.0276350275877671
Winners and losers from England's autumn Tests,2022,https://www.bbc.co.uk/sport/rugby-union/59369204,Marcus Smart,0.1469259828222092,0.54485684633255,0.5772288271359035,0.6863147020339966,0.0144200372111725
England clinch dramatic 27-26 win over South Africa at Twickenham,2022,https://www.bbc.co.uk/sport/rugby-union/59361364,Marcus Smart,0.1391417847753464,0.572745853000217,0.5743586818377177,0.6863147020339966,0.0113999895007109
NBA: Stephen Curry leads Warriors win with 46 points,2022,https://www.bbc.co.uk/sport/basketball/59775265,Kyle Lowry,0.1395123106060606,0.527275025844574,0.5540271103382111,0.6734214425086975,0.0377059923684876
NBA preview: 75th anniversary season set up to be one of the greats,2022,https://www.bbc.co.uk/sport/basketball/58915171,Kyle Lowry,0.146480151054619,0.5852688401937485,0.5557918474078178,0.6734214425086975,0.0280679957089245
NBA: Phoenix Suns beat Golden State Warriors 107-103 to equal win record,2022,https://www.bbc.co.uk/sport/basketball/60938026,Kyle Lowry,0.1769230769230769,0.6120872497558594,0.5814024011294047,0.6734214425086975,0.0464013618250436
Houston Astros beat Boston Red Sox to reach World Series against Braves or Dodgers,2022,https://www.bbc.co.uk/sport/baseball/59020639,Kyle Lowry,0.0236492673992673,0.5190151333808899,0.5849241614341736,0.6734214425086975,0.0158373158363789
NBA: LA Lakers fall to fifth defeat of the season with loss to Portland Trail Blazers,2022,https://www.bbc.co.uk/sport/basketball/59197184,Kyle Lowry,0.1892857142857143,0.5670916636784872,0.6007972757021586,0.6734214425086975,0.0325342839300885
NBA: Cleveland Cavaliers fight back to stun Boston Celtics,2022,https://www.bbc.co.uk/sport/basketball/59280176,Kyle Lowry,0.1695481601731601,0.5755415707826614,0.6070234477519989,0.6734214425086975,0.0286201325211975
NFL play-offs: Profiles and ones to watch for four teams in Conference Championships,2022,https://www.bbc.co.uk/sport/american-football/60169610,Kyle Lowry,0.1885224424698109,0.5671618743376299,0.5652876767245206,0.6734214425086975,0.0197617280830049
Irish Premiership: Crusaders put major dent in Glens' title hopes with 4-0 win,2022,https://www.bbc.co.uk/sport/football/61052566,Kyle Lowry,0.0571281599059376,0.5314411095210484,0.5587431277547564,0.6734214425086975,0.0202348794477042
NFL play-offs: Profiles and ones to watch for eight teams in divisional round,2022,https://www.bbc.co.uk/sport/american-football/60088341,Kyle Lowry,0.1416967361476032,0.5815812945365906,0.6199713399012884,0.6734214425086975,0.0144524838592459
Irish Premiership: Cliftonville beat title rivals Glentoran as 10-man Linfield stay top,2022,https://www.bbc.co.uk/sport/football/60668626,Kyle Lowry,0.1052043422733078,0.5754701097806295,0.5918812950452169,0.6734214425086975,0.0101082527792303
