title,date,url,player,textblob_sentiment,relevance_score
NBA: San Antonio Spurs beat Cleveland Cavaliers as Keldon Johnson blocks late shot,2023,https://www.bbc.co.uk/sport/basketball/63954218,Bam Adebayo,0.1923076923076923,0.009805925161440061
NBA: Stephen Curry inspires late Golden State Warriors win over the Milwaukee Bucks,2023,https://www.bbc.co.uk/sport/av/basketball/64932148,Stephen Curry,0.2666666666666666,0.23246787325868903
NBA: Stephen Curry inspires Golden State Warriors against Milwaukee Bucks,2023,https://www.bbc.co.uk/sport/basketball/64930824,Stephen Curry,0.1688311688311688,0.006074755761331168
"NBA: Stephen Curry ruled out indefinitely with knee injury, Kyrie Irving reportedly set for Dallas Mavericks trade",2023,https://www.bbc.co.uk/sport/basketball/64535246,Stephen Curry,0.0503787878787878,0.022983752062154934
Stephen Curry injured as Golden State Warriors lose again,2023,https://www.bbc.co.uk/sport/basketball/63982850,Stephen Curry,0.0890873015873015,0.015685668351133733
Stephen Curry: Point guard scores 24 as Golden State Warriors beat New York Knicks,2023,https://www.bbc.co.uk/sport/basketball/63686873,Stephen Curry,0.1914918414918415,0.008305533146419238
NBA: Stephen Curry 'lights the fire' as Golden State Warriors beat Sacramento Kings,2023,https://www.bbc.co.uk/sport/basketball/63553732,Stephen Curry,0.2186443932411673,0.0178045566449683
NBA: Stephen Curry scores 33 points as Warriors beat Lakers in season opener,2023,https://www.bbc.co.uk/sport/basketball/63310729,Stephen Curry,0.0286671661671661,0.012629242861718144
NBA: Ja Morant inspires Memphis Grizzlies win while Stephen Curry stars in Golden State Warriors loss,2023,https://www.bbc.co.uk/sport/basketball/63355733,Stephen Curry,0.1306998556998557,0.02662576494167681
NBA: Dallas Mavericks stars Luka Doncic and Kyrie Irving combine for second win together,2023,https://www.bbc.co.uk/sport/basketball/64833608,Stephen Curry,0.1416112657184086,0.01602173027017214
"Robinson on O'Hara, building for the future & new recruit Boyd-Munce",2023,https://www.bbc.com/sport/articles/c51j86n40pgo,Stephen Curry,0.0681818181818181,0.0
Steph Curry thanks Biden for bringing Griner home,2023,https://www.bbc.co.uk/news/64313215,Stephen Curry,0.2,0.16175630366222588
NBA: Golden State Warriors lose to Detroit Pistons after late three-pointer,2023,https://www.bbc.co.uk/sport/basketball/64172182,Stephen Curry,-0.0105842911877394,0.012859450600078046
NBA: LeBron James & Steph Curry both star as Golden State Warriors beat Los Angeles Lakers,2023,https://www.bbc.co.uk/sport/av/basketball/63314331,Stephen Curry,0.3,0.08540518907021721
LeBron James breaks NBA all-time scoring record,2023,https://www.bbc.co.uk/sport/basketball/64563131,Stephen Curry,0.1825086125086125,0.014383119635881717
NBA: Joel Embiid scores 38 points as Philadelphia 76ers beat Cleveland Cavaliers,2023,https://www.bbc.co.uk/sport/basketball/64974061,Stephen Curry,0.2004464285714285,0.007883355415817025
NBA: Giannis Antetokounmpo leads Milwaukee Bucks to win on injury return,2023,https://www.bbc.co.uk/sport/basketball/64948897,Stephen Curry,0.0838888888888888,0.007660836990491059
NBA: Golden State Warriors v LA Lakers & other key talking points for new season,2023,https://www.bbc.co.uk/sport/basketball/63287260,Stephen Curry,0.1064141414141414,0.014472421554083202
NBA: Damian Lillard scores season-high 60 points as Portland Trail Blazers beat Utah Jazz,2023,https://www.bbc.co.uk/sport/basketball/64409544,Stephen Curry,-0.0925925925925926,0.019318754566700572
Irish Premiership: Paul McElroy hat-trick helps Portadown beat Swifts to close gap at bottom,2023,https://www.bbc.co.uk/sport/football/64766315,Stephen Curry,-0.0358878968253968,0.005079879755815905
NBA: Giannis Antetokounmpo leads Bucks to win over Warriors,2023,https://www.bbc.co.uk/sport/basketball/63968476,Stephen Curry,0.0017512077294686,0.014217659811444176
Mornings: with Stephen Jardine,2023,https://www.bbc.co.uk/programmes/m001g9bv,Stephen Curry,0.0,0.4003781916689017
NBA: Miami Heat set free-throw record in 112-111 win over Oklahoma City Thunder,2023,https://www.bbc.co.uk/sport/basketball/64233233,Stephen Curry,0.2002430555555555,0.01285945060007805
NBA: Golden State Warriors thrash San Antonio Spurs in front of record crowd,2023,https://www.bbc.co.uk/sport/basketball/64273731,Stephen Curry,0.0885416666666666,0.018297547788834655
NBA: Brooklyn Nets stun Boston Celtics 115-105 in biggest comeback win this season,2023,https://www.bbc.co.uk/sport/basketball/64846501,Stephen Curry,0.2053030303030302,0.011625474543331887
NBA: Luka Doncic leads Dallas Mavericks to win over Golden State Warriors,2023,https://www.bbc.co.uk/sport/basketball/63804650,Stephen Curry,-0.0375811688311688,0.00922279206631064
NBA: Sacramento Kings beat LA Clippers in 'crazy' 176-175 history-making game,2023,https://www.bbc.co.uk/sport/basketball/64769116,Stephen Curry,0.0563492063492063,0.011514978317793117
NBA: Los Angeles Lakers beaten by Portland Trail Blazers as losing start continues,2023,https://www.bbc.co.uk/sport/basketball/63370829,Stephen Curry,0.0082491582491582,0.010833374164128617
NBA: Chicago Bulls end Boston Celtics' nine-game winning streak,2023,https://www.bbc.co.uk/sport/basketball/63713182,Stephen Curry,0.1553719008264463,0.018867462693233094
NBA: LA Lakers rally to topple Golden State Warriors despite LeBron James absence,2023,https://www.bbc.co.uk/sport/basketball/64615897,LeBron James,0.1351239669421487,0.008775487258642736
LeBron James breaks NBA all-time scoring record,2023,https://www.bbc.co.uk/sport/basketball/64563131,LeBron James,0.1825086125086125,0.037939120868425914
LeBron James' high-school coach says 'he never missed practice',2023,https://www.bbc.co.uk/sport/av/basketball/64576697,LeBron James,0.0,0.3264193850711613
5 Live Sport: All About...: LeBron James,2023,https://www.bbc.co.uk/programmes/p0f1v4v0,LeBron James,0.1363636363636363,0.7078600094071774
LeBron James' NBA record: How will it help British basketball?,2023,https://www.bbc.co.uk/news/newsbeat-64573713,LeBron James,0.0,0.3772396478685253
LeBron James on breaking the NBA scoring record,2023,https://www.bbc.co.uk/sport/av/basketball/64517393,LeBron James,0.0,0.44680234416484166
Watch LeBron James break NBA all-time scoring record,2023,https://www.bbc.co.uk/sport/av/basketball/64567857,LeBron James,0.0,0.3264193850711613
LeBron James breaks NBA scoring record - Dwight Howard on the LA Lakers' legend's legacy,2023,https://www.bbc.co.uk/sport/av/basketball/64512636,LeBron James,0.0,0.2121170426507163
NBA: LeBron James scores first triple-double of season to move close to all-time scoring record,2023,https://www.bbc.co.uk/sport/basketball/64481152,LeBron James,0.106060606060606,0.016033149940890286
NBA: LeBron James denied foul seconds before buzzer,2023,https://www.bbc.co.uk/sport/av/basketball/64453226,LeBron James,0.0,0.3772396478685253
NBA: Officials miss foul on LeBron James as LA Lakers lose to Boston Celtics,2023,https://www.bbc.co.uk/sport/basketball/64443930,LeBron James,0.1354545454545454,0.0052519028743840965
NBA results round-up: LeBron James closes on record but Lakers lose to Clippers,2023,https://www.bbc.co.uk/sport/basketball/64396495,LeBron James,0.1953217237308146,0.013792503645297409
NBA round-up: LeBron James inspires comeback win for the Los Angeles Lakers,2023,https://www.bbc.co.uk/sport/basketball/64370555,LeBron James,0.064,0.013205313800538748
LeBron James' LA Lakers accuse NBA of cheating after 'gut-wrenching' referee error,2023,https://www.bbc.co.uk/sport/basketball/64450359,LeBron James,-0.032161753590325,0.027875430128638502
NBA: LeBron James scores season-high 48 points in Los Angeles Lakers win,2023,https://www.bbc.co.uk/sport/basketball/64301044,LeBron James,0.1433155080213903,0.012520007855443117
NBA: LeBron James scores 47 points in Los Angeles Lakers win over Atlanta Hawks,2023,https://www.bbc.co.uk/sport/basketball/64134392,LeBron James,-0.0138461538461538,0.015138836024741786
LeBron James: LA Lakers player becomes NBA's all-time leading points scorer,2023,https://www.bbc.co.uk/newsround/64553059,LeBron James,0.0,0.23246787325868903
LeBron James reacts to Damar Hamlin incident,2023,https://www.bbc.co.uk/news/world-us-canada-64155817,LeBron James,0.0,0.44680234416484166
Newsbeat: LeBron James,2023,https://www.bbc.co.uk/programmes/m001hl0v,LeBron James,0.0,1.0
NBA: LeBron James passes Magic Johnson on all-time assists list,2023,https://www.bbc.co.uk/sport/basketball/63844768,LeBron James,0.0868421052631579,0.006927562477656798
NBA: LeBron James returns as LA Lakers beat San Antonio Spurs,2023,https://www.bbc.co.uk/sport/basketball/63766296,LeBron James,0.1808333333333333,0.018181231664431974
NBA: Los Angeles Lakers win as LeBron James and Anthony Davis star,2023,https://www.bbc.co.uk/sport/basketball/63453775,LeBron James,0.1636363636363636,0.012859450600078079
NBA: LeBron James & Steph Curry both star as Golden State Warriors beat Los Angeles Lakers,2023,https://www.bbc.co.uk/sport/av/basketball/63314331,LeBron James,0.3,0.19504252269618982
Six Nations 2023: Quickfire questions for Six Nations captains,2023,https://www.bbc.co.uk/sport/av/football/64451791,LeBron James,0.0,0.0
LA Lakers beat Denver Nuggets 121-110 to claim first win of season,2023,https://www.bbc.co.uk/sport/av/basketball/63456003,LeBron James,0.525,0.0
NBA: Los Angeles Lakers beaten by Portland Trail Blazers as losing start continues,2023,https://www.bbc.co.uk/sport/basketball/63370829,LeBron James,0.0082491582491582,0.010833374164128615
Joel Embiid: Philadelphia 76ers centre scores 59 points in win over Utah Jazz,2023,https://www.bbc.co.uk/sport/basketball/63620537,Darius Garland,0.1363636363636363,0.017892205736970448
NBA: San Antonio Spurs beat Cleveland Cavaliers as Keldon Johnson blocks late shot,2023,https://www.bbc.co.uk/sport/basketball/63954218,Darius Garland,0.1923076923076923,0.009805925161440061
NBA: Kyrie Irving and Brooklyn Nets pledge $1m after criticism over anti-Semitism,2023,https://www.bbc.co.uk/sport/basketball/63495933,Darius Garland,-0.0063095238095238,0.009060613047471145
Luka Doncic scores magical 60-point triple-double in Dallas Mavericks win,2023,https://www.bbc.co.uk/sport/basketball/64107654,Kyle Kuzma,0.2051156728576083,0.005752848750035873
NFL week 10: Minnesota Vikings stun Buffalo Bills plus more magic from Mahomes,2023,https://www.bbc.co.uk/sport/american-football/63618573,Dejounte Murray,0.1424561945990518,0.008687043840584737
NFL week 14: Eagles make play-offs & rookie Brock Purdy beats Tom Brady,2023,https://www.bbc.co.uk/sport/american-football/63939620,Dejounte Murray,0.1955689814194968,0.004153104015151214
NBA: Zion Williamson scores 43 points as Pelicans beat Timberwolves,2023,https://www.bbc.co.uk/sport/basketball/64114841,CJ McCollum,0.1515151515151515,0.01279156312346842
NBA: Klay Thompson ejected in Phoenix Suns win over Golden State Warriors,2023,https://www.bbc.co.uk/sport/basketball/63397347,Klay Thompson,0.1150285320739866,0.03247009551193617
NBA: Golden State Warriors lose to Detroit Pistons after late three-pointer,2023,https://www.bbc.co.uk/sport/basketball/64172182,Klay Thompson,-0.0105842911877394,0.022238485602749127
NBA: Giannis Antetokounmpo leads Milwaukee Bucks to win on injury return,2023,https://www.bbc.co.uk/sport/basketball/64948897,Klay Thompson,0.0838888888888888,0.007660836990491059
Damian Lillard scores 71 points as Portland Trail Blazers beat Houston Rockets,2023,https://www.bbc.co.uk/sport/basketball/64782882,Klay Thompson,0.0993241167434715,0.01306750649591128
NBA: Sacramento Kings beat LA Clippers in 'crazy' 176-175 history-making game,2023,https://www.bbc.co.uk/sport/basketball/64769116,Klay Thompson,0.0563492063492063,0.0051522044209233045
NBA: Golden State Warriors thrash San Antonio Spurs in front of record crowd,2023,https://www.bbc.co.uk/sport/basketball/64273731,Klay Thompson,0.0885416666666666,0.018297547788834655
NBA: Brooklyn Nets stun Boston Celtics 115-105 in biggest comeback win this season,2023,https://www.bbc.co.uk/sport/basketball/64846501,Klay Thompson,0.2053030303030302,0.005201575962190617
NBA: Luka Doncic leads Dallas Mavericks to win over Golden State Warriors,2023,https://www.bbc.co.uk/sport/basketball/63804650,Klay Thompson,-0.0375811688311688,0.02063493636117982
NBA: Chicago Bulls end Boston Celtics' nine-game winning streak,2023,https://www.bbc.co.uk/sport/basketball/63713182,Klay Thompson,0.1553719008264463,0.018867462693233094
Stephen Curry: Point guard scores 24 as Golden State Warriors beat New York Knicks,2023,https://www.bbc.co.uk/sport/basketball/63686873,Klay Thompson,0.1914918414918415,0.018578135499251962
NBA: Kyrie Irving helps Brooklyn Nets beat Memphis Grizzlies 127-115 on return from suspension,2023,https://www.bbc.co.uk/sport/basketball/63699344,Klay Thompson,0.2286096256684492,0.0070627682776093145
NBA: Defending champions Golden State Warriors beat Boston Celtics in Finals rematch,2023,https://www.bbc.co.uk/sport/basketball/63933734,Klay Thompson,0.0985780423280423,0.011795253101883575
Kyrie Irving: Nike suspend sponsorship deal with Brooklyn Nets player,2023,https://www.bbc.co.uk/sport/basketball/63525097,Klay Thompson,0.1093344155844155,0.011460514151545125
NBA: Stephen Curry 'lights the fire' as Golden State Warriors beat Sacramento Kings,2023,https://www.bbc.co.uk/sport/basketball/63553732,Klay Thompson,0.2186443932411673,0.011852953322266949
Laureus Awards: Lionesses nominated for World Team of the Year,2023,https://www.bbc.co.uk/sport/64700054,Klay Thompson,0.1143286311389759,0.003364084442502204
NBA: Stephen Curry scores 33 points as Warriors beat Lakers in season opener,2023,https://www.bbc.co.uk/sport/basketball/63310729,Klay Thompson,0.0286671661671661,0.003149383581153665
World Baseball Classic: Great Britain to make historic debut against USA,2023,https://www.bbc.co.uk/sport/baseball/64880237,Klay Thompson,0.156074384720218,0.002015232174690667
NBA: Eleven Orlando Magic & Detroit Pistons players suspended after scuffle,2023,https://www.bbc.co.uk/sport/basketball/64124245,Franz Wagner,0.1034902597402597,0.04283530541276215
Afternoon Concert: Saint-Saens's Organ Symphony,2023,https://www.bbc.co.uk/programmes/m001d6b8,Franz Wagner,0.0,0.0
"Through the Night: Dani Howard, Mahler and Brahms from Beijing",2023,https://www.bbc.co.uk/programmes/m001j4rs,Franz Wagner,0.0,0.0
Through the Night: James Ehnes plays Prokofiev,2023,https://www.bbc.co.uk/programmes/m001gtqq,Franz Wagner,0.0,0.0
Through the Night: Behzod Abduraimov plays Rachmaninovâs Paganini Variations,2023,https://www.bbc.co.uk/programmes/m001jlcz,Franz Wagner,0.0,0.0
Through the Night: Wagner and Liszt,2023,https://www.bbc.co.uk/programmes/m001fnvz,Franz Wagner,0.0,0.4003781916689017
Through the Night: The Fairy Queen,2023,https://www.bbc.co.uk/programmes/m001hg44,Franz Wagner,0.0,0.0
"NBA: Brooklyn Nets find 'solace' in wins after tumultuous week, says Kevin Durant",2023,https://www.bbc.co.uk/sport/basketball/63532635,Terry Rozier,0.089537037037037,0.005490974065996324
NBA: LA Lakers rally to topple Golden State Warriors despite LeBron James absence,2023,https://www.bbc.co.uk/sport/basketball/64615897,Domantas Sabonis,0.1351239669421487,0.01963180403055069
NBA: Golden State Warriors thrash San Antonio Spurs in front of record crowd,2023,https://www.bbc.co.uk/sport/basketball/64273731,Domantas Sabonis,0.0885416666666666,0.018297547788834655
NBA: Miami Heat set free-throw record in 112-111 win over Oklahoma City Thunder,2023,https://www.bbc.co.uk/sport/basketball/64233233,Jimmy Butler,0.2002430555555555,0.017311475912618026
NBA: LeBron James passes Magic Johnson on all-time assists list,2023,https://www.bbc.co.uk/sport/basketball/63844768,Jimmy Butler,0.0868421052631579,0.023278161669576258
NBA: San Antonio Spurs beat Cleveland Cavaliers as Keldon Johnson blocks late shot,2023,https://www.bbc.co.uk/sport/basketball/63954218,Jimmy Butler,0.1923076923076923,0.02194303823289935
Oscars 2023: Who will win and how to watch the ceremony,2023,https://www.bbc.co.uk/news/entertainment-arts-64857431,Jimmy Butler,0.8,0.0
NFL week 13: San Francisco 49ers beat Miami Dolphins while Deshaun Watson wins on return from suspension,2023,https://www.bbc.co.uk/sport/american-football/63855156,Jimmy Butler,0.0954148199683913,0.008579387411509532
"NFL play-offs: Patrick Mahomes, Josh Allen and Tom Brady aim for Super Bowl 57",2023,https://www.bbc.co.uk/sport/american-football/64233581,Jimmy Butler,0.0964555293191656,0.006722701829529507
NFL play-offs: Patrick Mahomes aims to overcome injury and reach Super Bowl 57,2023,https://www.bbc.co.uk/sport/american-football/64396384,Jimmy Butler,0.0992617908407382,0.006431255832829076
NFL play-offs: Remarkable rise of San Francisco 49ers' 'Mr Irrelevant' Brock Purdy,2023,https://www.bbc.co.uk/sport/american-football/64348673,Jimmy Butler,0.1655313051146385,0.003943563973489212
Oscar nominations 2023: Top Gun leads sequels surge,2023,https://www.bbc.co.uk/news/entertainment-arts-64371559,Jimmy Butler,0.5,0.0
Rugby League World Cup: Papua New Guinea 36-0 Wales - Kumuls seal quarter-final against England,2023,https://www.bbc.co.uk/sport/rugby-league/63464967,Jimmy Butler,0.0295145927920318,0.0061380050591608335
"Any Questions?: Stephen Bush, Thangam Debbonaire MP, Paul Drechsler, George Freeman MP",2023,https://www.bbc.co.uk/programmes/m001f5kl,Paul George,0.0,0.23246787325868903
"Any Questions? and Any Answers?: AQ: Stephen Bush, Thangam Debbonaire MP, Paul Drechsler, George Freeman MP",2023,https://www.bbc.co.uk/programmes/p0dh9kxp,Paul George,0.0,0.1950425226961897
Stuart George: Paula White sits in (25/01/2023),2023,https://www.bbc.co.uk/programmes/p0dvb8zg,Paul George,0.0,0.1900774225287333
Sao Paulo Grand Prix: Emotional George Russell savours the journey to victory,2023,https://www.bbc.co.uk/sport/formula1/63617920,Paul George,0.1626666935310552,0.0021112494506347165
Sao Paulo Grand Prix: George Russell beats Lewis Hamilton to first full Formula 1 win,2023,https://www.bbc.co.uk/sport/formula1/63617916,Paul George,0.0429150132275132,0.0
Sao Paulo Grand Prix: George Russell pole a 'milestone' for Mercedes,2023,https://www.bbc.co.uk/sport/formula1/63611036,Paul George,0.2066564185990937,0.002844108026216494
Sao Paulo Grand Prix sprint: George Russell takes first win,2023,https://www.bbc.co.uk/sport/formula1/63610213,Paul George,0.1065873015873015,0.0
The John Toal Show: Captain Matt Neill; Lonesome George; Let Them Lie; Psychology of Christmas; Chef Paula McIntyre,2023,https://www.bbc.co.uk/programmes/m001g1y5,Paul George,0.0,0.07379452513291654
Stuart George: Paula White sits in (01/11/2022),2023,https://www.bbc.co.uk/programmes/p0d4zzr9,Paul George,0.0,0.1900774225287333
King George VI Chase: Bravemansgame lands King George VI Chase,2023,https://www.bbc.co.uk/sport/horse-racing/64094636,Paul George,0.1712282847023107,0.006798148156156476
NBA: San Antonio Spurs beat Cleveland Cavaliers as Keldon Johnson blocks late shot,2023,https://www.bbc.co.uk/sport/basketball/63954218,Keldon Johnson,0.1923076923076923,0.029571892205871933
Nikola Jokic scores 100th career triple-double as Denver Nuggets beat Houston Rockets,2023,https://www.bbc.co.uk/sport/basketball/64808299,Keldon Johnson,0.2544456845238095,0.00860166223703249
NBA: Eleven Orlando Magic & Detroit Pistons players suspended after scuffle,2023,https://www.bbc.co.uk/sport/basketball/64124245,Keldon Johnson,0.1034902597402597,0.012150134498540974
LeBron James breaks NBA all-time scoring record,2023,https://www.bbc.co.uk/sport/basketball/64563131,Keldon Johnson,0.1825086125086125,0.01092882749343662
NBA: Kevin Durant traded to Phoenix Suns as Russell Westbrook joins Utah Jazz,2023,https://www.bbc.co.uk/sport/basketball/64593463,Keldon Johnson,0.0884722222222222,0.008065348989218934
Aaron Rodgers: Green Bay Packers quarterback says he intends to join New York Jets,2023,https://www.bbc.co.uk/sport/american-football/64929406,Keldon Johnson,0.1054625569235958,0.005183776551119796
NBA round-up: LeBron James inspires comeback win for the Los Angeles Lakers,2023,https://www.bbc.co.uk/sport/basketball/64370555,Anfernee Simons,0.064,0.014736479868994134
NBA: Donovan Mitchell scores a Cleveland Cavaliers record 71 points in win over Chicago Bulls,2023,https://www.bbc.co.uk/sport/basketball/64150547,Anfernee Simons,0.1555555555555555,0.012997410502706223
NBA round-up: Boston Celtics' winning streak ends with Orlando Magic loss,2023,https://www.bbc.co.uk/sport/basketball/64383208,Paolo Banchero,0.2453216374269005,0.01473647986899414
NBA: Donovan Mitchell scores a Cleveland Cavaliers record 71 points in win over Chicago Bulls,2023,https://www.bbc.co.uk/sport/basketball/64150547,Jerami Grant,0.1555555555555555,0.005814471612004968
NBA: Los Angeles Lakers beaten by Portland Trail Blazers as losing start continues,2023,https://www.bbc.co.uk/sport/basketball/63370829,Jerami Grant,0.0082491582491582,0.012089512047525067
Kyrie Irving: Nike suspend sponsorship deal with Brooklyn Nets player,2023,https://www.bbc.co.uk/sport/basketball/63525097,Jerami Grant,0.1093344155844155,0.005127868453248009
NBA: Giannis Antetokounmpo stars as Milwaukee Bucks beat LA Clippers,2023,https://www.bbc.co.uk/sport/basketball/64608767,Bojan Bogdanović,0.142436974789916,0.0
NBA: Chicago Bulls beat rivals Detroit Pistons 126-108 in Paris,2023,https://www.bbc.co.uk/sport/basketball/64341200,Bojan Bogdanović,0.1337583279604556,0.003683699936833681
NBA renames MVP award as Michael Jordan Trophy as part of rebrand,2023,https://www.bbc.co.uk/sport/basketball/63952245,Jordan Clarkson,0.1200725744843391,0.04748869509823405
United Rugby Championship: Leinster v Dragons (Sat),2023,https://www.bbc.co.uk/sport/rugby-union/64673013,Jordan Clarkson,-0.07,0.025825395125292548
LeBron James breaks NBA all-time scoring record,2023,https://www.bbc.co.uk/sport/basketball/64563131,Jordan Clarkson,0.1825086125086125,0.01249473381922827
Ryan Duncan makes first Dons start,2023,https://www.bbc.com/sport/articles/c6pdzgld1ezo,Jordan Clarkson,0.25,0.0
Scott Robinson starts for Kilmarnock,2023,https://www.bbc.com/sport/articles/cd185vyzg1vo,Jordan Clarkson,0.0,0.0
NBA: Nikola Jokic sets career high for rebounds in Denver Nuggets win,2023,https://www.bbc.co.uk/sport/basketball/64023967,Jordan Clarkson,0.2039848484848485,0.0
NBA: Dallas Mavericks stars Luka Doncic and Kyrie Irving combine for second win together,2023,https://www.bbc.co.uk/sport/basketball/64833608,Jordan Clarkson,0.1416112657184086,0.004148188864870557
United Rugby Championship: Leinster extend lead at top with victory over Dragons,2023,https://www.bbc.co.uk/sport/rugby-union/64692848,Jordan Clarkson,0.0692574786324786,0.012613985470996352
LeBron James: LA Lakers player becomes NBA's all-time leading points scorer,2023,https://www.bbc.co.uk/newsround/64553059,Jordan Clarkson,0.0,0.0
NBA: Golden State Warriors v LA Lakers & other key talking points for new season,2023,https://www.bbc.co.uk/sport/basketball/63287260,Jordan Clarkson,0.1064141414141414,0.009637210253222814
Aaron Rodgers: Green Bay Packers quarterback says he intends to join New York Jets,2023,https://www.bbc.co.uk/sport/american-football/64929406,Jordan Clarkson,0.1054625569235958,0.005183776551119796
United Rugby Championship: Leinster secure 40-5 bonus-point win over Glasgow,2023,https://www.bbc.co.uk/sport/rugby-union/63764336,Jordan Clarkson,0.0946913580246913,0.006798148156156431
NFL week 12 review & results: Aaron Rodgers hurt as Eagles beat Packers while Chiefs beat Rams,2023,https://www.bbc.co.uk/sport/american-football/63777983,Jordan Clarkson,0.1556811375207601,0.0018132752575141843
NBA on the BBC: The big questions as NBA returns after All-Star break,2023,https://www.bbc.co.uk/sport/basketball/64722489,Nikola Vučević,0.0630533543669136,0.0026758638644327824
NBA: Nikola Jokic sets career high for rebounds in Denver Nuggets win,2023,https://www.bbc.co.uk/sport/basketball/64023967,Nikola Vučević,0.2039848484848485,0.0
NBA: Kyrie Irving and Kevin Durant score high in Brooklyn Nets defeat at Memphis Grizzlies,2023,https://www.bbc.co.uk/sport/basketball/63383489,Nikola Vučević,0.2637310606060606,0.00604095294135065
NBA: Ja Morant inspires Memphis Grizzlies win while Stephen Curry stars in Golden State Warriors loss,2023,https://www.bbc.co.uk/sport/basketball/63355733,Nikola Vučević,0.1306998556998557,0.015391754817947686
Joel Embiid: Cameroon pledge would be 'tremendous leap forward' for African side,2023,https://www.bbc.co.uk/sport/africa/63159188,Nikola Vučević,0.1260862054612054,0.007601468876527215
NBA: Golden State Warriors v LA Lakers & other key talking points for new season,2023,https://www.bbc.co.uk/sport/basketball/63287260,Nikola Vučević,0.1064141414141414,0.007223763287702133
NBA: Kevin Durant scores 23 points on Phoenix Suns debut in win at Charlotte Hornets,2023,https://www.bbc.co.uk/sport/basketball/64820742,Devin Booker,0.1631146631146631,0.024060950369931153
NBA: Kevin Durant traded to Phoenix Suns as Russell Westbrook joins Utah Jazz,2023,https://www.bbc.co.uk/sport/basketball/64593463,Devin Booker,0.0884722222222222,0.013939838887819895
NBA: Klay Thompson ejected in Phoenix Suns win over Golden State Warriors,2023,https://www.bbc.co.uk/sport/basketball/63397347,Devin Booker,0.1150285320739866,0.01942198914939877
NBA: Brooklyn Nets stun Boston Celtics 115-105 in biggest comeback win this season,2023,https://www.bbc.co.uk/sport/basketball/64846501,Devin Booker,0.2053030303030302,0.011625474543331887
NBA: Boston Celtics beat Miami Heat in front of Prince and Princess of Wales,2023,https://www.bbc.co.uk/sport/basketball/63818629,Devin Booker,0.3702479338842975,0.007554222884432086
NBA: Los Angeles Lakers beaten by Portland Trail Blazers as losing start continues,2023,https://www.bbc.co.uk/sport/basketball/63370829,Devin Booker,0.0082491582491582,0.005408901431782367
