Unnamed: 0,title,date,url,player,textblob_Sentiment
7595,Glasgow Warriors 46-25 Benetton: Bonus-point win for hosts,2020-21,https://www.bbc.co.uk/sport/rugby-union/56550510,Gordon Hayward,
7596,GorDaq - the economics element,2005-06,http://news.bbc.co.uk/1/hi/programmes/newsnight/4675190.stm,Gordon Hayward,
7597,Court delay to homes demolition,2005-06,http://news.bbc.co.uk/1/hi/england/london/4919146.stm,Gordon Hayward,
7598,Covid-19: 'Behave responsibly' as lockdown eases and China 'vaccine efficacy low',2020-21,https://www.bbc.co.uk/news/uk-56712829,Gordon Hayward,
7599,Why I am an economy winner,2008-09,http://news.bbc.co.uk/1/hi/business/7766750.stm,Gordon Hayward,
7600,Bank of England cuts growth forecasts,2002-03,http://news.bbc.co.uk/1/hi/business/2752281.stm,Gordon Hayward,
7601,NBA: Stephen Curry passes Ray Allen's three-pointers mark as Golden State Warriors win,2021-22,https://www.bbc.co.uk/sport/basketball/59273283,Gordon Hayward,0.253958944281525
7606,Mixed reaction to Brown's report,2004-05,http://news.bbc.co.uk/1/hi/scotland/4063441.stm,Gordon Hayward,
7607,ITV reporter on Eurovision trail,2001-02,http://news.bbc.co.uk/hi/english/entertainment/music/newsid_1773000/1773339.stm,Gordon Hayward,
7608,The UK artists making the leap into film direction,2013-14,http://www.bbc.co.uk/news/entertainment-arts-26186945,Gordon Hayward,
7609,Brown's 'optimism' comes under fire,2002-03,http://news.bbc.co.uk/1/hi/business/2719555.stm,Gordon Hayward,
7610,Benetton 19-38 Glasgow Warriors: Two late tries seal bonus-point victory,2019-20,https://www.bbc.co.uk/sport/rugby-union/50985161,Gordon Hayward,0.09794028722600152
7611,MBE civil (H - M),1999-2000,http://news.bbc.co.uk/hi/english/special_report/1999/12/99/new_years_honours/newsid_584000/584164.stm,Gordon Hayward,
7616,Full list of candidates,2002-03,http://news.bbc.co.uk/1/hi/scotland/2927727.stm,Gordon Hayward,
7618,Interest rate decision looms,1999-2000,http://news.bbc.co.uk/hi/english/business/newsid_703000/703603.stm,Gordon Hayward,
7621,Today: Saturday 23rd January,2009-10,http://news.bbc.co.uk/today/hi/today/newsid_8476000/8476407.stm,Gordon Hayward,
7622,Scrubbing Up: Your comments,2008-09,http://news.bbc.co.uk/1/hi/health/7750596.stm,Gordon Hayward,
7623,Military Page - Army,1997-98,http://news.bbc.co.uk/hi/english/special_report/for_christmas/_new_year/new_year_honours/newsid_43000/43533.stm,Gordon Hayward,
7625,Bush car bail-out: Your comments,2008-09,http://news.bbc.co.uk/1/hi/business/7792719.stm,Gordon Hayward,
7626,Business welcomes pre-Budget report,2008-09,http://news.bbc.co.uk/1/hi/business/7746889.stm,Gordon Hayward,
7627,Political Ad Breakdown II,2004-05,http://news.bbc.co.uk/1/hi/uk_politics/vote_2005/blog/4434621.stm,Gordon Hayward,
7629,CBEs - full list,2003-04,http://news.bbc.co.uk/1/hi/uk/3357011.stm,Gordon Hayward,
7633,Premiership wish list,2003-04,http://news.bbc.co.uk/sport1/hi/football/eng_prem/3340729.stm,Gordon Hayward,
7634,FA Trophy fourth round review,2004-05,http://news.bbc.co.uk/sport1/hi/football/eng_conf/4236979.stm,Gordon Hayward,
7636,All the world's a stage - and these are the players,1997-98,http://news.bbc.co.uk/hi/english/special_report/all_blacks_on_tour/newsid_20000/20192.stm,Gordon Hayward,
7637,Your comments,2004-05,http://news.bbc.co.uk/1/hi/programmes/panorama/4377561.stm,Gordon Hayward,
7641,Wild weather and Only Fools return in newspapers,2013-14,https://www.bbc.co.uk/news/blogs-the-papers-25598398,Gordon Hayward,
7642,Playing with fire.,2007-08,http://news.bbc.co.uk/1/hi/programmes/politics_show/7127720.stm,Gordon Hayward,
7643,Sir Terry Wogan: Your memories and pictures,2015-16,https://www.bbc.co.uk/news/entertainment-arts-35453971,Gordon Hayward,
7649,UK voters' panel: Richard Gosling,2004-05,http://news.bbc.co.uk/1/hi/uk_politics/vote_2005/have_your_say/4391807.stm,Gordon Hayward,
7651,"Order of the British Empire, Civil - OBE (part one)",1998-99,http://news.bbc.co.uk/hi/english/special_report/1998/12/98/new_year_honours/newsid_244000/244819.stm,Gordon Hayward,
7655,Tributes to 'courageous' TV star,2008-09,http://news.bbc.co.uk/1/hi/entertainment/7957611.stm,Gordon Hayward,
7656,Sport quotes of the week,2008-09,http://news.bbc.co.uk/sport1/hi/funny_old_game/7693805.stm,Gordon Hayward,
7658,The Magazine Monitor,2004-05,http://news.bbc.co.uk/1/hi/magazine/4160925.stm,Gordon Hayward,
7659,"Order of the British Empire, Civil - MBE (part three)",1997-98,http://news.bbc.co.uk/hi/english/special_report/for_christmas/_new_year/new_year_honours/newsid_43000/43524.stm,Gordon Hayward,
7662,Steve Nash: Brooklyn Nets part ways with head coach,2022-23,https://www.bbc.co.uk/sport/basketball/63477309,Steve Nash,0.12843137254901962
7663,Kevin Durant found out about Brooklyn Nets sacking Steve Nash on TV,2022-23,https://www.bbc.co.uk/sport/basketball/63482350,Steve Nash,0.11126190476190474
7664,NBA: Brooklyn Nets must manage Kevin Durant game time - Steve Nash,2021-22,https://www.bbc.co.uk/sport/basketball/59694810,Steve Nash,0.0708994708994709
7666,Rugby League World Cup: Steve Nash reflects on 1972 win for Great Britain,2017-18,https://www.bbc.co.uk/sport/av/rugby-league/42196179,Steve Nash,
7667,Steve Nash: Britain's Unknown sun,2016-17,https://www.bbc.co.uk/news/uk-wales-37877100,Steve Nash,
7670,Steve Nash: Skills of NBA star with Welsh heritage,2016-17,https://www.bbc.co.uk/news/uk-wales-37934889,Steve Nash,
7671,"NBA: Basketball star Steve Nash, the unlikely Welshman",2016-17,https://www.bbc.co.uk/news/uk-wales-37851644,Steve Nash,
7673,Sharks were at their best - Dagostino,2010-11,http://news.bbc.co.uk/sport1/hi/other_sports/basketball/9363804.stm,Steve Nash,
7675,Inside Sport: How big a problem is gambling in sport?,2017-18,https://www.bbc.co.uk/programmes/p05t8jyr,Steve Nash,
7676,Inside Sport: How do you keep sports stars out of trouble?,2017-18,https://www.bbc.co.uk/programmes/p05m8pp0,Steve Nash,
7677,Murdered British paraglider 'safer in Mongolia than Manchester',2020-21,https://www.bbc.co.uk/news/uk-england-merseyside-56103390,Steve Nash,
7679,Nash helps Suns outshine Bulls in NBA,2009-10,http://news.bbc.co.uk/sport1/hi/other_sports/basketball/8596148.stm,Steve Nash,
7680,Nash inspires Suns to rise above Spurs,2009-10,http://news.bbc.co.uk/sport1/hi/other_sports/basketball/8416778.stm,Steve Nash,
7681,Nash helps Suns dethrone Kings,2009-10,http://news.bbc.co.uk/sport1/hi/other_sports/basketball/8443208.stm,Steve Nash,
7683,Mavericks edge out Spurs,2002-03,http://news.bbc.co.uk/sport1/hi/other_sports/us_sport/2786279.stm,Steve Nash,
7685,Mavs fend off Wolves,2002-03,http://news.bbc.co.uk/sport1/hi/other_sports/us_sport/2711767.stm,Steve Nash,
7686,Nash stars for Dallas,2002-03,http://news.bbc.co.uk/sport1/hi/other_sports/us_sport/2537383.stm,Steve Nash,
7687,Mavs edge out Nets,2003-04,http://news.bbc.co.uk/sport1/hi/other_sports/us_sport/3556321.stm,Steve Nash,
7688,Rockets pile pressure on Sixers,2003-04,http://news.bbc.co.uk/sport1/hi/other_sports/us_sport/3279405.stm,Steve Nash,
7689,Mavericks down Suns,2002-03,http://news.bbc.co.uk/sport1/hi/other_sports/us_sport/2877465.stm,Steve Nash,
7690,Mavericks shoot down Nets,2002-03,http://news.bbc.co.uk/sport1/hi/other_sports/us_sport/2820971.stm,Steve Nash,
7691,More acts for Stendhal Festival!,2011-12,http://www.bbc.co.uk/blogs/acrosstheline/2012/04/more_acts_for_stendhal_festiva.html,Steve Nash,
7692,Simonsen vows to fight for place,2007-08,http://news.bbc.co.uk/sport1/hi/football/teams/s/stoke_city/7301629.stm,Steve Nash,
7702,NHL looks to future,2003-04,http://news.bbc.co.uk/sport1/hi/other_sports/us_sport/3468931.stm,Steve Nash,
7703,Yao heads All-Star voting,2004-05,http://news.bbc.co.uk/sport1/hi/other_sports/us_sport/4103571.stm,Steve Nash,
7705,British paraglider murder: Killer's jailing leaves wife 'relieved',2017-18,https://www.bbc.co.uk/news/uk-england-merseyside-42063984,Steve Nash,
7708,NBA: Dallas Mavericks 'do not plan' to play national anthem again before games,2020-21,https://www.bbc.co.uk/sport/basketball/55988763,Steve Nash,0.2152968711505297
7710,West win to take All-Star honours,2006-07,http://news.bbc.co.uk/sport1/hi/other_sports/ice_hockey/6297233.stm,Steve Nash,
7711,A's set to lose Tejada,2002-03,http://news.bbc.co.uk/sport1/hi/other_sports/us_sport/2855041.stm,Steve Nash,
7714,Riders thrilled with Vear capture,2007-08,http://news.bbc.co.uk/sport1/hi/other_sports/basketball/7176487.stm,Steve Nash,
7716,NBA: LA Lakers lose 110-99 to Denver Nuggets,2022-23,https://www.bbc.co.uk/sport/basketball/63409773,Steve Nash,0.12268907563025208
7719,Gannon guns Raiders to title,2002-03,http://news.bbc.co.uk/sport1/hi/other_sports/us_sport/2674997.stm,Steve Nash,
7720,LeBron to shine in All-Star game,2005-06,http://news.bbc.co.uk/sport1/hi/other_sports/basketball/4676126.stm,Steve Nash,
7725,Glamorgan Hall of Fame,2005-06,http://news.bbc.co.uk/sport1/hi/cricket/counties/glamorgan/4501140.stm,Steve Nash,
7726,NBA: James Harden inspires Brooklyn Nets to win against Phoenix Suns,2020-21,https://www.bbc.co.uk/sport/basketball/56095264,Steve Nash,0.23888888888888885
7729,Gannon takes MVP award,2002-03,http://news.bbc.co.uk/sport1/hi/other_sports/us_sport/2621013.stm,Steve Nash,
7732,Brooklyn Nets: Jacque Vaughn appointed as permanent head coach,2022-23,https://www.bbc.co.uk/sport/basketball/63576644,Steve Nash,0.08579545454545454
7733,NBA to hold basketball camp in Cuba to foster talent,2014-15,https://www.bbc.co.uk/news/world-latin-america-32203271,Steve Nash,
7737,Kyrie Irving says he embraces 'all religions' after criticism from Brooklyn Nets owner,2022-23,https://www.bbc.co.uk/sport/basketball/63444993,Steve Nash,-0.09538926681783824
7740,Spurs make NBA history,2002-03,http://news.bbc.co.uk/sport1/hi/other_sports/us_sport/2765287.stm,Steve Nash,
7742,Waugh's men claim Aussie title,2002-03,http://news.bbc.co.uk/sport1/hi/cricket/2854177.stm,Steve Nash,
7745,Suns win streak hits new heights,2006-07,http://news.bbc.co.uk/sport1/hi/other_sports/basketball/6304919.stm,Steve Nash,
7746,View from America,2004-05,http://news.bbc.co.uk/sport1/hi/other_sports/us_sport/4123249.stm,Steve Nash,
7750,Super Bowl sensations,2003-04,http://news.bbc.co.uk/sport1/hi/other_sports/us_sport/3253912.stm,Steve Nash,
7752,Kirby receives injury all-clear,2007-08,http://news.bbc.co.uk/sport1/hi/cricket/counties/7344322.stm,Steve Nash,
7753,Business Matters: US budget row,2021-22,https://www.bbc.co.uk/programmes/w172xvqltqn8n2y,Steve Nash,
7756,County Championship: Joe Clarke closes in on second Notts ton against Yorkshire,2018-19,https://www.bbc.co.uk/sport/cricket/47841977,Steve Nash,0.08653846153846154
7758,McMahon in keeper crisis,2003-04,http://news.bbc.co.uk/sport1/hi/football/teams/b/blackpool/3327067.stm,Steve Nash,
7761,Jordan gets All-Star call-up,2002-03,http://news.bbc.co.uk/sport1/hi/other_sports/us_sport/2703641.stm,Steve Nash,
7762,Yorkshire v Sussex: Chris Jordan shines on debut,2012-13,https://www.bbc.co.uk/sport/cricket/22079809,Steve Nash,-0.0059808612440191335
7763,Overtime joy for Favre,2003-04,http://news.bbc.co.uk/sport1/hi/other_sports/us_sport/3358543.stm,Steve Nash,
7764,MP raises concerns about Child Support Agency,2012-13,http://www.bbc.co.uk/democracylive/house-of-commons-21701200,Steve Nash,
7767,NBA: Brooklyn Nets beat New York Knicks 112-85 in Jacque Vaughn's first game as head coach,2022-23,https://www.bbc.co.uk/sport/basketball/63580568,Steve Nash,0.027597402597402603
7775,Macclesfield 1-1 Exeter,2002-03,http://news.bbc.co.uk/sport1/hi/football/eng_div_3/2671667.stm,Steve Nash,
7776,Kevin Durant: Brooklyn Nets star fined and 'sorry' for Michael Rapaport exchange,2020-21,https://www.bbc.co.uk/sport/basketball/56620897,Steve Nash,-0.020370370370370372
7779,Reading 2-1 Preston,2005-06,http://news.bbc.co.uk/sport1/hi/football/eng_div_1/4727042.stm,Steve Nash,
7780,NBA: Golden State Warriors lose to Detroit Pistons after late three-pointer,2022-23,https://www.bbc.co.uk/sport/basketball/64172182,Steve Nash,-0.01058429118773946
7782,Suns spoil Jackson's LA comeback,2005-06,http://news.bbc.co.uk/sport1/hi/other_sports/basketball/4406140.stm,Steve Nash,
7788,Worcestershire set to lose Gareth Andrew to injury,2011-12,https://www.bbc.co.uk/sport/cricket/16414383,Steve Nash,0.05499999999999999
7790,Hollies miss Hall of Fame honour,2009-10,http://news.bbc.co.uk/1/hi/entertainment/8565291.stm,Steve Nash,
7791,Bold Bruins land Gonchar,2003-04,http://news.bbc.co.uk/sport1/hi/other_sports/us_sport/3532673.stm,Steve Nash,
7792,NBA postpones more games over Covid-19 case number rise,2021-22,https://www.bbc.co.uk/sport/basketball/59720597,Steve Nash,0.06731060606060606
7793,Catalan Dragons 28-20 Castleford,2011-12,https://www.bbc.co.uk/sport/rugby-league/17031551,Steve Nash,0.022903225806451617
7799,Hot streak continues for Suns,2004-05,http://news.bbc.co.uk/sport1/hi/other_sports/us_sport/4159101.stm,Steve Nash,
7800,Mavericks clinch play-off spot,2003-04,http://news.bbc.co.uk/sport1/hi/other_sports/us_sport/3584787.stm,Steve Nash,
7802,All-Star boost for Bryant,2003-04,http://news.bbc.co.uk/sport1/hi/other_sports/us_sport/3443573.stm,Steve Nash,
7803,Cavs and James off the mark,2003-04,http://news.bbc.co.uk/sport1/hi/other_sports/us_sport/3254465.stm,Steve Nash,
7805,Preston 3-2 Stoke,2006-07,http://news.bbc.co.uk/sport1/hi/football/eng_div_1/6258755.stm,Steve Nash,
7807,Eli Manning: New York Giants quarterback announces retirement,2019-20,https://www.bbc.co.uk/sport/american-football/51213242,Steve Nash,0.14766554433221096
7813,Mavericks march on,2002-03,http://news.bbc.co.uk/sport1/hi/other_sports/us_sport/2651839.stm,Steve Nash,
7816,NBA: Brooklyn Nets fans wear 'Fight Anti-Semitism' T-shirts after Kyrie Irving tweet,2022-23,https://www.bbc.co.uk/sport/basketball/63467880,Steve Nash,-0.03991841491841493
7819,Macclesfield 1-3 Swansea,2002-03,http://news.bbc.co.uk/sport1/hi/football/eng_div_3/2716169.stm,Steve Nash,
7820,Science and Technology Committee,2010-11,http://news.bbc.co.uk/democracylive/hi/house_of_commons/newsid_9431000/9431409.stm,Steve Nash,
7823,Nets set win record,2003-04,http://news.bbc.co.uk/sport1/hi/other_sports/us_sport/3501925.stm,Steve Nash,
7825,Goater denies Man Utd,2002-03,http://news.bbc.co.uk/sport1/hi/football/eng_prem/2715989.stm,Steve Nash,
7826,Girl fell to death after sex jibe,2009-10,http://news.bbc.co.uk/1/hi/england/gloucestershire/8550390.stm,Steve Nash,
7830,Mavericks fall to Lewis,2003-04,http://news.bbc.co.uk/sport1/hi/other_sports/us_sport/3617437.stm,Steve Nash,
7832,Kings continue to struggle,2003-04,http://news.bbc.co.uk/sport1/hi/other_sports/us_sport/3592149.stm,Steve Nash,
7833,Primeau on target for Flyers,2003-04,http://news.bbc.co.uk/sport1/hi/other_sports/us_sport/3405461.stm,Steve Nash,
7834,Macclesfield 0-1 Hull,2002-03,http://news.bbc.co.uk/sport1/hi/football/eng_div_3/2804053.stm,Steve Nash,
7835,In the Studio: Stephen Page: Staging indigenous culture,2021-22,https://www.bbc.co.uk/programmes/w3ct1tf7,Steve Nash,
7836,Bellator 292: Britons Michael 'MVP' Page and Linton Vassell earn stunning knockouts,2022-23,https://www.bbc.co.uk/sport/mixed-martial-arts/64924283,Steve Nash,0.14524572649572645
7837,NFL play-offs hot up,2002-03,http://news.bbc.co.uk/sport1/hi/other_sports/us_sport/2638271.stm,Steve Nash,
7838,NBA: Golden State Warriors beat Utah Jazz to reach play-offs,2021-22,https://www.bbc.co.uk/sport/basketball/60972112,Steve Nash,0.13116883116883118
7841,Wright on song as Sussex dominate,2007-08,http://news.bbc.co.uk/sport1/hi/cricket/counties/7344696.stm,Steve Nash,
7842,West Indies v England photos,2008-09,http://news.bbc.co.uk/sport1/hi/cricket/england/7876693.stm,Steve Nash,
7845,SAG Awards: The winners and nominees,2022-23,https://www.bbc.co.uk/news/entertainment-arts-64781108,Steve Nash,
7847,In the Studio: Stephen Page: Staging Indigenous Culture,2021-22,https://www.bbc.co.uk/programmes/p0bk2llk,Steve Nash,
7849,NBA: LeBron James shines as LA Lakers beat Houston Rockets,2021-22,https://www.bbc.co.uk/sport/basketball/59146508,Steve Nash,0.10664335664335664
7850,NBA: Zion Williamson scores 43 points as Pelicans beat Timberwolves,2022-23,https://www.bbc.co.uk/sport/basketball/64114841,Steve Nash,0.15151515151515152
7851,Macclesfield 0-1 Hartlepool,2002-03,http://news.bbc.co.uk/sport1/hi/football/eng_div_3/2676043.stm,Steve Nash,
7855,The Gambia's Bubacarr Trawally moves to Guizhou Hengfeng FC on a free transfer,2017-18,https://www.bbc.co.uk/sport/football/43215823,Steve Nash,0.13487654320987655
7858,Heard in England Counties line-up,2009-10,http://news.bbc.co.uk/sport1/hi/rugby_union/8536439.stm,Steve Nash,
7861,Suns close on play-offs,2002-03,http://news.bbc.co.uk/sport1/hi/other_sports/us_sport/2921715.stm,Steve Nash,
7862,NBA: Brooklyn Nets beat Toronto Raptors to seal Easter Conference play-off spot,2020-21,https://www.bbc.co.uk/sport/basketball/56911906,Steve Nash,0.21776859504132232
7867,Preston 1-0 Crewe,2005-06,http://news.bbc.co.uk/sport1/hi/football/eng_div_1/4842468.stm,Steve Nash,
7869,Your Pictures: 05 April - 12 April 2017,2016-17,https://www.bbc.co.uk/news/uk-wales-39512420,Steve Nash,
7875,Bragg to curate Glastonbury stage,2009-10,http://news.bbc.co.uk/1/hi/entertainment/8576037.stm,Steve Nash,
7878,Raptors overhaul monster deficit,2004-05,http://news.bbc.co.uk/sport1/hi/other_sports/us_sport/4031065.stm,Steve Nash,
7879,Garnett sends Mavs packing,2003-04,http://news.bbc.co.uk/sport1/hi/other_sports/us_sport/3333061.stm,Steve Nash,
7880,Canadiens make NHL history,2003-04,http://news.bbc.co.uk/sport1/hi/other_sports/us_sport/3230420.stm,Steve Nash,
7881,Mavericks overcome Timberwolves,2002-03,http://news.bbc.co.uk/sport1/hi/other_sports/us_sport/2901757.stm,Steve Nash,
7882,Macclesfield 3-1 Leyton Orient,2002-03,http://news.bbc.co.uk/sport1/hi/football/eng_div_3/2832499.stm,Steve Nash,
7883,Mavericks edge out Wizards,2002-03,http://news.bbc.co.uk/sport1/hi/other_sports/us_sport/2792975.stm,Steve Nash,
7884,Mavericks slump continues,2002-03,http://news.bbc.co.uk/sport1/hi/other_sports/us_sport/2675365.stm,Steve Nash,
7885,Pacers end Mavericks run,2002-03,http://news.bbc.co.uk/sport1/hi/other_sports/us_sport/2526383.stm,Steve Nash,
7888,Jonathan Agnew column,2008-09,http://news.bbc.co.uk/sport1/hi/cricket/england/7931716.stm,Steve Nash,
7890,NBA: Kyrie Irving scores career-best 60 points as Brooklyn Nets thrash Orlando Magic,2021-22,https://www.bbc.co.uk/sport/basketball/60761847,Steve Nash,0.188630667578036
7891,Perfect ten for Dallas,2002-03,http://news.bbc.co.uk/sport1/hi/other_sports/us_sport/2485559.stm,Steve Nash,
7896,Grizzlies roar on,2003-04,http://news.bbc.co.uk/sport1/hi/other_sports/us_sport/3577643.stm,Steve Nash,
7897,Dawes leads Queensland fightback,2002-03,http://news.bbc.co.uk/sport1/hi/cricket/2849399.stm,Steve Nash,
7898,Zenden stuns Villa,2003-04,http://news.bbc.co.uk/sport1/hi/football/eng_prem/3232997.stm,Steve Nash,
7899,"NBA: LA Lakers defeated by LA Clippers, Brooklyn Nets beat Golden State Warriors",2020-21,https://www.bbc.co.uk/sport/basketball/55421669,Steve Nash,0.06133449883449883
7900,NBA: Golden State Warriors v LA Lakers & other key talking points for new season,2022-23,https://www.bbc.co.uk/sport/basketball/63287260,Steve Nash,0.10641414141414143
7902,"NBA: LA rivalry, Zion Williamson & China disputes - the big talking points before new season",2019-20,https://www.bbc.co.uk/sport/basketball/50132656,Steve Nash,0.15543732782369143
7903,Little gull makes Manx birdspotting project debut,2017-18,https://www.bbc.co.uk/news/world-europe-isle-of-man-42566725,Steve Nash,
7908,Heard in England Counties squad,2009-10,http://news.bbc.co.uk/sport1/hi/rugby_union/8454518.stm,Steve Nash,
7912,Roy reaches milestone,2002-03,http://news.bbc.co.uk/sport1/hi/other_sports/us_sport/2678585.stm,Steve Nash,
7913,Mavs too strong for Grizzlies,2003-04,http://news.bbc.co.uk/sport1/hi/other_sports/us_sport/3624329.stm,Steve Nash,
7914,Lakers hold off Clippers,2003-04,http://news.bbc.co.uk/sport1/hi/other_sports/us_sport/3407027.stm,Steve Nash,
7915,Carter inspires Raptors,2003-04,http://news.bbc.co.uk/sport1/hi/other_sports/us_sport/3388079.stm,Steve Nash,
7916,Nowitzki spurs Mavericks,2002-03,http://news.bbc.co.uk/sport1/hi/other_sports/us_sport/2767893.stm,Steve Nash,
7917,Kings sweep Grizzlies aside,2002-03,http://news.bbc.co.uk/sport1/hi/other_sports/us_sport/2690277.stm,Steve Nash,
7918,Dallas still on top,2002-03,http://news.bbc.co.uk/sport1/hi/other_sports/us_sport/2470905.stm,Steve Nash,
7919,Birmingham 3-1 Preston,2006-07,http://news.bbc.co.uk/sport1/hi/football/eng_div_1/6201368.stm,Steve Nash,
7920,Knicks down Magic,2003-04,http://news.bbc.co.uk/sport1/hi/other_sports/us_sport/3239151.stm,Steve Nash,
7921,Boro held by Pompey,2003-04,http://news.bbc.co.uk/sport1/hi/football/eng_prem/3247514.stm,Steve Nash,
7924,Injured Kirby rushed to hospital,2007-08,http://news.bbc.co.uk/sport1/hi/cricket/counties/7343463.stm,Steve Nash,
7925,Britain's Joel Freeland set for Portland Trail Blazers NBA debut,2012-13,https://www.bbc.co.uk/sport/basketball/20142109,Steve Nash,0.1979527417027417
7933,Baverstock Academy head called for closure of 'broken' school,2016-17,https://www.bbc.co.uk/news/uk-england-birmingham-38906781,Steve Nash,
7934,Wednesday's gossip column,2006-07,http://news.bbc.co.uk/sport1/hi/football/gossip_and_transfers/6381363.stm,Steve Nash,
7941,Mavericks see off Kings,2003-04,http://news.bbc.co.uk/sport1/hi/other_sports/us_sport/3429059.stm,Steve Nash,
7942,LeBron stars again,2003-04,http://news.bbc.co.uk/sport1/hi/other_sports/us_sport/3337881.stm,Steve Nash,
7943,Mavericks swat Hornets,2002-03,http://news.bbc.co.uk/sport1/hi/other_sports/us_sport/2908585.stm,Steve Nash,
7944,Jordan rolls back the years,2002-03,http://news.bbc.co.uk/sport1/hi/other_sports/us_sport/2807067.stm,Steve Nash,
7945,The gossip column,2002-03,http://news.bbc.co.uk/sport1/hi/football/2755861.stm,Steve Nash,
7946,Mavericks march on,2002-03,http://news.bbc.co.uk/sport1/hi/other_sports/us_sport/2608511.stm,Steve Nash,
7948,"NBA: Brooklyn Nets find 'solace' in wins after tumultuous week, says Kevin Durant",2022-23,https://www.bbc.co.uk/sport/basketball/63532635,Steve Nash,0.08953703703703703
7949,Kyrie Irving: Nike suspend sponsorship deal with Brooklyn Nets player,2022-23,https://www.bbc.co.uk/sport/basketball/63525097,Steve Nash,0.10933441558441559
7954,Tuesday's photos of the day,2004-05,http://news.bbc.co.uk/sport1/hi/photo_galleries/photos_of_the_day/4245703.stm,Andre Iguodala,
7955,London 2012: LeBron James and Kobe Bryant in US Olympic squad,2011-12,https://www.bbc.co.uk/sport/basketball/16586122,Andre Iguodala,0.23872053872053875
7958,NBA: Oklahoma City Thunder earn late win as Golden State Warriors and Brooklyn Nets lose,2021-22,https://www.bbc.co.uk/sport/basketball/59709849,Andre Iguodala,0.07353535353535354
7959,Rodriguez takes MVP honour,2003-04,http://news.bbc.co.uk/sport1/hi/other_sports/us_sport/3278855.stm,Andre Iguodala,
7960,NBA: Kyrie Irving buzzer-beater gives Brooklyn Nets win at Toronto Raptors,2022-23,https://www.bbc.co.uk/sport/basketball/64010284,Andre Iguodala,0.2775
7963,NBA: Los Angeles Lakers beaten as Luka Doncic shines for Dallas Mavericks,2021-22,https://www.bbc.co.uk/sport/basketball/60584024,Andre Iguodala,0.15331196581196577
7965,Plymouth 49-103 Everton,2008-09,http://news.bbc.co.uk/sport1/hi/other_sports/basketball/7833990.stm,Andre Iguodala,
7966,NBA: Stephen Curry sets Golden State Warriors record in win over Denver Nuggets,2020-21,https://www.bbc.co.uk/sport/basketball/56729552,Andre Iguodala,0.1434681637806638
7969,The biggest gaps between titles in sports history,2015-16,https://www.bbc.co.uk/newsround/34964029,Andre Iguodala,
7973,South Africa: Player stats,2002-03,http://news.bbc.co.uk/sport1/hi/rugby_union/international/2503261.stm,Andre Iguodala,
7975,College bowls round-up,2004-05,http://news.bbc.co.uk/sport1/hi/other_sports/us_sport/4137155.stm,Andre Iguodala,
7977,Opera on 3: Shostakovich's Lady Macbeth of Mtsensk,2022-23,https://www.bbc.co.uk/programmes/m001jcjx,Brandon Bass,
7979,NFL highlights - Brandon Marshall stars in Pro Bowl,2011-12,https://www.bbc.co.uk/sport/av/american-football/16785493,Brandon Bass,
7983,Opera on 3: Kevin Puts's The Hours,2022-23,https://www.bbc.co.uk/programmes/m001fwy4,Brandon Bass,
7984,Portsmouth 4-1 Southend United,2019-20,https://www.bbc.co.uk/sport/football/49533129,Brandon Bass,0.101578231292517
7987,Opera on 3: Richard Strauss's Ariadne auf Naxos,2021-22,https://www.bbc.co.uk/programmes/m00154t4,Brandon Bass,
7988,Red Sox sign Schilling,2003-04,http://news.bbc.co.uk/sport1/hi/other_sports/us_sport/3248950.stm,Brandon Bass,
7990,NBA: LeBron James claims first Los Angeles Lakers victory,2018-19,https://www.bbc.co.uk/sport/basketball/45975260,Brandon Bass,0.08192857142857142
7992,Tom Brady's Tampa Bay Buccaneers to face Patrick Mahomes' Kansas City Chiefs in Super Bowl 55,2020-21,https://www.bbc.co.uk/sport/american-football/55791239,Brandon Bass,0.25037575186090044
7996,NBA: Stephen Curry leads Warriors win with 46 points,2021-22,https://www.bbc.co.uk/sport/basketball/59775265,Brandon Bass,0.1395123106060606
7998,NBA: Los Angeles Lakers beaten by Philadelphia 76ers to end away streak,2020-21,https://www.bbc.co.uk/sport/basketball/55838170,Brandon Bass,0.24774318818436464
7999,Through the Night: Haydn's Creation,2022-23,https://www.bbc.co.uk/programmes/m001dphj,Brandon Bass,
8000,BBL Trophy final: London City Royals beat London Lions in overtime 90-82,2018-19,https://www.bbc.co.uk/sport/basketball/47517634,Brandon Bass,0.12043650793650792
8004,Green Bay Packers beat Los Angeles Rams; Buffalo Bills overcome Baltimore Ravens,2020-21,https://www.bbc.co.uk/sport/american-football/55692981,Brandon Bass,0.09544564382226714
8005,BBC Introducing: The Joe Public,2009-10,http://news.bbc.co.uk/local/somerset/hi/people_and_places/music/newsid_8412000/8412673.stm,Brandon Bass,
