Unnamed: 0,title,date,url,player,textblob_Sentiment
2224,Paula White: Tony Christie,2010-11,https://www.bbc.co.uk/programmes/p00dzxg6,Chris Paul,
2225,Paula White: Advice line launched for perfect Christmas turkey,2010-11,https://www.bbc.co.uk/programmes/p00cl34s,Chris Paul,
2226,Paula White: Paula chats to a real life Christmas Fairey,2010-11,https://www.bbc.co.uk/programmes/p00cb912,Chris Paul,
2227,Paula White: The Hairy Bikers and Christmas cocktails,2010-11,https://www.bbc.co.uk/programmes/p00c88nq,Chris Paul,
2228,Paula White: Christmas is coming and Paula wants your toy-related tales,2010-11,https://www.bbc.co.uk/programmes/p00c5msq,Chris Paul,
2229,Paula White: Myleene Klass on making dreams come true at Christmas,2010-11,https://www.bbc.co.uk/programmes/p00c47zp,Chris Paul,
2230,Paula White: Sue Perkins on writing witty Christmas cards,2010-11,https://www.bbc.co.uk/programmes/p00bz7tv,Chris Paul,
2231,Christy Pym: Stevenage boss Paul Tisdale signs Peterborough keeper on loan,2021-22,https://www.bbc.co.uk/sport/football/59803014,Chris Paul,0.20535714285714285
2232,Omicron: Paul Givan 'doesn't envisage more restrictions before Christmas',2021-22,https://www.bbc.co.uk/news/uk-northern-ireland-59578050,Chris Paul,
2233,Cooking with Paula McIntyre: Christmas Party Food,2021-22,https://www.bbc.co.uk/programmes/p0b6q2hk,Chris Paul,
2234,Comedy Club Extra: Christmas Crackers: Paul Garner,2021-22,https://www.bbc.co.uk/programmes/m0012myp,Chris Paul,
2235,Cooking with Paula McIntyre: Christmas Leftovers Recipes,2020-21,https://www.bbc.co.uk/programmes/p092clkf,Chris Paul,
2240,"Scotland Outdoors: Mark and Euan are joined by storyteller Pauline Cordiner, Euan boards a Santa steam train and Mark visits a Christmas grotto",2019-20,https://www.bbc.co.uk/programmes/p07ylshl,Chris Paul,
2241,Paul McCartney unwraps his 'secret' Christmas album,2019-20,https://www.bbc.co.uk/news/entertainment-arts-50755325,Chris Paul,
2242,Cooking with Paula McIntyre: Chocolate Christmas Cake with Vanilla Marzipan,2019-20,https://www.bbc.co.uk/programmes/p07vw271,Chris Paul,
2248,Christopher Paul: Police hunt for 1991 Caerphilly murderer,2017-18,https://www.bbc.co.uk/news/uk-wales-43727487,Chris Paul,
2249,Christopher Paul: Hunt for convicted Caerphilly murderer,2017-18,https://www.bbc.co.uk/news/uk-wales-south-east-wales-43723705,Chris Paul,
2250,Cooking with Paula McIntyre: Christmas Party Food,2017-18,https://www.bbc.co.uk/programmes/p05r9k1f,Chris Paul,
2251,Bedford's Christmas tree festival has taken over St Paul's Church,2017-18,https://www.bbc.co.uk/news/uk-england-beds-bucks-herts-42281676,Chris Paul,
2253,"Front Row: Jake Gyllenhaal, Pauline Black, Christopher Wheeldon and the business of musicals",2016-17,https://www.bbc.co.uk/programmes/b08j99mz,Chris Paul,
2255,Contemporaries of Christ: Paul Twivy,1994-95,https://www.bbc.co.uk/programmes/p033jspj,Chris Paul,
2256,Paul Cook: Christmas run-in will define League Two season,2015-16,https://www.bbc.co.uk/sport/football/34869127,Chris Paul,0.14702380952380953
2258,Paul Lambert: Christian Benteke didn't throw a 'Mike Tyson punch',2014-15,https://www.bbc.co.uk/sport/football/29873833,Chris Paul,0.06129032258064516
2262,Front Row: Jean Paul Gaultier; Christy Moore; The Raid 2,2013-14,https://www.bbc.co.uk/programmes/b03zy4hl,Chris Paul,
2263,St Boniface's former bursar Christopher Paul Gorman cleared of fraud,2013-14,https://www.bbc.co.uk/news/uk-england-devon-24888931,Chris Paul,
2265,"Christian Benteke worth more than Â£25m, says Paul Lambert",2012-13,https://www.bbc.co.uk/sport/football/22109498,Chris Paul,0.21026785714285715
2266,Paul Lambert says Christian Benteke will stay at Aston Villa,2012-13,https://www.bbc.co.uk/sport/football/21550118,Chris Paul,0.12782738095238094
2267,Paul Farrer on composition Christmas TV theme tunes,2012-13,https://www.bbc.co.uk/news/uk-england-hereford-worcester-21317796,Chris Paul,
2268,Christian Benteke: Aston Villa boss Paul Lambert says striker will stay,2012-13,https://www.bbc.co.uk/sport/football/20808052,Chris Paul,0.04055555555555555
2269,BBC WM Red Alert Appeal Christmas Auction with Paul Franks,2012-13,https://www.bbc.co.uk/news/uk-england-birmingham-20643288,Chris Paul,
2270,Christian Benteke will get better - Paul Lambert,2012-13,https://www.bbc.co.uk/sport/football/20149198,Chris Paul,0.19761904761904758
2278,"Sir Thomas, Sir Paul, Sir Ian and Sir Christopher",2009-10,http://www.bbc.co.uk/blogs/nickrobinson/2010/02/sir_thomas_sir.html,Chris Paul,
2280,Daily Service: 25/01/2022 Christian Unity - Shared Paths/The Feast of the Conversion of Saint Paul the Apostle,2021-22,https://www.bbc.co.uk/programmes/m0013sbf,Chris Paul,
2282,Rugby Union Weekly: France run riot at Twickenham,2022-23,https://www.bbc.co.uk/programmes/p0f87z68,Chris Paul,
2283,Debate Night: Series 4: 08/03/2023,2022-23,https://www.bbc.co.uk/programmes/m001jxyx,Chris Paul,
2284,Rams Daily: A Derby County Podcast: The Rams head coach previews Morecambe & reflects on the transfer window,2022-23,https://www.bbc.co.uk/programmes/p0f0q3vg,Chris Paul,
2285,Rugby Union Weekly: England booed off after Springboks defeat,2022-23,https://www.bbc.co.uk/programmes/p0dk1kzw,Chris Paul,
2286,Rugby Union Weekly: Wiggy and a Christmas cracker,2022-23,https://www.bbc.co.uk/programmes/p0drlhxn,Chris Paul,
2287,Chris Baxter: Chris Baxter's Late Show,2022-23,https://www.bbc.co.uk/programmes/p0dstb09,Chris Paul,
2288,Rugby Union Weekly: Argentina stun England at Twickenham,2022-23,https://www.bbc.co.uk/programmes/p0dd81sp,Chris Paul,
2289,FC Isle of Man: Ravens sack manager Chris Bass after poor run,2022-23,https://www.bbc.co.uk/sport/football/63545135,Chris Paul,0.040429894179894184
2291,NBA: Darius Garland's half-court shot & Brandon Ingram's game-winner - plays of the week,2021-22,https://www.bbc.co.uk/sport/av/basketball/60040625,Chris Paul,
2296,606: Twas the night before the World Cup Final,2022-23,https://www.bbc.co.uk/programmes/m001g8ys,Chris Paul,
2299,The Countryside Hour: Countryside Extra: With Anna Perrott and Paul Stancliffe,2021-22,https://www.bbc.co.uk/programmes/p0bwhts3,Chris Paul,
2300,Rugby Union Weekly: Maro and the Mona Lisa,2021-22,https://www.bbc.co.uk/programmes/p0bw9gpk,Chris Paul,
2301,Rugby Union Weekly: Vive Les Bleus!,2021-22,https://www.bbc.co.uk/programmes/p0bwg7wh,Chris Paul,
2302,Movies With Ali Plumb: Avengers: Endgame,2020-21,https://www.bbc.co.uk/programmes/p095v86m,Chris Paul,
2303,Louisa life raft failure led to deaths of three fishermen,2021-22,https://www.bbc.co.uk/news/uk-scotland-highlands-islands-60592172,Chris Paul,
2304,The Countryside Hour: Countryside Extra: Snooping on seagulls!,2021-22,https://www.bbc.co.uk/programmes/p0b87d3q,Chris Paul,
2306,"Leicester 5-0 Sheff Utd: We lost a leader, itâs taken its toll - Paul Heckingbottom",2020-21,https://www.bbc.co.uk/sport/av/football/56394555,Chris Paul,
2311,The Countryside Hour: Bits and pieces from High Ash Farm,2016-17,https://www.bbc.co.uk/programmes/p04w2cpt,Chris Paul,
2318,Dungannon Swifts ease past Ballinamallard 2-0 at Stangmore Park,2017-18,https://www.bbc.co.uk/sport/av/football/43185097,Chris Paul,
2320,Oldham Athletic 2-0 Grimsby Town,2018-19,https://www.bbc.co.uk/sport/football/47676327,Chris Paul,0.1788690476190476
2322,Paul Coutts: Sheffield United midfielder out for the rest of the season,2017-18,https://www.bbc.co.uk/sport/football/42053101,Chris Paul,0.0726086956521739
2326,Paul Trollope: Brighton name former Cardiff boss as assistant manager,2016-17,https://www.bbc.co.uk/sport/football/38091462,Chris Paul,0.196969696969697
2328,Nigeria deaths: McManus's former boss tried to make him stay,2011-12,https://www.bbc.co.uk/news/uk-17315653,Chris Paul,
2329,Wythenshawe by-election: 'Labour holds safe seat',2013-14,https://www.bbc.co.uk/news/world-asia-china-26193238,Chris Paul,
2331,"We have to rebuild Rangers, says Paul Murray",2014-15,https://www.bbc.co.uk/sport/av/scotland/31790235,Chris Paul,
2332,York coach ready to face brother,2009-10,http://news.bbc.co.uk/sport1/hi/rugby_league/8524963.stm,Chris Paul,
2333,NIFL 'must move' on Carrick pitch crisis say BBC Sport NI pundits,2015-16,https://www.bbc.co.uk/sport/av/football/35233437,Chris Paul,
2335,Wythenshawe by-election interview: Michael Kane,2013-14,https://www.bbc.co.uk/news/uk-politics-26064303,Chris Paul,
2336,Wythenshawe by-election interview: Nigel Woodcock,2013-14,https://www.bbc.co.uk/news/uk-politics-26064308,Chris Paul,
2337,Wythenshawe by-election interview: John Bickley,2013-14,https://www.bbc.co.uk/news/uk-politics-26064305,Chris Paul,
2338,Wythenshawe by-election interview: Eddy O'Sullivan,2013-14,https://www.bbc.co.uk/news/uk-politics-26064306,Chris Paul,
2339,Wythenshawe by-election interview: Daniel Critchlow,2013-14,https://www.bbc.co.uk/news/uk-politics-26064307,Chris Paul,
2340,Wythenshawe by-election interview: Mary Di Mauro,2013-14,https://www.bbc.co.uk/news/uk-politics-26064304,Chris Paul,
2342,Southend United to check on Chris Barker knock,2012-13,https://www.bbc.co.uk/sport/av/football/21572398,Chris Paul,
2344,Agent pays tribute to Paul the octopus,2010-11,http://news.bbc.co.uk/sport1/hi/football/9128053.stm,Chris Paul,
2347,Ulster prepare for Treviso clash,2010-11,http://news.bbc.co.uk/sport1/hi/rugby_union/9230329.stm,Chris Paul,
2348,Bottom six would be 'disaster' - Quinn,2008-09,http://news.bbc.co.uk/sport1/hi/scotland/7951003.stm,Chris Paul,
2349,Ipswich could not stop Iwelumo - Paul Jewell,2011-12,https://www.bbc.co.uk/sport/av/football/17502030,Chris Paul,
2351,Hutchings disappointed by Jewell departure,2008-09,http://news.bbc.co.uk/sport1/hi/football/7803554.stm,Chris Paul,
2353,Micky Adams hails impact of Port Vale substitutes,2011-12,https://www.bbc.co.uk/sport/av/football/17088399,Chris Paul,
2362,Simpson hoping for compensation,2009-10,http://news.bbc.co.uk/sport1/hi/football/teams/s/shrewsbury/8473152.stm,Chris Paul,
2363,Collingwood hails Woakes performance,2010-11,http://news.bbc.co.uk/sport1/hi/cricket/9359606.stm,Chris Paul,
2364,A Blog Exclusive.,2006-07,http://www.bbc.co.uk/blogs/pm/2007/03/a_blog_exclusive.shtml,Chris Paul,
2365,Lambert stunned by triple injury blow,2010-11,http://news.bbc.co.uk/sport1/hi/football/teams/n/norwich/9403576.stm,Chris Paul,
2366,Grayson delight at Ashton showing,2010-11,http://news.bbc.co.uk/sport1/hi/rugby_union/my_club/northampton/9191642.stm,Chris Paul,
2368,Torquay: Chris Hargreaves says Sturrock replacement 'not vital',2014-15,https://www.bbc.co.uk/sport/football/32248021,Chris Paul,0.09620535714285713
2370,Feeling the pain with Saints,2010-11,http://news.bbc.co.uk/sport1/hi/rugby_union/my_club/northampton/9269314.stm,Chris Paul,
2376,Buckle praises veteran Hargreaves,2009-10,http://news.bbc.co.uk/sport1/hi/football/teams/t/torquay_united/8473352.stm,Chris Paul,
2380,Highlights - Kilmarnock 1-1 St Mirren,2009-10,http://news.bbc.co.uk/sport1/hi/scotland/8527223.stm,Chris Paul,
2381,Division Three January moves,2007-08,http://news.bbc.co.uk/sport1/hi/football/scot_div_1/7223622.stm,Chris Paul,
2383,Hart questions Johnson sending-off,2008-09,http://news.bbc.co.uk/sport1/hi/football/match_of_the_day/7983610.stm,Chris Paul,
2384,Hutchings shock at Jewell exit,2008-09,http://news.bbc.co.uk/sport1/hi/football/7804465.stm,Chris Paul,
2385,Thursday's Quote of the Day,2009-10,http://www.bbc.co.uk/blogs/magazinemonitor/2009/12/thursdays_quote_of_the_day_86.shtml,Chris Paul,
2386,Knights back Mark Cavendish to be Sports Personality of the Year,2009-10,http://news.bbc.co.uk/sport1/hi/tv_and_radio/sports_personality_of_the_year/8387466.stm,Chris Paul,
2387,Larne v Dungannon Swifts,2007-08,http://news.bbc.co.uk/sport1/hi/football/irish/7144935.stm,Chris Paul,
2390,Simpson furious over Humphrey injury,2008-09,http://news.bbc.co.uk/sport1/hi/football/7749385.stm,Chris Paul,
2397,Lines likely to return quickly - Trollope,2008-09,http://news.bbc.co.uk/sport1/hi/football/7771355.stm,Chris Paul,
2398,Want to see a pic of Dom's new glasses?,2010-11,http://www.bbc.co.uk/blogs/chrismoyles/2011/02/want_to_see_a_pic_of_doms_new.html,Chris Paul,
2400,Shuker delights Hart,2003-04,http://news.bbc.co.uk/sport1/hi/football/teams/b/barnsley/3554675.stm,Chris Paul,
2403,Morton 2-0 Alloa Athletic,2004-05,http://news.bbc.co.uk/sport1/hi/football/scot_div_1/4446569.stm,Chris Paul,
2412,Yeah! It's the weekend!,2010-11,http://www.bbc.co.uk/blogs/chrismoyles/2010/12/yeah_its_the_weekend.html,Chris Paul,
2413,Crystal Palace sign Kwesi Appiah and Michael Chambers,2011-12,https://www.bbc.co.uk/sport/football/16821640,Chris Paul,0.0
2417,June's blog,2007-08,http://www.bbc.co.uk/blogs/chrismoyles/2008/03/junes_blog.html,Chris Paul,
2419,Prototyping Weeknotes #38 (29/10/10),2010-11,http://www.bbc.co.uk/blogs/researchanddevelopment/2010/10/prototyping-weeknotes-37-29101.shtml,Chris Paul,
2422,Prototyping Weeknotes #43 (10/12/10),2010-11,http://www.bbc.co.uk/blogs/researchanddevelopment/2010/12/prototyping-weeknotes-43-10121.shtml,Chris Paul,
2424,Thorman ready for Paul challenge,2009-10,http://news.bbc.co.uk/sport1/hi/rugby_league/8501466.stm,Chris Paul,
2430,Norwich to off-load duo,2002-03,http://news.bbc.co.uk/sport1/hi/football/teams/n/norwich/2928469.stm,Chris Paul,
2433,Glentoran 3-1 Institute,2005-06,http://news.bbc.co.uk/sport1/hi/football/irish/4750792.stm,Chris Paul,
2436,Division Two January moves,2007-08,http://news.bbc.co.uk/sport1/hi/football/scot_div_1/7223611.stm,Chris Paul,
2438,The Wild Thing live on Drive!,2009-10,http://www.bbc.co.uk/blogs/simonmayo/2010/02/the_wild_thing_live_on_drive.shtml,Chris Paul,
2441,Celtics too strong for Mavericks in NBA,2009-10,http://news.bbc.co.uk/sport1/hi/other_sports/basketball/8578617.stm,Paul Pierce,
2442,Pierce blow deepens Celtics woe,2006-07,http://news.bbc.co.uk/sport1/hi/other_sports/basketball/6337689.stm,Paul Pierce,
2443,Lakers hold off Thunder in NBA,2009-10,http://news.bbc.co.uk/sport1/hi/other_sports/basketball/8427945.stm,Paul Pierce,
2445,Pierce stars for Celtics,2002-03,http://news.bbc.co.uk/sport1/hi/other_sports/us_sport/2817153.stm,Paul Pierce,
2447,Pierce outshines LeBron,2003-04,http://news.bbc.co.uk/sport1/hi/other_sports/us_sport/3317367.stm,Paul Pierce,
2448,Pierce fires up Celtics,2002-03,http://news.bbc.co.uk/sport1/hi/other_sports/us_sport/2696753.stm,Paul Pierce,
2450,Paul Waugh on the net election,2009-10,http://news.bbc.co.uk/1/hi/programmes/the_daily_politics/8609505.stm,Paul Pierce,
2452,Sir Paul delays European tour,2001-02,http://news.bbc.co.uk/hi/english/entertainment/newsid_1829000/1829306.stm,Paul Pierce,
2453,Carey punches back,2001-02,http://news.bbc.co.uk/hi/english/entertainment/newsid_1832000/1832286.stm,Paul Pierce,
2454,Curious Under the Stars: Devil's Bridge: Part 3,2018-19,https://www.bbc.co.uk/programmes/m0002mkl,Paul Pierce,
2459,Hawks down Wizards,2003-04,http://news.bbc.co.uk/sport1/hi/other_sports/us_sport/3507388.stm,Paul Pierce,
2469,Body art threat to blood supplies,1999-2000,http://news.bbc.co.uk/hi/english/uk/northern_ireland/newsid_553000/553412.stm,Paul Pierce,
2474,Tougher regulation for piercing,1998-99,http://news.bbc.co.uk/hi/english/uk_politics/newsid_324000/324247.stm,Paul Pierce,
2475,Pc cannot remember 'piercing' act,2004-05,http://news.bbc.co.uk/1/hi/england/dorset/4075771.stm,Paul Pierce,
2477,Iverson inspires Sixers,2002-03,http://news.bbc.co.uk/sport1/hi/other_sports/us_sport/2899841.stm,Paul Pierce,
2478,NBA All-Star Game: Stephen Curry sets record as Team LeBron win 163-160 against Team Durant,2021-22,https://www.bbc.co.uk/sport/basketball/60459972,Paul Pierce,0.014035087719298242
2479,NBA All-Star: Giannis scores game-high 38 points in defeat to Team LeBron,2018-19,https://www.bbc.co.uk/sport/basketball/47276052,Paul Pierce,0.13415404040404041
2480,US father 'shoots his children',2008-09,http://news.bbc.co.uk/1/hi/world/americas/7984748.stm,Paul Pierce,
2483,Message in a bottle returns to New Hampshire family 50 years later,2016-17,http://www.bbc.co.uk/news/world-us-canada-37778511,Paul Pierce,
2484,Bloxwich man charged with possessing ammunition,2013-14,https://www.bbc.co.uk/news/uk-england-birmingham-24971077,Paul Pierce,
2487,Celtics add to Lakers' woes,2002-03,http://news.bbc.co.uk/sport1/hi/other_sports/us_sport/2419321.stm,Paul Pierce,
2490,NHL looks to future,2003-04,http://news.bbc.co.uk/sport1/hi/other_sports/us_sport/3468931.stm,Paul Pierce,
2492,NBA: Los Angeles Lakers continue losing start with defeat by LA Clippers,2022-23,https://www.bbc.co.uk/sport/basketball/63341374,Paul Pierce,0.3214285714285714
2495,Sixers ruin Brown return,2003-04,http://news.bbc.co.uk/sport1/hi/other_sports/us_sport/3242110.stm,Paul Pierce,
2497,Burglar absconds from open prison,2007-08,http://news.bbc.co.uk/1/hi/england/coventry_warwickshire/7117697.stm,Paul Pierce,
2500,Woman robbed at gun point in town,2006-07,http://news.bbc.co.uk/1/hi/england/oxfordshire/6424491.stm,Paul Pierce,
2501,All-Stars seal series comeback,2002-03,http://news.bbc.co.uk/sport1/hi/other_sports/us_sport/2487877.stm,Paul Pierce,
2502,Inside Music: Pianist Tom Poster on fresh approaches to listening,2022-23,https://www.bbc.co.uk/programmes/m001dp6s,Paul Pierce,
2509,Mystery man dies in accident,2002-03,http://news.bbc.co.uk/1/hi/england/2883413.stm,Paul Pierce,
2511,Man jailed for 'freak pipe death',2004-05,http://news.bbc.co.uk/1/hi/england/nottinghamshire/4298757.stm,Paul Pierce,
2513,NFL Europe gets go-ahead,2002-03,http://news.bbc.co.uk/sport1/hi/other_sports/us_sport/2883397.stm,Paul Pierce,
2515,"NBA: Jazz end two-game losing streak, Antetokounmpo stars as Bucks get back to winning ways",2021-22,https://www.bbc.co.uk/sport/basketball/59200795,Paul Pierce,0.1636363636363636
2517,Policeman not guilty of indecency,2004-05,http://news.bbc.co.uk/1/hi/england/dorset/4078907.stm,Paul Pierce,
2518,Celtics fend off Raptors,2003-04,http://news.bbc.co.uk/sport1/hi/other_sports/us_sport/3520803.stm,Paul Pierce,
2519,Saturday's photos of the day,2006-07,http://news.bbc.co.uk/sport1/hi/front_page/6392371.stm,Paul Pierce,
2520,NBA trio win through to play-offs,2004-05,http://news.bbc.co.uk/sport1/hi/other_sports/us_sport/4443589.stm,Paul Pierce,
2521,Rams ease past Bears,2002-03,http://news.bbc.co.uk/sport1/hi/other_sports/us_sport/2489805.stm,Paul Pierce,
2524,Man in court on shotgun and ammunition charges,2013-14,https://www.bbc.co.uk/news/uk-england-birmingham-25015791,Paul Pierce,
2526,Wednesday's photos of the day,2004-05,http://news.bbc.co.uk/sport1/hi/photo_galleries/photos_of_the_day/4117279.stm,Paul Pierce,
2528,In pictures: Bond is back,1999-2000,http://news.bbc.co.uk/hi/english/entertainment/newsid_532000/532691.stm,Paul Pierce,
2529,Pierce Sweeney: Exeter City captain on 300 games and Grecians' ambitions,2022-23,https://www.bbc.co.uk/sport/football/64343751,Paul Pierce,0.24781420765027323
2531,Arbroath 6-1 Albion Rovers,2011-12,https://www.bbc.co.uk/sport/football/16631000,Paul Pierce,0.07954545454545454
2534,Officer 'touched girl's piercing',2004-05,http://news.bbc.co.uk/1/hi/england/dorset/4072931.stm,Paul Pierce,
2537,Kim Kardashian sued in crypto 'pump and dump' case,2021-22,https://www.bbc.co.uk/news/technology-59964648,Paul Pierce,
2540,Iverson stars for Philadelphia,2002-03,http://news.bbc.co.uk/sport1/hi/other_sports/us_sport/2912073.stm,Paul Pierce,
2541,Super Bowl XXXIX photos,2004-05,http://news.bbc.co.uk/sport1/hi/photo_galleries/4242003.stm,Paul Pierce,
2543,NBA: Kevin Durant traded to Phoenix Suns as Russell Westbrook joins Utah Jazz,2022-23,https://www.bbc.co.uk/sport/basketball/64593463,Paul Pierce,0.08847222222222222
2549,'Flashing' Belfast bouncer Paul McCamley loses appeal,2010-11,https://www.bbc.co.uk/news/uk-northern-ireland-politics-12926013,Paul Pierce,
2550,Brosnan 'to star in Crown sequel',2007-08,http://news.bbc.co.uk/1/hi/entertainment/7094169.stm,Paul Pierce,
2551,North-South Series: Mason Crane helps South to victory in Abu Dhabi,2016-17,http://www.bbc.co.uk/sport/cricket/39338078,Paul Pierce,0.13333333333333333
2552,Exeter City 2-1 Forest Green Rovers (AET),2017-18,https://www.bbc.co.uk/sport/football/42232506,Paul Pierce,0.007026713124274113
2554,Wolves want new deal for Gilbert,2010-11,http://news.bbc.co.uk/sport1/hi/other_sports/basketball/9433310.stm,Paul Pierce,
2557,Berwick 0-1 Montrose,2010-11,http://news.bbc.co.uk/sport1/hi/football/scot_div_1/9450669.stm,Paul Pierce,
2558,NBA: Giannis Antetokounmpo scores fifth triple-double of season in Milwaukee Bucks win,2020-21,https://www.bbc.co.uk/sport/basketball/56370610,Paul Pierce,0.26519036519036526
2561,Yankees sign Matsui,2002-03,http://news.bbc.co.uk/sport1/hi/other_sports/us_sport/2592497.stm,Paul Pierce,
2565,Rockets edge out Lakers,2002-03,http://news.bbc.co.uk/sport1/hi/other_sports/us_sport/2671235.stm,Paul Pierce,
2566,Bond stars to honour Q,1999-2000,http://news.bbc.co.uk/hi/english/entertainment/newsid_652000/652505.stm,Paul Pierce,
2567,Grizzlies extend hot streak,2003-04,http://news.bbc.co.uk/sport1/hi/other_sports/us_sport/3497090.stm,Paul Pierce,
2568,Raptors strike late,2003-04,http://news.bbc.co.uk/sport1/hi/other_sports/us_sport/3378157.stm,Paul Pierce,
2569,David Fuller: Man admits 1987 murders and abusing corpses,2021-22,https://www.bbc.co.uk/news/uk-england-kent-59167648,Paul Pierce,
2571,Terror case coverage condemned,2002-03,http://news.bbc.co.uk/1/hi/england/2487345.stm,Paul Pierce,
2573,Edinburgh Capitals lose to Coventry Blaze in the Elite League,2011-12,https://www.bbc.co.uk/sport/ice-hockey/17433383,Paul Pierce,-0.06126543209876542
2576,Warriors continue Boston woe,2002-03,http://news.bbc.co.uk/sport1/hi/other_sports/us_sport/2890719.stm,Paul Pierce,
2579,NBA season preview: Who will challenge the Golden State Warriors?,2017-18,https://www.bbc.co.uk/sport/basketball/41626662,Paul Pierce,0.13876742656984592
2580,Kidd casts spell on Wizards,2002-03,http://news.bbc.co.uk/sport1/hi/other_sports/us_sport/2393351.stm,Paul Pierce,
2581,Madonna to sing Bond theme,2001-02,http://news.bbc.co.uk/hi/english/entertainment/music/newsid_1883000/1883995.stm,Paul Pierce,
2582,Jersey Premiership: Scottish beat St Peter to extend lead,2012-13,https://www.bbc.co.uk/sport/football/21456523,Paul Pierce,0.28506944444444443
2585,Everton Tigers v Cheshire Jets,2009-10,http://news.bbc.co.uk/sport1/hi/other_sports/basketball/8472241.stm,Paul Pierce,
2586,Fish-eating dinosaur found,1998-99,http://news.bbc.co.uk/hi/english/sci/tech/newsid_213000/213073.stm,Paul Pierce,
2589,Ebola healthcare workers discharged,2014-15,https://www.bbc.co.uk/news/health-31439204,Paul Pierce,
2592,Celtics on the up,2003-04,http://news.bbc.co.uk/sport1/hi/other_sports/us_sport/3509598.stm,Paul Pierce,
2593,Pacers stretch streak,2003-04,http://news.bbc.co.uk/sport1/hi/other_sports/us_sport/3384879.stm,Paul Pierce,
2594,Wallace rescues Blazers,2002-03,http://news.bbc.co.uk/sport1/hi/other_sports/us_sport/2945299.stm,Paul Pierce,
2595,Playlist 14.11.08,2008-09,http://www.bbc.co.uk/blogs/stuartbailie/2008/11/playlist_141108.shtml,Paul Pierce,
2597,Sonics see off Sixers,2002-03,http://news.bbc.co.uk/sport1/hi/other_sports/us_sport/2568233.stm,Paul Pierce,
2600,Front Row: Harry Hill on I Can't Sing; George Michael's Symphonica album; A Long Way Down,2013-14,https://www.bbc.co.uk/programmes/b03y0n8d,Paul Pierce,
2601,South beat North to win three-match series in Dubai,2016-17,https://www.bbc.co.uk/sport/cricket/39322676,Paul Pierce,0.10166666666666666
2602,Romance tops Valentine box office,2009-10,http://news.bbc.co.uk/1/hi/entertainment/8515847.stm,Paul Pierce,
2604,Wizards leave it late,2004-05,http://news.bbc.co.uk/sport1/hi/other_sports/us_sport/4021435.stm,Paul Pierce,
2605,LeBron inspires Cavaliers,2003-04,http://news.bbc.co.uk/sport1/hi/other_sports/us_sport/3494886.stm,Paul Pierce,
2606,Francis inspires Rockets,2002-03,http://news.bbc.co.uk/sport1/hi/other_sports/us_sport/2656087.stm,Paul Pierce,
2607,Matthew Topham: Death crash lotto winner 'wishes he had stopped',2020-21,https://www.bbc.co.uk/news/uk-england-lincolnshire-56339897,Paul Pierce,
2609,"NBA: LA rivalry, Zion Williamson & China disputes - the big talking points before new season",2019-20,https://www.bbc.co.uk/sport/basketball/50132656,Paul Pierce,0.15543732782369143
2610,Heatley foiled by West,2002-03,http://news.bbc.co.uk/sport1/hi/other_sports/us_sport/2712763.stm,Paul Pierce,
2611,Jersey Premiership: St Paul's edge closer to title with Scottish draw,2013-14,https://www.bbc.co.uk/sport/football/26856524,Paul Pierce,0.11709519436792165
2612,Bank accused wins Law Lords case,2006-07,http://news.bbc.co.uk/1/hi/northern_ireland/6195210.stm,Paul Pierce,
2618,Nash stars for Dallas,2002-03,http://news.bbc.co.uk/sport1/hi/other_sports/us_sport/2537383.stm,Paul Pierce,
2620,Super Bowl 2020: Kansas City beat San Francisco - Patrick Mahomes provides perfect finish,2019-20,https://www.bbc.co.uk/sport/american-football/51354055,Paul Pierce,0.10030579885231047
2621,Nature: Series 5: The Water Boatman's Song,2011-12,https://www.bbc.co.uk/programmes/b0194mvq,Paul Pierce,
2624,Exeter City 2-1 Stevenage,2019-20,https://www.bbc.co.uk/sport/football/51268277,Paul Pierce,0.20569105691056916
2626,Lakers halt Kings' run,2002-03,http://news.bbc.co.uk/sport1/hi/other_sports/us_sport/2938333.stm,Paul Pierce,
2627,Wizards down Celtics,2002-03,http://news.bbc.co.uk/sport1/hi/other_sports/us_sport/2634089.stm,Paul Pierce,
2630,David Fuller: Killer who abused mortuary bodies will die in jail,2021-22,https://www.bbc.co.uk/news/uk-england-kent-59601656,Paul Pierce,
2631,Breaking Bad's Aaron Paul: I have never been this busy,2013-14,https://www.bbc.co.uk/news/newsbeat-26680909,Paul Pierce,
2634,North v South: Mark Wood strikes on return while Ben Duckett makes century,2016-17,https://www.bbc.co.uk/sport/cricket/39281294,Paul Pierce,0.15454545454545457
2640,BBL: Cheshire Phoenix maintain impressive winning run,2014-15,https://www.bbc.co.uk/sport/basketball/30328222,Paul Pierce,0.20886574074074074
