Unnamed: 0,title,date,url,player,textblob_Sentiment
4967,Kawhi Leonard and Paul George break scoring records in LA Clippers win,2019-20,https://www.bbc.co.uk/sport/basketball/50792823,James Harden,0.3333333333333333
4968,Russell Westbrook ties Wilt Chamberlain's triple-double record,2018-19,https://www.bbc.co.uk/sport/basketball/47188932,James Harden,0.11083333333333333
4970,Sherlock Holmes: The Hound of the Baskervilles: 1. The Powers of Evil,1998-99,https://www.bbc.co.uk/programmes/b007k1np,James Harden,
4971,NBA: Stephen Curry inspires Golden State Warriors to victory over LA Clippers,2021-22,https://www.bbc.co.uk/sport/basketball/59441291,James Harden,0.28846153846153844
4972,Gordon Hayward: Boston Celtics forward fractures ankle in heavy fall,2017-18,https://www.bbc.co.uk/sport/basketball/41662878,James Harden,0.07288267288267289
4973,Moreton Corbet's Puritan spectre,2009-10,http://news.bbc.co.uk/local/shropshire/hi/people_and_places/history/newsid_8329000/8329563.stm,James Harden,
4975,LV=Cup: Scarlets 13-7 Gloucester,2013-14,https://www.bbc.co.uk/sport/rugby-union/25885845,James Harden,0.06000000000000001
4976,Luka Doncic scores 40-point triple-double as Dallas Mavericks beat San Antonio Spurs,2019-20,https://www.bbc.co.uk/sport/basketball/50471018,James Harden,
4977,Assume Nothing: The Heiress and The General: Episode 1: A Knock on the Door,2021-22,https://www.bbc.co.uk/programmes/m0014nkk,James Harden,
4982,James leads Cavaliers charge,2003-04,http://news.bbc.co.uk/sport1/hi/other_sports/us_sport/3274637.stm,James Harden,
4984,Amlin Challenge Cup: Gloucester 47-3 London Irish,2012-13,https://www.bbc.co.uk/sport/rugby-union/20716418,James Harden,
4990,The Repair Shop: Series 9: Episode 33,2022-23,https://www.bbc.co.uk/programmes/m001f0tt,James Harden,
4991,LeBron vs Zlatan: Who won the politics bout?,2020-21,https://www.bbc.co.uk/news/world-us-canada-56222894,James Harden,
4992,NBA: Anthony Davis leads Los Angeles Lakers to seventh straight win over Memphis Grizzlies,2020-21,https://www.bbc.co.uk/sport/basketball/56052423,James Harden,0.18579545454545454
4993,Brooklyn Nets beat Orlando Magic for eighth straight win,2020-21,https://www.bbc.co.uk/sport/basketball/56207442,James Harden,0.010389610389610381
4994,NBA: Phoenix Suns secure 16th win in a row against Brooklyn Nets despite Kevin Durant heroics,2021-22,https://www.bbc.co.uk/sport/basketball/59449866,James Harden,0.13125
4995,Caris LeVert: Brooklyn Nets to Indiana Pacers trade could have saved his life,2020-21,https://www.bbc.co.uk/sport/basketball/55730153,James Harden,0.17490909090909093
4996,G'ford Heat 66-84 Mersey Tigers,2010-11,http://news.bbc.co.uk/sport1/hi/other_sports/basketball/9415736.stm,James Harden,
4997,NBA: Luka Doncic inspires Dallas Mavericks to Christmas Day win over Los Angeles Lakers,2022-23,https://www.bbc.co.uk/sport/basketball/64093917,James Harden,0.16170798898071626
5002,Jordan: A career in four acts,2002-03,http://news.bbc.co.uk/sport1/hi/other_sports/us_sport/2724231.stm,James Harden,
5003,NBA: Denver Nuggets beat Los Angeles Lakers 133-96,2021-22,https://www.bbc.co.uk/sport/basketball/60014693,James Harden,0.13106060606060607
5006,Vitamin boost for transplant patients,2001-02,http://news.bbc.co.uk/hi/english/health/newsid_1898000/1898438.stm,James Harden,
5008,NBA: Memphis Grizzlies beat Phoenix Suns by one point,2021-22,https://www.bbc.co.uk/sport/basketball/59807910,James Harden,0.253968253968254
5009,Harlequins 28-25 Gloucester,2012-13,https://www.bbc.co.uk/sport/rugby-union/20143878,James Harden,0.14451659451659452
5010,NBA: LeBron James scores 26 points against his former side as the LA Lakers win again,2021-22,https://www.bbc.co.uk/sport/basketball/59101077,James Harden,0.15066844919786096
5011,Harlequins 29-31 Gloucester,2009-10,http://news.bbc.co.uk/sport1/hi/rugby_union/8490660.stm,James Harden,
5014,Michael Sheen to star in climber Mallory biopic,2014-15,http://www.bbc.co.uk/news/entertainment-arts-32215568,James Harden,
5015,NBA: Miami Heat set free-throw record in 112-111 win over Oklahoma City Thunder,2022-23,https://www.bbc.co.uk/sport/basketball/64233233,James Harden,0.20024305555555555
5017,NBA: Andre Drummond injured on debut as LA Lakers lose to Milwaukee Bucks,2020-21,https://www.bbc.co.uk/sport/basketball/56599927,James Harden,0.21824795574795575
5018,"NBA: LA Lakers edge win over Chicago Bulls, Warriors beat Clippers",2020-21,https://www.bbc.co.uk/sport/basketball/55599975,James Harden,0.14157196969696967
5019,NBA: LaMarcus Aldridge impresses on debut in Brooklyn Nets win,2020-21,https://www.bbc.co.uk/sport/basketball/56613612,James Harden,0.22681818181818175
5020,NBA: Russell Westbrook makes historic triple-double for Washington Wizards,2020-21,https://www.bbc.co.uk/sport/basketball/56574070,James Harden,0.16616161616161615
5021,Car insurance set to soar,1998-99,http://news.bbc.co.uk/hi/english/business/your_money/newsid_259000/259367.stm,James Harden,
5022,Your thoughts on West Ham's transfer window,2021-22,https://www.bbc.com/sport/articles/cnw8xlge4w6o,James Harden,
5023,Northampton 16-18 Gloucester,2010-11,http://news.bbc.co.uk/sport1/hi/rugby_union/english/9406274.stm,James Harden,
5024,Aviva Premiership: Bath 31-25 Gloucester,2012-13,https://www.bbc.co.uk/sport/rugby-union/21591055,James Harden,
5025,Gloucester 19-24 Sale,2011-12,https://www.bbc.co.uk/sport/rugby-union/17749428,James Harden,0.11849179626957405
5028,LA Clippers snatch win over Washington Wizards in huge comeback,2021-22,https://www.bbc.co.uk/sport/basketball/60137437,James Harden,0.1984312825221916
5029,Men jailed for fight before Shrewsbury and Walsall fixture,2013-14,https://www.bbc.co.uk/news/uk-england-shropshire-24746826,James Harden,
5030,NBA: Brooklyn Nets must manage Kevin Durant game time - Steve Nash,2021-22,https://www.bbc.co.uk/sport/basketball/59694810,James Harden,0.0708994708994709
5033,Gloucester 29-23 Harlequins,2011-12,https://www.bbc.co.uk/sport/rugby-union/17106624,James Harden,
5036,Raiders in focus,2002-03,http://news.bbc.co.uk/sport1/hi/other_sports/us_sport/2682155.stm,James Harden,
5038,Devon marines renamed after Bond author's wartime group,2010-11,https://www.bbc.co.uk/news/uk-england-devon-11980837,James Harden,
5041,US 'war is fun' general rebuked,2004-05,http://news.bbc.co.uk/1/hi/world/americas/4234751.stm,James Harden,
5042,NFL play-offs: Patrick Mahomes 'out of concussion protocol' for Kansas City Chiefs,2020-21,https://www.bbc.co.uk/sport/american-football/55768423,James Harden,0.15265151515151512
5043,NBA: New York Knicks make play-offs for first time in eight years after Celtics lose to Cleveland,2020-21,https://www.bbc.co.uk/sport/basketball/57097575,James Harden,0.047593582887700527
5044,NFL: Green Bay Packers end Arizona Cardinals' unbeaten start to the season,2021-22,https://www.bbc.co.uk/sport/american-football/59087320,James Harden,0.05953282828282828
5046,Super Bowl 2020: Kansas City beat San Francisco - Patrick Mahomes provides perfect finish,2019-20,https://www.bbc.co.uk/sport/american-football/51354055,James Harden,0.10030579885231047
5047,"NBA: Phoenix Suns beat Utah Jazz to go 4-1, Philadelphia 76ers beat Orlando Magic",2020-21,https://www.bbc.co.uk/sport/basketball/55505873,James Harden,0.20867003367003367
5048,Leicester 36-3 Gloucester,2011-12,https://www.bbc.co.uk/sport/rugby-union/17196209,James Harden,0.09579813108038912
5049,North v South: Mark Wood strikes on return while Ben Duckett makes century,2016-17,https://www.bbc.co.uk/sport/cricket/39281294,James Harden,0.15454545454545457
5050,Nottage admits Australia gamble,2009-10,http://news.bbc.co.uk/sport1/hi/rugby_union/my_club/gloucester/8339648.stm,James Harden,
5052,Brown puts his faith in youth,2007-08,http://news.bbc.co.uk/1/hi/uk_politics/7209076.stm,James Harden,
5053,Kobe Bryant: Wife Vanessa leads emotional memorial to basketball star and daughter Gianna,2019-20,https://www.bbc.co.uk/sport/basketball/51622134,James Harden,0.2902263374485597
5054,Kawhi Leonard: LA Clippers star enjoys victorious return to Toronto Raptors,2019-20,https://www.bbc.co.uk/sport/basketball/50755293,James Harden,0.08813131313131314
5056,NBA round-up: Stephen Curry helps Golden State Warriors beat Los Angeles Lakers,2020-21,https://www.bbc.co.uk/sport/basketball/55701354,James Harden,0.06487603305785122
5057,BBL & WBBL Cup final 2018: Cheshire and Nottingham secure victories,2017-18,https://www.bbc.co.uk/sport/basketball/42852526,James Harden,0.07843253968253969
5059,Boy who raped sister after watching pornography sentenced,2013-14,https://www.bbc.co.uk/news/uk-england-lancashire-26418508,James Harden,
5060,Fifty Shades of Grey actor Jamie Dornan becomes father,2013-14,https://www.bbc.co.uk/news/newsbeat-25428385,James Harden,
5061,Iran's Revolutionary Guards set to be labelled as terrorist group by UK,2022-23,https://www.bbc.co.uk/news/uk-64156965,James Harden,
5063,Rookie Evans reigns for Kings,2009-10,http://news.bbc.co.uk/sport1/hi/other_sports/basketball/8542774.stm,Tyreke Evans,
5064,Kings win is Evans' crowning glory,2009-10,http://news.bbc.co.uk/sport1/hi/other_sports/basketball/8561845.stm,Tyreke Evans,
5065,Tyreke Johnson: Southampton midfielder joins Gillingham on loan,2020-21,https://www.bbc.co.uk/sport/football/55593846,Tyreke Evans,0.2888888888888889
5066,Boreham Wood 0-1 Woking,2021-22,https://www.bbc.co.uk/sport/football/60883999,Tyreke Evans,-0.09005376344086018
5067,Connor Ogilvie: Gillingham defender rejects new deal and leaves League One side,2020-21,https://www.bbc.co.uk/sport/football/57115724,Tyreke Evans,0.11558441558441558
5068,Callum Slattery: Southampton midfielder joins Gillingham on loan,2020-21,https://www.bbc.co.uk/sport/football/55666527,Tyreke Evans,0.118
5071,Tom Brady 'un-retires' and disappoints unlucky fan,2021-22,https://www.bbc.co.uk/news/world-us-canada-60741228,Tyreke Evans,
5072,World Series: Houston Astros beat New York Yankees & will face LA Dodgers,2017-18,https://www.bbc.co.uk/sport/baseball/41712323,Tyreke Evans,0.07549407114624507
5074,Karl-Anthony Towns records season-high NBA score in Minnesota Timberwolves win,2021-22,https://www.bbc.co.uk/sport/basketball/60747632,Tyreke Evans,0.26499999999999996
5076,NFL play-offs: San Francisco 49ers and Cincinnati Bengals claim upsets in divisional round,2021-22,https://www.bbc.co.uk/sport/american-football/60099669,Tyreke Evans,0.04517437423687422
5078,Pujols and Pedroia win MVP awards,2008-09,http://news.bbc.co.uk/sport1/hi/other_sports/baseball/7736369.stm,Tyreke Evans,
5079,Tom Brady: NFL great makes retirement U-turn after six weeks,2021-22,https://www.bbc.co.uk/sport/american-football/60731983,Tyreke Evans,0.16908191990159202
5080,Rodriguez joins Yankees,2003-04,http://news.bbc.co.uk/sport1/hi/other_sports/us_sport/3489607.stm,Tyreke Evans,
5083,Super Bowl 2021: Tom Brady wins seventh title as Tampa Bay Buccaneers beat Kansas City Chiefs,2020-21,https://www.bbc.co.uk/sport/american-football/55975394,Tyreke Evans,0.15695049429521474
5084,Tom Brady's Tampa Bay Buccaneers to face Patrick Mahomes' Kansas City Chiefs in Super Bowl 55,2020-21,https://www.bbc.co.uk/sport/american-football/55791239,Tyreke Evans,0.25037575186090044
5085,NFL play-offs: Profiles and ones to watch for eight teams in divisional round,2021-22,https://www.bbc.co.uk/sport/american-football/60088341,Tyreke Evans,0.14169673614760325
5086,"NFL play-offs: San Francisco 49ers, Kansas City Chiefs and Tampa Bay Buccaneers win",2021-22,https://www.bbc.co.uk/sport/american-football/60019066,Tyreke Evans,0.11085248085248078
5088,âI sold my wedding presents to set up my companyâ,2018-19,https://www.bbc.co.uk/news/business-47460591,Tyreke Evans,
5089,NFL play-offs: Kansas City Chiefs and Los Angeles Rams win thrillers,2021-22,https://www.bbc.co.uk/sport/american-football/60106118,Tyreke Evans,0.1599968759762574
5090,Transfer news: Done deals during January 2021,2020-21,https://www.bbc.co.uk/sport/55507839,Tyreke Evans,0.11406926406926406
5100,Houston Astros beat Boston Red Sox to reach World Series against Braves or Dodgers,2021-22,https://www.bbc.co.uk/sport/baseball/59020639,Luis Scola,0.023649267399267395
5103,Marlins off to a flyer,2003-04,http://news.bbc.co.uk/sport1/hi/other_sports/us_sport/3606429.stm,Luis Scola,
5104,Fight Talk: Who wins Wilder v Fury II? Was John Ryder robbed of world title?,2019-20,https://www.bbc.co.uk/sport/boxing/50547953,Luis Scola,0.12509695165945164
5108,World Series 2021: Atlanta Braves crush Houston Astros to win first Fall Classic since 1995,2021-22,https://www.bbc.co.uk/sport/baseball/59144305,Luis Scola,0.1225869809203143
5109,Pope: Runners and riders,2012-13,http://www.bbc.co.uk/news/world-21657407,Luis Scola,
5111,Cardinals taking part in the vote,2004-05,http://news.bbc.co.uk/1/hi/world/europe/4452205.stm,Luis Scola,
5112,NBA highlights - Bosh helps Raptors beat Kings,2009-10,http://news.bbc.co.uk/sport1/hi/other_sports/basketball/8503770.stm,Chris Bosh,
5113,Bosh bags points as Raptors reign in NBA,2009-10,http://news.bbc.co.uk/sport1/hi/other_sports/basketball/8465292.stm,Chris Bosh,
5114,Bosh injured as Raptors lose in NBA,2009-10,http://news.bbc.co.uk/sport1/hi/other_sports/basketball/8606616.stm,Chris Bosh,
5115,Toronto late blast stuns Rockets,2003-04,http://news.bbc.co.uk/sport1/hi/other_sports/us_sport/3276225.stm,Chris Bosh,
5116,Prototyping Weeknotes #39 (05/11/10),2010-11,http://www.bbc.co.uk/blogs/researchanddevelopment/2010/11/prototyping-weeknotes-39-05111.shtml,Chris Bosh,
5118,NBA All-Star weekend begins,2004-05,http://news.bbc.co.uk/sport1/hi/other_sports/us_sport/4280223.stm,Chris Bosh,
5122,Floyd Mayweather: Manny Pacquiao fight rumours 'speculation',2014-15,https://www.bbc.co.uk/sport/av/basketball/31488517,Chris Bosh,
5123,Sport in focus: Shoot,2009-10,http://news.bbc.co.uk/1/hi/in_depth/8515858.stm,Chris Bosh,
5125,Rose so sweet for Raptors,2004-05,http://news.bbc.co.uk/sport1/hi/other_sports/us_sport/4289629.stm,Chris Bosh,
5131,London 2012: LeBron James and Kobe Bryant in US Olympic squad,2011-12,https://www.bbc.co.uk/sport/basketball/16586122,Chris Bosh,0.23872053872053875
5134,"NBA All-Star Weekend: Slam dunks, superheroes and a shaky anthem",2017-18,https://www.bbc.co.uk/news/newsbeat-43112540,Chris Bosh,
5137,Miami Heat beaten by Chicago Bulls to miss NBA winning record,2012-13,http://www.bbc.co.uk/sport/0/basketball/21964896,Chris Bosh,0.17604166666666665
5139,Kidd nets winning return,2004-05,http://news.bbc.co.uk/sport1/hi/other_sports/us_sport/4075981.stm,Chris Bosh,
5141,Inside Bobby's kingdom,2002-03,http://news.bbc.co.uk/sport1/hi/other_sports/specials/world_darts_championship_2003/2624959.stm,Chris Bosh,
5142,Lakers lose in Atlanta,2003-04,http://news.bbc.co.uk/sport1/hi/other_sports/us_sport/3528011.stm,Chris Bosh,
5147,Carter inspires Raptors,2003-04,http://news.bbc.co.uk/sport1/hi/other_sports/us_sport/3299553.stm,Chris Bosh,
5148,LeBron James: NBA superstar's evolution from high school prodigy,2020-21,https://www.bbc.co.uk/sport/basketball/56186430,Chris Bosh,0.1856344306893758
5149,Celtics fend off Raptors,2003-04,http://news.bbc.co.uk/sport1/hi/other_sports/us_sport/3520803.stm,Chris Bosh,
5150,NBA All-Star: Giannis scores game-high 38 points in defeat to Team LeBron,2018-19,https://www.bbc.co.uk/sport/basketball/47276052,Chris Bosh,0.13415404040404041
5154,Jackson seals new Bucs deal,2004-05,http://news.bbc.co.uk/sport1/hi/other_sports/us_sport/4404101.stm,Chris Bosh,
5155,Clippers end Pacers' unbeaten run,2004-05,http://news.bbc.co.uk/sport1/hi/other_sports/us_sport/4001595.stm,Chris Bosh,
5156,Mavericks see off Kings,2003-04,http://news.bbc.co.uk/sport1/hi/other_sports/us_sport/3429059.stm,Chris Bosh,
5159,NBA: Giannis Antetokounmpo scores fifth triple-double of season in Milwaukee Bucks win,2020-21,https://www.bbc.co.uk/sport/basketball/56370610,Chris Bosh,0.26519036519036526
5160,O'Neal stars for Lakers,2003-04,http://news.bbc.co.uk/sport1/hi/other_sports/us_sport/3450153.stm,Chris Bosh,
5161,Hull triple sinks St Louis,2002-03,http://news.bbc.co.uk/sport1/hi/other_sports/us_sport/2899929.stm,Chris Bosh,
5163,James stars in Cleveland win,2004-05,http://news.bbc.co.uk/sport1/hi/other_sports/us_sport/4144415.stm,Chris Bosh,
5164,NBA: Kevin Durant traded to Phoenix Suns as Russell Westbrook joins Utah Jazz,2022-23,https://www.bbc.co.uk/sport/basketball/64593463,Chris Bosh,0.08847222222222222
5166,Yao Ming leads Rockets,2003-04,http://news.bbc.co.uk/sport1/hi/other_sports/us_sport/3541681.stm,Chris Bosh,
5167,Brooks leads NFC to Pro Bowl win,2005-06,http://news.bbc.co.uk/sport1/hi/other_sports/american_football/4707622.stm,Chris Bosh,
5168,Hawks down Wizards,2003-04,http://news.bbc.co.uk/sport1/hi/other_sports/us_sport/3507388.stm,Chris Bosh,
5169,BBL Trophy: Lions beat Plymouth for club double win,2020-21,https://www.bbc.co.uk/sport/basketball/56478684,Chris Bosh,0.10051759834368532
5171,Inside Bobby's kingdom,2003-04,http://news.bbc.co.uk/sport1/hi/other_sports/world_darts_2004/3343487.stm,Chris Bosh,
5173,Karl-Anthony Towns records season-high NBA score in Minnesota Timberwolves win,2021-22,https://www.bbc.co.uk/sport/basketball/60747632,Chris Bosh,0.26499999999999996
5175,NBA season preview: Who will challenge the Golden State Warriors?,2017-18,https://www.bbc.co.uk/sport/basketball/41626662,Chris Bosh,0.13876742656984592
5179,Bulldogs put bite on Seminoles,2002-03,http://news.bbc.co.uk/sport1/hi/other_sports/us_sport/2621269.stm,Chris Bosh,
5183,NBA All-Star Game: Giannis Antetokounmpo MVP as Team LeBron beat Team Durant 170-150,2020-21,https://www.bbc.co.uk/sport/basketball/56318297,Chris Bosh,0.17432151182151176
5184,Super Bowl XL quotes,2005-06,http://news.bbc.co.uk/sport1/hi/other_sports/american_football/4690748.stm,Chris Bosh,
5185,Heat on fire for Shaq debut,2004-05,http://news.bbc.co.uk/sport1/hi/other_sports/us_sport/3981087.stm,Chris Bosh,
5190,NBA preview: 75th anniversary season set up to be one of the greats,2021-22,https://www.bbc.co.uk/sport/basketball/58915171,Chris Bosh,0.14648015105461906
5191,Detmer's mixed fortunes,2002-03,http://news.bbc.co.uk/sport1/hi/other_sports/us_sport/2503873.stm,Chris Bosh,
5193,Is it the 1980s again?,1999-2000,http://news.bbc.co.uk/hi/english/uk/newsid_654000/654874.stm,Chris Bosh,
5194,A-Z of the World Cup,2006-07,http://news.bbc.co.uk/sport1/hi/cricket/6439333.stm,Chris Bosh,
5196,Super Bowl 50: Denver Broncos beat Carolina Panthers,2015-16,https://www.bbc.co.uk/sport/american-football/35519220,Chris Bosh,0.1363253749617386
5198,Super Bowl 2021: Tom Brady wins seventh title as Tampa Bay Buccaneers beat Kansas City Chiefs,2020-21,https://www.bbc.co.uk/sport/american-football/55975394,Chris Bosh,0.15695049429521474
5199,NFL week 15 review: Philadelphia Eagles shock LA Rams to stay in play-off race,2018-19,https://www.bbc.co.uk/sport/american-football/46593542,Chris Bosh,0.132178502714217
5205,NFL week 12 review: Pittsburgh Steelers' winning streak ends at Denver Broncos,2018-19,https://www.bbc.co.uk/sport/american-football/46344437,Chris Bosh,0.10150978498085934
5206,Johanna Konta among tennis players back at school to study business,2020-21,https://www.bbc.co.uk/sport/tennis/56509008,Chris Bosh,0.22723349567099566
5207,Basketball's golden era,2008-09,http://news.bbc.co.uk/sport1/hi/other_sports/basketball/7892648.stm,Chris Bosh,
5208,NCAA: Is this the greatest basketball finish ever?,2015-16,https://www.bbc.co.uk/sport/basketball/35966833,Chris Bosh,0.17099466891133558
5209,London 2012: Olympic sport this week,2011-12,https://www.bbc.co.uk/sport/olympics/16678808,Chris Bosh,0.2167136034255599
5210,NFL play-offs: Chiefs and Packers top seeds on road to Super Bowl 55,2020-21,https://www.bbc.co.uk/sport/american-football/55574897,Chris Bosh,0.2015366247509106
5215,Sportsday Live - Monday 16 January,2011-12,http://news.bbc.co.uk/sport1/hi/front_page/9678373.stm,Chris Bosh,
5217,Who will win the Super Bowl?,2002-03,http://news.bbc.co.uk/sport1/hi/sports_talk/2625421.stm,Chris Bosh,
5221,"Bolt, Messi, Ronaldo, Williams, Hamilton, Murray, Kohli, Biles - icons of the decade",2019-20,https://www.bbc.co.uk/sport/50878569,Chris Bosh,0.0
5223,Super Bowl LII: Philadelphia Eagles beat New England Patriots to win title,2017-18,https://www.bbc.co.uk/sport/american-football/42940719,Chris Bosh,0.11878568961902293
5226,Super Bowl LII: A frosty welcome for Eagles in Minnesota as Brady's Patriots chase history,2017-18,https://www.bbc.co.uk/sport/american-football/42895871,Chris Bosh,0.1444842657342657
5227,College bowls round-up,2004-05,http://news.bbc.co.uk/sport1/hi/other_sports/us_sport/4137155.stm,Chris Bosh,
5228,Super Bowl XLII as it happened,2007-08,http://news.bbc.co.uk/sport1/hi/other_sports/american_football/7224160.stm,Chris Bosh,
5230,NZ v England day five as it happened,2007-08,http://news.bbc.co.uk/sport1/hi/cricket/england/7299873.stm,Chris Bosh,
5231,NZ v England day three as it happened,2007-08,http://news.bbc.co.uk/sport1/hi/cricket/england/7282451.stm,Chris Bosh,
5232,Federer v Berdych as it happened,2007-08,http://news.bbc.co.uk/sport1/hi/tennis/7199492.stm,Chris Bosh,
5235,NFL off-season news and gossip,2009-10,http://news.bbc.co.uk/sport1/hi/other_sports/american_football/8574540.stm,Chris Bosh,
5240,Baseball moves in full swing,2003-04,http://news.bbc.co.uk/sport1/hi/other_sports/us_sport/3301695.stm,Greg Monroe,
5243,NBA London: New York Knicks beat Detroit Pistons at O2,2012-13,https://www.bbc.co.uk/sport/basketball/21069222,Greg Monroe,0.014898989898989893
5244,BT Premiership One round-up,2003-04,http://news.bbc.co.uk/sport1/hi/rugby_union/scottish/3316745.stm,Greg Monroe,
5245,Yankees sign Matsui,2002-03,http://news.bbc.co.uk/sport1/hi/other_sports/us_sport/2592497.stm,Greg Monroe,
5247,BT Scotland Premiership round-up,2002-03,http://news.bbc.co.uk/sport1/hi/scotland/2531371.stm,Greg Monroe,
5248,Johnson scoops pitching prize,2002-03,http://news.bbc.co.uk/sport1/hi/other_sports/us_sport/2408123.stm,Greg Monroe,
5250,BT Premiership One round-up,2003-04,http://news.bbc.co.uk/sport1/hi/rugby_union/scottish/3297303.stm,Greg Monroe,
5252,BT Scotland Premiership round-up,2002-03,http://news.bbc.co.uk/sport1/hi/scotland/2506941.stm,Greg Monroe,
5253,BT Premiership One round-up,2003-04,http://news.bbc.co.uk/sport1/hi/rugby_union/scottish/3386329.stm,Greg Monroe,
5254,Patriots rally to win Super Bowl,2004-05,http://news.bbc.co.uk/sport1/hi/other_sports/us_sport/4237273.stm,Greg Monroe,
5256,BT Premiership One round-up,2003-04,http://news.bbc.co.uk/sport1/hi/rugby_union/scottish/3274077.stm,Greg Monroe,
5257,BT Premiership One round-up,2003-04,http://news.bbc.co.uk/sport1/hi/rugby_union/scottish/3469315.stm,Greg Monroe,
5259,My kind of town: Chicago,2001-02,http://news.bbc.co.uk/sport1/hi/other_sports/us_sport/1660515.stm,Greg Monroe,
5261,BT Premiership One round-up,2003-04,http://news.bbc.co.uk/sport1/hi/rugby_union/scottish/3426617.stm,Greg Monroe,
5263,Braves still set standard,2002-03,http://news.bbc.co.uk/sport1/hi/other_sports/us_sport/2893961.stm,Greg Monroe,
5265,NFL week eight review: LA Rams continue perfect start as Saints get revenge over Vikings,2018-19,https://www.bbc.co.uk/sport/american-football/46016794,Greg Monroe,0.13946921596921596
5267,Election 2016: Obama woos voters in âJunkyard Dogâ country,2016-17,https://www.bbc.co.uk/news/election-us-2016-37838287,Greg Monroe,
5269,BT Premiership One round-up,2003-04,http://news.bbc.co.uk/sport1/hi/rugby_union/scottish/3253857.stm,Greg Monroe,
5271,BT Scotland Premiership round-up,2002-03,http://news.bbc.co.uk/sport1/hi/scotland/2694839.stm,Greg Monroe,
5272,Super Bowl 53: New England Patriots beat Los Angeles Rams 13-3 for record sixth win,2018-19,https://www.bbc.co.uk/sport/american-football/47112047,Greg Monroe,0.10883513117119675
5276,Quotes of the week,2007-08,http://news.bbc.co.uk/sport1/hi/funny_old_game/7238585.stm,Greg Monroe,
5277,Front Row: Anne Tyler in conversation with Mark Lawson,2012-13,https://www.bbc.co.uk/programmes/b01rgm36,Ty Lawson,
5279,San Diego Padres: Manny Machado signs record free agent deal,2018-19,https://www.bbc.co.uk/sport/baseball/47328811,Ty Lawson,0.13375
5282,NBA: Ja Morant sets new Memphis Grizzlies record against San Antonio Spurs,2021-22,https://www.bbc.co.uk/sport/basketball/60568024,Ty Lawson,0.28598401598401596
5283,Steelers seal Super Bowl victory,2005-06,http://news.bbc.co.uk/sport1/hi/other_sports/american_football/4676218.stm,Ty Lawson,
5284,Overtime joy for Favre,2003-04,http://news.bbc.co.uk/sport1/hi/other_sports/us_sport/3358543.stm,Ty Lawson,
5287,Bonds blast in vain,2002-03,http://news.bbc.co.uk/sport1/hi/other_sports/us_sport/2442443.stm,Ty Lawson,
5288,NFL 2021 awards: Aaron Rodgers named Most Valuable Player for fourth time,2021-22,https://www.bbc.co.uk/sport/american-football/60320432,Ty Lawson,0.18844696969696975
5289,Cheshire Jets 86-89 Sheff Sharks,2009-10,http://news.bbc.co.uk/sport1/hi/other_sports/basketball/8456405.stm,Ty Lawson,
5290,NFL play-offs: Five players set to light up the post-season,2020-21,https://www.bbc.co.uk/sport/american-football/55548609,Ty Lawson,0.1608501192684866
5297,NFL week 12 review: Pittsburgh Steelers' winning streak ends at Denver Broncos,2018-19,https://www.bbc.co.uk/sport/american-football/46344437,Ty Lawson,0.10150978498085934
5299,Evans to undergo second neck op,2009-10,http://news.bbc.co.uk/sport1/hi/rugby_union/scottish/8513669.stm,Ty Lawson,
5301,âI sold my wedding presents to set up my companyâ,2018-19,https://www.bbc.co.uk/news/business-47460591,Ty Lawson,
5302,Super Bowl XLIII as it happened,2008-09,http://news.bbc.co.uk/sport1/hi/other_sports/american_football/7861265.stm,Ty Lawson,
5303,NFL play-offs: Kansas City Chiefs target third straight Super Bowl in Conference Championships,2021-22,https://www.bbc.co.uk/sport/american-football/60169849,Ty Lawson,0.0722063968526233
