title,date,url,player,textblob_sentiment,sentiment_bert_average_score,sentiment_xlnet_average_score,bert_relevance
Super Bowl LI: New England Patriots recover from record deficit to beat Atlanta Falcons,2017,https://www.bbc.co.uk/sport/american-football/38876834,Thaddeus Young,0.1248586393030838,0.5879135065608554,0.5784616337882148,0.5906133055686951
NBA: Everything you need to know about the 2016-17 season,2017,https://www.bbc.co.uk/sport/basketball/37717478,Draymond Green,0.1404705369257608,0.5883280975478036,0.6069504192897252,0.5767537951469421
NFL play-offs: Patriots and Falcons win to move one game away from Super Bowl,2017,https://www.bbc.co.uk/sport/american-football/38627457,Draymond Green,0.0964646464646464,0.6276085674762726,0.5445209741592407,0.5767537951469421
"NFL week 9: Ajayi, Oakland, Luck and the 49ers feature in our mid-season awards",2017,https://www.bbc.co.uk/sport/american-football/37876336,Draymond Green,0.0562766554433221,0.5679724282688565,0.574082162645128,0.5767537951469421
NFL play-offs: Patriots and Falcons win to move one game away from Super Bowl,2017,https://www.bbc.co.uk/sport/american-football/38627457,Dion Waiters,0.0964646464646464,0.5506170988082886,0.5684553980827332,0.6140668392181396
NBA: Everything you need to know about the 2016-17 season,2017,https://www.bbc.co.uk/sport/basketball/37717478,Rudy Gay,0.1404705369257608,0.5826866200992039,0.6048885328429086,0.5957121253013611
Trump presidency week two: Foot still on accelerator,2017,https://www.bbc.co.uk/news/world-us-canada-38830514,Rudy Gay,0.0,0.5386323928833008,0.5153307914733887,0.5957121253013611
North v South: Mark Wood strikes on return while Ben Duckett makes century,2017,https://www.bbc.co.uk/sport/cricket/39281294,Josh Richardson,0.1545454545454545,0.6138297120730082,0.5976040760676066,0.6393991708755493
"NFL week 9: Ajayi, Oakland, Luck and the 49ers feature in our mid-season awards",2017,https://www.bbc.co.uk/sport/american-football/37876336,Josh Richardson,0.0562766554433221,0.5469073520766364,0.5719981855816312,0.6393991708755493
Tim Kneale and Mark Cavendish among Isle of Man sports awards nominees,2017,https://www.bbc.co.uk/sport/38905818,Josh Richardson,0.0833673469387755,0.5788413524627686,0.5373094558715821,0.6393991708755493
Ice hockey: Dundee Stars head coach Marc LeFebvre hails Cale Tanaka contribution,2017,https://www.bbc.co.uk/sport/ice-hockey/39251618,Josh Richardson,0.0747826908541194,0.5623407363891602,0.5795698861281077,0.6393991708755493
New Year Honours 2017: Olympic heroes and entertainers recognised,2017,https://www.bbc.co.uk/news/uk-38470732,Josh Richardson,0.1363636363636363,0.5482562184333801,0.5933109521865845,0.6393991708755493
