title,date,url,player,textblob_sentiment,sentiment_bert_average_score,sentiment_xlnet_average_score,bert_relevance,relevance_score
Watch: Stephen Curry lights up NBA All-Star weekend,2021,https://www.bbc.co.uk/sport/av/basketball/56320296,Stephen Curry,0.0,0.556215763092041,0.6843924522399902,0.6268447637557983,0.1086275801314555
"NBA: Stephen Curry, Luka Doncic and Kyrie Irving star in best plays of the week",2021,https://www.bbc.co.uk/sport/av/basketball/56799805,Stephen Curry,1.0,0.6167026162147522,0.6028950214385986,0.6268447637557983,1.0
NBA: Stephen Curry sets record for most three-pointers in a month,2021,https://www.bbc.co.uk/sport/basketball/56884822,Stephen Curry,0.1238782051282051,0.5453809301058451,0.5557775298754374,0.6268447637557983,0.0754002923992406
NBA: Golden State Warriors coach Steve Kerr hails Stephen Curry scoring streak after win over 76ers,2021,https://www.bbc.co.uk/sport/basketball/56812419,Stephen Curry,0.0993506493506493,0.5420785546302795,0.6151183446248373,0.6268447637557983,0.0799842027746563
NBA: Stephen Curry sets Golden State Warriors record in win over Denver Nuggets,2021,https://www.bbc.co.uk/sport/basketball/56729552,Stephen Curry,0.1434681637806638,0.5639479607343674,0.5742666721343994,0.6268447637557983,0.0428958003342151
NBA: Stephen Curry scores 41 points as Golden State Warriors beat Milwaukee Bucks,2021,https://www.bbc.co.uk/sport/basketball/56659775,Stephen Curry,0.239983164983165,0.5549102226893107,0.6378509998321533,0.6268447637557983,0.0620396980468285
NBA: Stephen Curry shines for Golden State Warriors in win over leaders Utah Jazz,2021,https://www.bbc.co.uk/sport/basketball/56398838,Stephen Curry,0.2471170033670034,0.5858694911003113,0.5709006637334824,0.6268447637557983,0.0370211711846978
NBA: Stephen Curry & Luka Doncic star in best plays of the week,2021,https://www.bbc.co.uk/sport/av/basketball/56086875,Stephen Curry,1.0,0.6733726859092712,0.7390440702438354,0.6268447637557983,0.091261211466363
NBA plays of the week: Stephen Curry stars as Warriors beat Pacers,2021,https://www.bbc.co.uk/sport/av/basketball/55709371,Stephen Curry,0.0,0.5481595993041992,0.6393924951553345,0.6268447637557983,0.0497725356484358
NBA highlights: Stephen Curry scores career-high points total in Golden State win,2021,https://www.bbc.co.uk/sport/av/basketball/55528947,Stephen Curry,0.3666666666666667,0.5929149389266968,0.5507951974868774,0.6268447637557983,0.0518391063550373
NBA round-up: Stephen Curry helps Golden State Warriors beat Los Angeles Lakers,2021,https://www.bbc.co.uk/sport/basketball/55701354,Stephen Curry,0.0648760330578512,0.5233362317085266,0.5404909451802572,0.6268447637557983,0.0380768263906236
NBA: Stephen Curry scores career-high points total in Golden State Warriors win,2021,https://www.bbc.co.uk/sport/basketball/55527301,Stephen Curry,0.2301515151515151,0.6054180463155111,0.5973259607950846,0.6268447637557983,0.2789154341005829
NBA: Kyrie Irving & Steph Curry star in best plays of the week,2021,https://www.bbc.co.uk/sport/av/basketball/56731681,Stephen Curry,1.0,0.6279561519622803,0.5503916144371033,0.6268447637557983,0.0549130914915237
"NBA: Carmelo Anthony makes history, New York Knicks continue impressive run",2021,https://www.bbc.co.uk/sport/basketball/56978313,Stephen Curry,0.4022977022977022,0.5581209361553192,0.5579369366168976,0.6268447637557983,0.0590549287058684
NBA: Utah Jazz beat Philadelphia 76ers to enhance league's best record,2021,https://www.bbc.co.uk/sport/basketball/56061283,Stephen Curry,0.1342105263157895,0.5740283727645874,0.5708628296852112,0.6268447637557983,0.0642362319999017
NBA All-Star Game: Giannis Antetokounmpo MVP as Team LeBron beat Team Durant 170-150,2021,https://www.bbc.co.uk/sport/basketball/56318297,Stephen Curry,0.1743215118215117,0.5991060932477316,0.5382518668969473,0.6268447637557983,0.0796452005978504
NBA: LeBron James helps LA Lakers beat Golden State Warriors,2021,https://www.bbc.co.uk/sport/basketball/56411872,Stephen Curry,0.2326936026936026,0.5736211538314819,0.5367866357167562,0.6268447637557983,0.0120857321301085
NBA: Joel Embiid scores 39 points as Philadelphia top Eastern Conference,2021,https://www.bbc.co.uk/sport/basketball/56756955,Stephen Curry,0.1227272727272727,0.6545020937919617,0.5246710181236267,0.6268447637557983,0.0256451573436598
Chet Holmgren: Is this 7ft teenager basketball's next superstar?,2021,https://www.bbc.co.uk/sport/av/basketball/55909258,Stephen Curry,0.0,0.5118496417999268,0.7212185859680176,0.6268447637557983,0.0409522197629384
NBA: Los Angeles Lakers beaten by Philadelphia 76ers to end away streak,2021,https://www.bbc.co.uk/sport/basketball/55838170,Stephen Curry,0.2477431881843646,0.5629806220531464,0.57335165143013,0.6268447637557983,0.0518391063550373
NBA: Dallas Mavericks 'do not plan' to play national anthem again before games,2021,https://www.bbc.co.uk/sport/basketball/55988763,Stephen Curry,0.2152968711505297,0.6300680041313171,0.5813840746879577,0.6268447637557983,0.0125432614895901
"NBA: LA Lakers and LA Clippers win, Boston Celtics v Miami Heat called off",2021,https://www.bbc.co.uk/sport/basketball/55615129,Stephen Curry,0.0863636363636363,0.5805078744888306,0.5123952031135559,0.6268447637557983,0.0202787947865563
NBA: Miami Heat beat Los Angeles Lakers as Curry misses Warriors game in Charlotte,2021,https://www.bbc.co.uk/sport/basketball/56144438,Stephen Curry,0.0683333333333333,0.5940447648366293,0.6056467096010844,0.6268447637557983,0.0
Giannis Antetokounmpo helps Milwaukee Bucks beat Philadelphia 76ers,2021,https://www.bbc.co.uk/sport/basketball/56440079,Stephen Curry,0.0446859903381642,0.5987921754519144,0.5180456837018331,0.6268447637557983,0.6438330602954052
NBA: Damian Lillard stars as Portland Trail Blazers beat Chicago Bulls,2021,https://www.bbc.co.uk/sport/basketball/55877070,Damian Lillard,-0.0012396694214876,0.571411112944285,0.5579972664515177,0.6273689270019531,0.6438330602954052
NBA: LA Lakers lose to Portland as Atlanta Hawks overcome Detroit Pistons,2021,https://www.bbc.co.uk/sport/basketball/55473013,Damian Lillard,0.2488776655443322,0.5879122813542684,0.5710509816805521,0.6273689270019531,0.0
NBA All-Star Game: Giannis Antetokounmpo MVP as Team LeBron beat Team Durant 170-150,2021,https://www.bbc.co.uk/sport/basketball/56318297,Damian Lillard,0.1743215118215117,0.6240652402242025,0.5663912892341614,0.6273689270019531,0.0
NBA: Giannis Antetokounmpo scores fifth triple-double of season in Milwaukee Bucks win,2021,https://www.bbc.co.uk/sport/basketball/56370610,Damian Lillard,0.2651903651903652,0.5809205174446106,0.6058064341545105,0.6273689270019531,0.0341593673505587
NBA: Jimmy Butler stars as Miami Heat beat Utah Jazz,2021,https://www.bbc.co.uk/sport/basketball/56221356,Damian Lillard,0.1444444444444444,0.5839468836784363,0.5602486431598663,0.6273689270019531,0.0658807728591045
NBA: James Harden shines as Brooklyn Nets beat San Antonio Spurs,2021,https://www.bbc.co.uk/sport/basketball/56250373,Damian Lillard,0.2784848484848484,0.5910648306210836,0.5506198207537333,0.6273689270019531,0.1405267371341086
NBA: Kevin Durant and debutant James Harden star in Brooklyn Nets win,2021,https://www.bbc.co.uk/sport/basketball/55694101,Damian Lillard,0.1015316205533596,0.6245923638343811,0.5567735632260641,0.6273689270019531,0.0444558286478126
NBA: Andre Drummond injured on debut as LA Lakers lose to Milwaukee Bucks,2021,https://www.bbc.co.uk/sport/basketball/56599927,Damian Lillard,0.2182479557479557,0.586512565612793,0.6127674877643585,0.6273689270019531,0.0615624472583344
NBA: Los Angeles Lakers hope to meet President-elect Joe Biden but champions lose at Spurs,2021,https://www.bbc.co.uk/sport/basketball/55584721,Damian Lillard,0.2087121212121211,0.5606806725263596,0.58937206864357,0.6273689270019531,0.0236562985304704
NBA: James Harden reported to be joining Brooklyn Nets as they beat New York Knicks,2021,https://www.bbc.co.uk/sport/basketball/55658704,Damian Lillard,0.2285443722943723,0.5388847947120666,0.6139058828353882,0.6273689270019531,0.0336669183646545
NBA: James Harden shines as Brooklyn Nets win at Houston Rockets,2021,https://www.bbc.co.uk/sport/basketball/56276876,Damian Lillard,0.235438689217759,0.5906719207763672,0.5818079113960266,0.6273689270019531,0.0215692920574009
NBA: Joel Embiid makes Philadelphia 76ers history in win over LA Clippers,2021,https://www.bbc.co.uk/sport/basketball/56783443,Nikola Jokić,0.2091017316017316,0.5867963830629984,0.5675614873568217,0.6354597806930542,0.0
NBA: Anthony Davis injured as LA Lakers lose to Denver Nuggets,2021,https://www.bbc.co.uk/sport/basketball/56067667,Nikola Jokić,0.0857142857142857,0.5420451462268829,0.6338574588298798,0.6354597806930542,0.0254097077338788
NBA: James Harden inspires Brooklyn Nets to win against Phoenix Suns,2021,https://www.bbc.co.uk/sport/basketball/56095264,Nikola Jokić,0.2388888888888888,0.5967473238706589,0.6191455274820328,0.6354597806930542,0.0280370794083895
NBA: Los Angeles Lakers hope to meet President-elect Joe Biden but champions lose at Spurs,2021,https://www.bbc.co.uk/sport/basketball/55584721,Nikola Jokić,0.2087121212121211,0.5890849679708481,0.566448763012886,0.6354597806930542,0.0
NBA: James Harden shines as Brooklyn Nets beat San Antonio Spurs,2021,https://www.bbc.co.uk/sport/basketball/56250373,Nikola Jokić,0.2784848484848484,0.6022864182790121,0.5721993843714396,0.6354597806930542,0.0061558227987997
LaMelo Ball: Charlotte Hornets rookie becomes youngest player in NBA history to score triple-double,2021,https://www.bbc.co.uk/sport/basketball/55608161,Nikola Jokić,0.0913720538720539,0.5727131068706512,0.5635308474302292,0.6354597806930542,0.0799583497508096
NBA round-up: Utah Jazz beat Orlando Magic; Dallas Mavericks win against Brooklyn Nets,2021,https://www.bbc.co.uk/sport/basketball/56229659,Nikola Jokić,0.3131016042780748,0.5445627570152283,0.5605119069417318,0.6354597806930542,0.0221823418594291
NBA: Joel Embiid injured on return as Philadelphia 76ers beat Washington Wizards,2021,https://www.bbc.co.uk/sport/basketball/56384645,Nikola Jokić,0.0637987012987012,0.5628989537556967,0.6019451022148132,0.6354597806930542,0.0269770923121695
"NBA 2021 season: Boston Celtics beat Milwaukee Bucks, Miami Heat lose to Orlando Magic",2021,https://www.bbc.co.uk/sport/basketball/55435333,Nikola Jokić,0.1268518518518518,0.5561716705560684,0.5747727453708649,0.6354597806930542,0.0221870122974216
NBA: Houston Rockets beat San Antonio Spurs,2021,https://www.bbc.co.uk/sport/basketball/55673146,Nikola Jokić,0.1820175438596491,0.5609478950500488,0.5841350158055624,0.6354597806930542,0.0179913814668557
NBA: LeBron James and Anthony Davis shine as Lakers top Western Conference,2021,https://www.bbc.co.uk/sport/basketball/55556627,Nikola Jokić,0.1618686868686868,0.5742388566335043,0.5432119965553284,0.6354597806930542,0.0153009714950812
NBA: Golden State Warriors coach Steve Kerr hails Stephen Curry scoring streak after win over 76ers,2021,https://www.bbc.co.uk/sport/basketball/56812419,Nikola Jokić,0.0993506493506493,0.6192006468772888,0.5304314891497294,0.6354597806930542,0.0107402837567825
NBA: LA Lakers lose to Portland as Atlanta Hawks overcome Detroit Pistons,2021,https://www.bbc.co.uk/sport/basketball/55473013,Nikola Jokić,0.2488776655443322,0.5840378006299337,0.5108486811319987,0.6354597806930542,0.0236562985304704
"NBA: Steph Curry moves to second on all-time three-pointers list, LA Lakers beat Chicago Bulls",2021,https://www.bbc.co.uk/sport/basketball/55785310,Nikola Jokić,0.1298996458087367,0.5664140582084656,0.5859870463609695,0.6354597806930542,0.0
NBA: Anthony Davis leads Los Angeles Lakers to seventh straight win over Memphis Grizzlies,2021,https://www.bbc.co.uk/sport/basketball/56052423,Nikola Jokić,0.1857954545454545,0.6243407527605692,0.576426108678182,0.6354597806930542,0.2074689316150181
NBA: Luka Doncic helps Dallas Mavericks win as James Harden shines for Brooklyn Nets,2021,https://www.bbc.co.uk/sport/basketball/56179595,Nikola Jokić,0.1867153679653679,0.560330256819725,0.556909367442131,0.6354597806930542,0.0
NBA: LeBron James shoots season-high 46 in LA Lakers win over Cleveland,2021,https://www.bbc.co.uk/sport/basketball/55807721,Nikola Jokić,0.1807291666666666,0.5496389746665955,0.6066759943962097,0.6354597806930542,0.0
Cleveland Cavaliers 125-113 Brooklyn Nets: Collin Sexton shines again to lead Cavs to victory,2021,https://www.bbc.co.uk/sport/basketball/55778820,Nikola Jokić,0.1811188811188811,0.5626220822334289,0.607735562324524,0.6354597806930542,0.0128378811304634
NBA: Los Angeles Lakers beaten by Philadelphia 76ers to end away streak,2021,https://www.bbc.co.uk/sport/basketball/55838170,Bradley Beal,0.2477431881843646,0.5635989606380463,0.621910959482193,0.6244285702705383,0.014600647325925
NBA All-Star Game: Giannis Antetokounmpo MVP as Team LeBron beat Team Durant 170-150,2021,https://www.bbc.co.uk/sport/basketball/56318297,Bradley Beal,0.1743215118215117,0.5884048342704773,0.5500557025273641,0.6244285702705383,0.0
NBA: Russell Westbrook ties league record for triple-doubles as Washington Wizards win,2021,https://www.bbc.co.uk/sport/basketball/57045891,Bradley Beal,0.3249999999999999,0.6363427042961121,0.6207025349140167,0.6244285702705383,0.0
NBA: LeBron James shines as Los Angeles Lakers beat Oklahoma City Thunder in overtime,2021,https://www.bbc.co.uk/sport/basketball/55992334,Bradley Beal,0.1404377880184331,0.5384175181388855,0.5271945397059122,0.6244285702705383,0.0
NBA: Los Angeles Lakers lose third game in a row after overtime defeat to Washington,2021,https://www.bbc.co.uk/sport/basketball/56166119,Bradley Beal,0.0738095238095238,0.5492784976959229,0.5843588511149088,0.6244285702705383,0.5202924207866805
NBA round-up: Utah Jazz beat Orlando Magic; Dallas Mavericks win against Brooklyn Nets,2021,https://www.bbc.co.uk/sport/basketball/56229659,Bradley Beal,0.3131016042780748,0.5923022031784058,0.6025504867235819,0.6244285702705383,0.7305677540284644
"LeBron James: LA Lakers great marks 1,300th NBA regular-season game with victory",2021,https://www.bbc.co.uk/sport/basketball/56236587,Bradley Beal,0.0416125541125541,0.593881090482076,0.6152565677960714,0.6244285702705383,0.4365297658873328
NBA: Phoenix Suns reach play-offs for first time in 11 years,2021,https://www.bbc.co.uk/sport/basketball/56925403,Bradley Beal,0.1869949494949495,0.560359463095665,0.5871532559394836,0.6244285702705383,0.6438330602954052
NBA: Stephen Curry sets Golden State Warriors record in win over Denver Nuggets,2021,https://www.bbc.co.uk/sport/basketball/56729552,Bradley Beal,0.1434681637806638,0.6323068737983704,0.5965905338525772,0.6244285702705383,0.0421020724568029
"NBA: Stephen Curry, Luka Doncic and Kyrie Irving star in best plays of the week",2021,https://www.bbc.co.uk/sport/av/basketball/56799805,Luka Dončić,1.0,0.6029457449913025,0.8269193172454834,0.6387507915496826,0.0496143053435389
NBA: Watch Luka Doncic throw stunning buzzer-beater for Dallas Mavericks,2021,https://www.bbc.co.uk/sport/av/basketball/56758416,Luka Dončić,0.5,0.5152129530906677,0.5355755090713501,0.6387507915496826,0.8443099119671311
NBA: Stephen Curry & Luka Doncic star in best plays of the week,2021,https://www.bbc.co.uk/sport/av/basketball/56086875,Luka Dončić,1.0,0.5632112622261047,0.6140499114990234,0.6387507915496826,0.6438330602954055
NBA: Watch Luka Doncic last-second winner helps Dallas Mavericks beat Boston Celtics,2021,https://www.bbc.co.uk/sport/av/basketball/56182519,Luka Dončić,0.0,0.6056466102600098,0.6091821789741516,0.6387507915496826,0.5202924207866804
Watch: Luka Doncic scores career-high 46 points in Maverkics win,2021,https://www.bbc.co.uk/sport/av/basketball/56053400,Luka Dončić,0.8,0.5537951588630676,0.6021428108215332,0.6387507915496826,0.5755074808812175
NBA: Luka Doncic helps Dallas Mavericks win as James Harden shines for Brooklyn Nets,2021,https://www.bbc.co.uk/sport/basketball/56179595,Luka Dončić,0.1867153679653679,0.5612741112709045,0.546515166759491,0.6387507915496826,0.037742202307188
NBA round-up: Luka Doncic stars but Dallas Mavericks lose to Chicago Bulls,2021,https://www.bbc.co.uk/sport/basketball/55701549,Luka Dončić,0.0108225108225108,0.5970226973295212,0.5759074985980988,0.6387507915496826,0.6438330602954052
NBA: Luka Doncic shows off fancy footwork as Mavericks beat Heat,2021,https://www.bbc.co.uk/sport/av/basketball/55515225,Luka Dončić,0.0,0.5631564855575562,0.6417601704597473,0.6387507915496826,0.0342005703394127
Watch LeBron James' 'circus shot' in NBA plays of the week,2021,https://www.bbc.co.uk/sport/av/basketball/56483331,Luka Dončić,0.0,0.5701596140861511,0.7217709422111511,0.6387507915496826,0.0400216395860007
NBA plays of the week: Watch some 'nasty' dunks and buzzer beaters,2021,https://www.bbc.co.uk/sport/av/basketball/56210685,Luka Dončić,-1.0,0.6799215078353882,0.6189552545547485,0.6387507915496826,0.6438330602954052
NBA: Anthony Davis leads Los Angeles Lakers to seventh straight win over Memphis Grizzlies,2021,https://www.bbc.co.uk/sport/basketball/56052423,Luka Dončić,0.1857954545454545,0.6335411071777344,0.5620354811350504,0.6387507915496826,0.5755074808812175
NBA: Joel Embiid scores 39 points as Philadelphia top Eastern Conference,2021,https://www.bbc.co.uk/sport/basketball/56756955,Luka Dončić,0.1227272727272727,0.626013457775116,0.5483188629150391,0.6387507915496826,0.5755074808812175
NBA: Miles Bridges' 'filthy' dunk leads plays of the week,2021,https://www.bbc.co.uk/sport/av/basketball/56772216,Luka Dončić,-0.8,0.5880511403083801,0.5362274646759033,0.6387507915496826,0.0358842117779379
NBA: Los Angeles Clippers suffer mammoth 51-point defeat by Dallas Mavericks,2021,https://www.bbc.co.uk/sport/basketball/55462919,Luka Dončić,0.0319674012855831,0.5333550572395325,0.5948412418365479,0.6387507915496826,0.2501953396189476
NBA: LeBron James shines as Los Angeles Lakers beat Oklahoma City Thunder in overtime,2021,https://www.bbc.co.uk/sport/basketball/55992334,Luka Dončić,0.1404377880184331,0.6275959610939026,0.5173478126525879,0.6387507915496826,0.6438330602954052
NBA: Utah Jazz beat Philadelphia 76ers to enhance league's best record,2021,https://www.bbc.co.uk/sport/basketball/56061283,Luka Dončić,0.1342105263157895,0.6141172647476196,0.5742382605870565,0.6387507915496826,0.0356211754318295
NBA: Giannis Antetokounmpo scores fifth triple-double of season in Milwaukee Bucks win,2021,https://www.bbc.co.uk/sport/basketball/56370610,Luka Dončić,0.2651903651903652,0.6080097675323486,0.5496153593063354,0.6387507915496826,0.4747446951004773
NBA: Los Angeles Lakers hope to meet President-elect Joe Biden but champions lose at Spurs,2021,https://www.bbc.co.uk/sport/basketball/55584721,Luka Dončić,0.2087121212121211,0.5576231628656387,0.5822294354438782,0.6387507915496826,0.0183086917905076
NBA: Giannis Antetokounmpo shines as Milwaukee Bucks beat Detroit Pistons,2021,https://www.bbc.co.uk/sport/basketball/55542453,Luka Dončić,0.2976584022038567,0.6451582312583923,0.620290219783783,0.6387507915496826,0.7305677540284644
NBA: Joel Embiid returns from injury in Philadelphia 76ers win,2021,https://www.bbc.co.uk/sport/basketball/56630066,Luka Dončić,0.2133173843700159,0.5274843176205953,0.690400242805481,0.6387507915496826,0.0
NBA: Toronto Raptors rout Golden State Warriors as Giannis Antetokounmpo stars for Bucks,2021,https://www.bbc.co.uk/sport/basketball/56623166,Luka Dončić,0.2025717703349282,0.5671588579813639,0.6227400302886963,0.6387507915496826,0.0
"NBA: Chris Paul reaches 10,000 assists as the Phoenix Suns beat the Los Angeles Lakers",2021,https://www.bbc.co.uk/sport/basketball/56478914,Luka Dončić,0.1363042186571598,0.5315965414047241,0.5387914578119913,0.6387507915496826,0.0590549287058684
Giannis Antetokounmpo helps Milwaukee Bucks beat Philadelphia 76ers,2021,https://www.bbc.co.uk/sport/basketball/56440079,Luka Dončić,0.0446859903381642,0.6033827662467957,0.5886988043785095,0.6387507915496826,0.0244497758559701
NBA: Golden State Warriors coach Steve Kerr hails Stephen Curry scoring streak after win over 76ers,2021,https://www.bbc.co.uk/sport/basketball/56812419,Luka Dončić,0.0993506493506493,0.5773391524950663,0.5649495323499044,0.6387507915496826,0.0060037188266239
NBA: James Harden shines as Brooklyn Nets beat San Antonio Spurs,2021,https://www.bbc.co.uk/sport/basketball/56250373,Luka Dončić,0.2784848484848484,0.6144686937332153,0.5790752172470093,0.6387507915496826,0.0060940656368253
NBA round-up: Utah Jazz beat Orlando Magic; Dallas Mavericks win against Brooklyn Nets,2021,https://www.bbc.co.uk/sport/basketball/56229659,Luka Dončić,0.3131016042780748,0.5702502926190695,0.5840625564257304,0.6387507915496826,0.5755074808812175
NBA: LeBron James stars against Oklahoma City as Los Angeles Lakers win six in a row,2021,https://www.bbc.co.uk/sport/basketball/56022204,Luka Dončić,0.1366522366522366,0.5342906713485718,0.611980676651001,0.6387507915496826,0.6438330602954051
Sports trading cards: Why 'blockbuster' cards have boomed in lockdown,2021,https://www.bbc.co.uk/sport/56903823,Luka Dončić,0.1317458599601456,0.5458789765834808,0.5740323960781097,0.6387507915496826,0.0469871056603862
NBA: James Harden reported to be joining Brooklyn Nets as they beat New York Knicks,2021,https://www.bbc.co.uk/sport/basketball/55658704,Luka Dončić,0.2285443722943723,0.5593828082084655,0.5925682544708252,0.6387507915496826,0.0518391063550373
NBA: James Harden shines as Brooklyn Nets win at Houston Rockets,2021,https://www.bbc.co.uk/sport/basketball/56276876,Luka Dončić,0.235438689217759,0.5769929528236389,0.5444096446037292,0.6387507915496826,0.0310542626812138
Cleveland Cavaliers 125-113 Brooklyn Nets: Collin Sexton shines again to lead Cavs to victory,2021,https://www.bbc.co.uk/sport/basketball/55778820,Luka Dončić,0.1811188811188811,0.5888522863388062,0.5726275324821473,0.6387507915496826,0.022350661312426
NBA All-Star Game: Giannis Antetokounmpo MVP as Team LeBron beat Team Durant 170-150,2021,https://www.bbc.co.uk/sport/basketball/56318297,Giannis Antetokounmpo,0.1743215118215117,0.602550874153773,0.559641698996226,0.6317904591560364,0.0221823418594291
NBA: Giannis Antetokounmpo scores fifth triple-double of season in Milwaukee Bucks win,2021,https://www.bbc.co.uk/sport/basketball/56370610,Giannis Antetokounmpo,0.2651903651903652,0.5687396883964538,0.6065456509590149,0.6317904591560364,0.5202924207866805
NBA: Milwaukee Bucks' Giannis Antetokounmpo posts triple-double to beat Washington Wizards,2021,https://www.bbc.co.uk/sport/basketball/56392125,Giannis Antetokounmpo,0.1086363636363636,0.6210890412330627,0.5626545945803324,0.6317904591560364,0.0
Giannis Antetokounmpo helps Milwaukee Bucks beat Philadelphia 76ers,2021,https://www.bbc.co.uk/sport/basketball/56440079,Giannis Antetokounmpo,0.0446859903381642,0.6346313754717509,0.660634179910024,0.6317904591560364,0.0495749048377907
NBA: Giannis Antetokounmpo shines as Milwaukee Bucks beat Detroit Pistons,2021,https://www.bbc.co.uk/sport/basketball/55542453,Giannis Antetokounmpo,0.2976584022038567,0.5882603377103806,0.5980765521526337,0.6317904591560364,0.0
NBA: Toronto Raptors rout Golden State Warriors as Giannis Antetokounmpo stars for Bucks,2021,https://www.bbc.co.uk/sport/basketball/56623166,Giannis Antetokounmpo,0.2025717703349282,0.5556532144546509,0.5709907213846842,0.6317904591560364,0.0215692920574009
Watch: Stephen Curry lights up NBA All-Star weekend,2021,https://www.bbc.co.uk/sport/av/basketball/56320296,Giannis Antetokounmpo,0.0,0.5227197408676147,0.5247005224227905,0.6317904591560364,0.0177730034047461
NBA: Anthony Davis leads Los Angeles Lakers to seventh straight win over Memphis Grizzlies,2021,https://www.bbc.co.uk/sport/basketball/56052423,Giannis Antetokounmpo,0.1857954545454545,0.5709863305091858,0.5725937088330587,0.6317904591560364,0.0283300126190878
NBA: Andre Drummond injured on debut as LA Lakers lose to Milwaukee Bucks,2021,https://www.bbc.co.uk/sport/basketball/56599927,Giannis Antetokounmpo,0.2182479557479557,0.6360000818967819,0.595942035317421,0.6317904591560364,0.0148403801287498
NBA: LeBron James helps LA Lakers beat Golden State Warriors,2021,https://www.bbc.co.uk/sport/basketball/56411872,Giannis Antetokounmpo,0.2326936026936026,0.5614485343297323,0.6350473165512085,0.6317904591560364,0.0353468247264167
LaMelo Ball: Charlotte Hornets rookie becomes youngest player in NBA history to score triple-double,2021,https://www.bbc.co.uk/sport/basketball/55608161,Giannis Antetokounmpo,0.0913720538720539,0.593804270029068,0.5774503946304321,0.6317904591560364,0.5202924207866805
NBA: LeBron James stars against Oklahoma City as Los Angeles Lakers win six in a row,2021,https://www.bbc.co.uk/sport/basketball/56022204,Giannis Antetokounmpo,0.1366522366522366,0.5780237515767416,0.6532081564267477,0.6317904591560364,0.0364221131494812
Brooklyn Nets beat Orlando Magic for eighth straight win,2021,https://www.bbc.co.uk/sport/basketball/56207442,Giannis Antetokounmpo,0.0103896103896103,0.5605031549930573,0.5838350653648376,0.6317904591560364,0.0128378811304634
NBA: Los Angeles Lakers beaten by Philadelphia 76ers to end away streak,2021,https://www.bbc.co.uk/sport/basketball/55838170,Giannis Antetokounmpo,0.2477431881843646,0.5569788217544556,0.5454640984535217,0.6317904591560364,0.0966847407358693
"LeBron James: LA Lakers great marks 1,300th NBA regular-season game with victory",2021,https://www.bbc.co.uk/sport/basketball/56236587,Giannis Antetokounmpo,0.0416125541125541,0.6204160253206888,0.5953097740809122,0.6317904591560364,0.0615624472583345
NBA: Brooklyn Nets beat Toronto Raptors to seal Easter Conference play-off spot,2021,https://www.bbc.co.uk/sport/basketball/56911906,Giannis Antetokounmpo,0.2177685950413223,0.5826529264450073,0.6034389734268188,0.6317904591560364,0.5202924207866805
