title,date,url,player,textblob_sentiment,sentiment_bert_average_score,sentiment_xlnet_average_score,bert_relevance,relevance_score
LeBron vs Zlatan: Who won the politics bout?,2021,https://www.bbc.co.uk/news/world-us-canada-56222894,James Harden,0.0,0.5696423649787903,0.76595139503479,0.6273145079612732,
NBA: Anthony Davis leads Los Angeles Lakers to seventh straight win over Memphis Grizzlies,2021,https://www.bbc.co.uk/sport/basketball/56052423,James Harden,0.1857954545454545,0.6011885404586792,0.5669860243797302,0.6273145079612732,
Brooklyn Nets beat Orlando Magic for eighth straight win,2021,https://www.bbc.co.uk/sport/basketball/56207442,James Harden,0.0103896103896103,0.5705210268497467,0.5296183228492737,0.6273145079612732,
Caris LeVert: Brooklyn Nets to Indiana Pacers trade could have saved his life,2021,https://www.bbc.co.uk/sport/basketball/55730153,James Harden,0.1749090909090909,0.5911262333393097,0.587552547454834,0.6273145079612732,
NBA: Andre Drummond injured on debut as LA Lakers lose to Milwaukee Bucks,2021,https://www.bbc.co.uk/sport/basketball/56599927,James Harden,0.2182479557479557,0.5613423734903336,0.5697442591190338,0.6273145079612732,
"NBA: LA Lakers edge win over Chicago Bulls, Warriors beat Clippers",2021,https://www.bbc.co.uk/sport/basketball/55599975,James Harden,0.1415719696969696,0.5606256127357483,0.5373288790384928,0.6273145079612732,
NBA: LaMarcus Aldridge impresses on debut in Brooklyn Nets win,2021,https://www.bbc.co.uk/sport/basketball/56613612,James Harden,0.2268181818181817,0.5735849142074585,0.5647320449352264,0.6273145079612732,
NBA: Russell Westbrook makes historic triple-double for Washington Wizards,2021,https://www.bbc.co.uk/sport/basketball/56574070,James Harden,0.1661616161616161,0.6090212762355804,0.6036536395549774,0.6273145079612732,
NFL play-offs: Patrick Mahomes 'out of concussion protocol' for Kansas City Chiefs,2021,https://www.bbc.co.uk/sport/american-football/55768423,James Harden,0.1526515151515151,0.5896519899368287,0.5939987182617188,0.6273145079612732,
NBA: New York Knicks make play-offs for first time in eight years after Celtics lose to Cleveland,2021,https://www.bbc.co.uk/sport/basketball/57097575,James Harden,0.0475935828877005,0.5910579760869344,0.5490015943845113,0.6273145079612732,
"NBA: Phoenix Suns beat Utah Jazz to go 4-1, Philadelphia 76ers beat Orlando Magic",2021,https://www.bbc.co.uk/sport/basketball/55505873,James Harden,0.2086700336700336,0.563084065914154,0.6476032435894012,0.6273145079612732,
NBA round-up: Stephen Curry helps Golden State Warriors beat Los Angeles Lakers,2021,https://www.bbc.co.uk/sport/basketball/55701354,James Harden,0.0648760330578512,0.5553654233614603,0.6045020818710327,0.6273145079612732,
NBA: Anthony Davis leads Los Angeles Lakers to seventh straight win over Memphis Grizzlies,2021,https://www.bbc.co.uk/sport/basketball/56052423,Kristaps Porziņģis,0.1857954545454545,0.5759652455647787,0.5317804416020712,0.6356549263000488,
NBA: Giannis Antetokounmpo scores fifth triple-double of season in Milwaukee Bucks win,2021,https://www.bbc.co.uk/sport/basketball/56370610,Kristaps Porziņģis,0.2651903651903652,0.5227797150611877,0.5486817598342896,0.6356549263000488,
NBA round-up: Utah Jazz beat Orlando Magic; Dallas Mavericks win against Brooklyn Nets,2021,https://www.bbc.co.uk/sport/basketball/56229659,Kristaps Porziņģis,0.3131016042780748,0.5429831743240356,0.5742460091908773,0.6356549263000488,
NBA: James Harden shines as Brooklyn Nets win at Houston Rockets,2021,https://www.bbc.co.uk/sport/basketball/56276876,Kristaps Porziņģis,0.235438689217759,0.5916369795799256,0.5675492882728577,0.6356549263000488,
The Reunion: Deepwater Horizon Oil Spill,2021,https://www.bbc.co.uk/programmes/m000v2lz,Gordon Hayward,0.0,0.5782116055488586,0.574552595615387,0.6274356245994568,
Cleveland Cavaliers 125-113 Brooklyn Nets: Collin Sexton shines again to lead Cavs to victory,2021,https://www.bbc.co.uk/sport/basketball/55778820,Gordon Hayward,0.1811188811188811,0.6178208708763122,0.56228666305542,0.6274356245994568,
Glasgow Warriors 46-25 Benetton: Bonus-point win for hosts,2021,https://www.bbc.co.uk/sport/rugby-union/56550510,Gordon Hayward,0.102020202020202,0.5837641954421997,0.5479613393545151,0.6274356245994568,
Covid-19: 'Behave responsibly' as lockdown eases and China 'vaccine efficacy low',2021,https://www.bbc.co.uk/news/uk-56712829,Gordon Hayward,0.1,0.6739938259124756,0.5782960057258606,0.6274356245994568,
Faith leaders oppose Yarl's Wood asylum seeker prefab plans,2021,https://www.bbc.co.uk/news/uk-england-beds-bucks-herts-55846266,Christian Wood,0.0,0.6301422119140625,0.5176520943641663,0.6206424236297607,
NBA: Houston Rockets beat San Antonio Spurs,2021,https://www.bbc.co.uk/sport/basketball/55673146,Christian Wood,0.1820175438596491,0.6141379674275717,0.6307686765988668,0.6206424236297607,
Houston Rockets suffer overtime loss to Portland Trail Blazers,2021,https://www.bbc.co.uk/sport/basketball/55458404,Christian Wood,0.0652525252525252,0.6102389991283417,0.6072763800621033,0.6206424236297607,
Tiger Woods: The triumphs and troubles of golf superstar,2021,https://www.bbc.co.uk/news/world-us-canada-56177816,Christian Wood,0.0,0.5324876308441162,0.5844863057136536,0.6206424236297607,
Coronavirus mutes Christmas celebrations in Bethlehem,2021,https://www.bbc.co.uk/news/world-middle-east-55408841,Christian Wood,0.0,0.7427961826324463,0.6614254713058472,0.6206424236297607,
Dina Asher-Smith: British sprinter calls for greater exposure of elite sporting females,2021,https://www.bbc.co.uk/sport/athletics/56340134,Christian Wood,0.2560320182961692,0.5828246235847473,0.624221408367157,0.6206424236297607,
NBA All-Star Game: LeBron James calls plans to play game in pandemic 'a slap in the face',2021,https://www.bbc.co.uk/sport/basketball/55944277,Kelly Oubre Jr.,-0.0051041666666666,0.5557047873735428,0.5326139032840729,0.5885355472564697,
NBA: Giannis Antetokounmpo scores fifth triple-double of season in Milwaukee Bucks win,2021,https://www.bbc.co.uk/sport/basketball/56370610,Shai Gilgeous-Alexander,0.2651903651903652,0.5350608468055725,0.5952067852020264,0.6037195324897766,
"NBA: LA Lakers and LA Clippers win, Boston Celtics v Miami Heat called off",2021,https://www.bbc.co.uk/sport/basketball/55615129,Shai Gilgeous-Alexander,0.0863636363636363,0.6201262772083282,0.5899634957313538,0.6037195324897766,
NBA: Minnesota Timberwolves' Karl-Anthony Towns defiant over Covid-19,2021,https://www.bbc.co.uk/sport/basketball/55687220,Shai Gilgeous-Alexander,0.0900252525252525,0.5853274861971537,0.5484313567479452,0.6037195324897766,
NBA: Stephen Curry shines for Golden State Warriors in win over leaders Utah Jazz,2021,https://www.bbc.co.uk/sport/basketball/56398838,Shai Gilgeous-Alexander,0.2471170033670034,0.5417079776525497,0.5512470602989197,0.6037195324897766,
NBA All-Star Game: 76ers' duo Joel Embiid and Ben Simmons ruled out due to contact tracing,2021,https://www.bbc.co.uk/sport/basketball/56315689,Ben Simmons,-0.0572727272727272,0.6022130846977234,0.5048232674598694,0.6246301531791687,
NBA: Joel Embiid makes Philadelphia 76ers history in win over LA Clippers,2021,https://www.bbc.co.uk/sport/basketball/56783443,Ben Simmons,0.2091017316017316,0.5834850271542867,0.6109551390012106,0.6246301531791687,
NBA: Utah Jazz beat Philadelphia 76ers to enhance league's best record,2021,https://www.bbc.co.uk/sport/basketball/56061283,Ben Simmons,0.1342105263157895,0.5517500837643942,0.6115731795628866,0.6246301531791687,
NBA: Giannis Antetokounmpo scores fifth triple-double of season in Milwaukee Bucks win,2021,https://www.bbc.co.uk/sport/basketball/56370610,Ben Simmons,0.2651903651903652,0.570350456237793,0.5690460443496704,0.6246301531791687,
NBA All-Star Game: Giannis Antetokounmpo MVP as Team LeBron beat Team Durant 170-150,2021,https://www.bbc.co.uk/sport/basketball/56318297,Ben Simmons,0.1743215118215117,0.6078906754652659,0.5998068650563558,0.6246301531791687,
Premiership: Exeter v London Irish,2021,https://www.bbc.co.uk/sport/rugby-union/56039219,Ben Simmons,0.0,0.6134408116340637,0.5739941596984863,0.6246301531791687,
NBA: Joel Embiid scores 39 points as Philadelphia top Eastern Conference,2021,https://www.bbc.co.uk/sport/basketball/56756955,Ben Simmons,0.1227272727272727,0.618245393037796,0.5143876671791077,0.6246301531791687,
Brooklyn Nets beat Orlando Magic for eighth straight win,2021,https://www.bbc.co.uk/sport/basketball/56207442,Ben Simmons,0.0103896103896103,0.6593445241451263,0.5676712393760681,0.6246301531791687,
LeBron James: Los Angeles Lakers star injures ankle in defeat by Atlanta Hawks,2021,https://www.bbc.co.uk/sport/basketball/56474291,Ben Simmons,0.0482792132792132,0.586210772395134,0.5409405827522278,0.6246301531791687,
Premiership: Newcastle Falcons 52-27 London Irish - Exiles blown away by second-half Falcons blitz,2021,https://www.bbc.co.uk/sport/rugby-union/56996677,Ben Simmons,0.0769968553459119,0.5721705953280131,0.5899859269460043,0.6246301531791687,
"NBA: Steph Curry moves to second on all-time three-pointers list, LA Lakers beat Chicago Bulls",2021,https://www.bbc.co.uk/sport/basketball/55785310,Ben Simmons,0.1298996458087367,0.6402457058429718,0.6432972699403763,0.6246301531791687,
Premiership: London Irish 36-33 Bath - Exiles enjoy five-try win as Dunn and Ewels see red,2021,https://www.bbc.co.uk/sport/rugby-union/56497552,Ben Simmons,0.0738674729150919,0.5561612546443939,0.5570655862490336,0.6246301531791687,
Premiership: Northampton Saints 44-26 London Irish - Six-try Saints move into top four,2021,https://www.bbc.co.uk/sport/rugby-union/56761124,Ben Simmons,0.0995614035087719,0.5856553912162781,0.5800002574920654,0.6246301531791687,
European Challenge Cup: Bath 26-13 London Irish - Will Stuart scores twice at The Rec,2021,https://www.bbc.co.uk/sport/rugby-union/56663094,Ben Simmons,0.2112179487179487,0.5757830619812012,0.5909130334854126,0.6246301531791687,
"NFL play-offs super wildcard round: Saints, Browns & Ravens advance",2021,https://www.bbc.co.uk/sport/american-football/55612657,Ben Simmons,0.1004422532200309,0.5666618006569999,0.5689723917416164,0.6246301531791687,
European Challenge Cup: London Irish 41-35 Cardiff Blues,2021,https://www.bbc.co.uk/sport/rugby-union/56604366,Ben Simmons,-0.0012268518518518,0.5551447749137879,0.5931649208068848,0.6246301531791687,
Premiership: Sale Sharks 41-13 London Irish - Sharks solidify top-four place,2021,https://www.bbc.co.uk/sport/rugby-union/56447519,Ben Simmons,0.0880964121348736,0.5754787921905518,0.5223529219627381,0.6246301531791687,
Premiership: London Irish 20-17 Worcester - Paddy Jackson penalty gives Exiles win,2021,https://www.bbc.co.uk/sport/rugby-union/56342207,Ben Simmons,0.1659290382819794,0.5530507326126098,0.5764965772628784,0.6246301531791687,
Premiership: London Irish 31-22 Newcastle Falcons - Exiles hold off fightback for bonus-point win,2021,https://www.bbc.co.uk/sport/rugby-union/55842791,Ben Simmons,0.0032325522801713,0.5907155990600585,0.5526737213134766,0.6246301531791687,
NBA: Joel Embiid makes Philadelphia 76ers history in win over LA Clippers,2021,https://www.bbc.co.uk/sport/basketball/56783443,P.J. Washington,0.2091017316017316,0.5877382953961691,0.5276865164438883,0.6092913746833801,
NBA: Anthony Davis leads Los Angeles Lakers to seventh straight win over Memphis Grizzlies,2021,https://www.bbc.co.uk/sport/basketball/56052423,P.J. Washington,0.1857954545454545,0.5421198407808939,0.5864821672439575,0.6092913746833801,
NFL play-offs: Patrick Mahomes 'out of concussion protocol' for Kansas City Chiefs,2021,https://www.bbc.co.uk/sport/american-football/55768423,P.J. Washington,0.1526515151515151,0.5527313351631165,0.6084077000617981,0.6092913746833801,
NFL play-offs: Five players set to light up the post-season,2021,https://www.bbc.co.uk/sport/american-football/55548609,P.J. Washington,0.1608501192684866,0.5365917801856994,0.5878934860229492,0.6092913746833801,
NBA: LeBron James helps LA Lakers beat Golden State Warriors,2021,https://www.bbc.co.uk/sport/basketball/56411872,P.J. Washington,0.2326936026936026,0.5575288136800131,0.558619221051534,0.6092913746833801,
LaMelo Ball: Charlotte Hornets rookie becomes youngest player in NBA history to score triple-double,2021,https://www.bbc.co.uk/sport/basketball/55608161,P.J. Washington,0.0913720538720539,0.5565101504325867,0.5518369823694229,0.6092913746833801,
NBA: Los Angeles Lakers beaten by Philadelphia 76ers to end away streak,2021,https://www.bbc.co.uk/sport/basketball/55838170,P.J. Washington,0.2477431881843646,0.5962950885295868,0.5554211884737015,0.6092913746833801,
NFL play-offs: Chiefs and Packers top seeds on road to Super Bowl 55,2021,https://www.bbc.co.uk/sport/american-football/55574897,P.J. Washington,0.2015366247509106,0.5611374318599701,0.5502645254135132,0.6092913746833801,
The Wall: Series 3: Versus Celebrities,2021,https://www.bbc.co.uk/programmes/m000slzz,John Wall,0.0,0.5454838871955872,0.5670623779296875,0.6245386004447937,
American Psycho at 30,2021,https://www.bbc.co.uk/programmes/m000tfl6,John Wall,0.0,0.700676441192627,0.5385890603065491,0.6245386004447937,
"Any Questions?: Jesse Norman MP, Lucy Powell MP, Lord Bilimoria, Yanis Varoufakis",2021,https://www.bbc.co.uk/programmes/m000ss4g,Norman Powell,0.0,0.5252265930175781,0.5279777646064758,0.6231723427772522,
NBA: Joel Embiid makes Philadelphia 76ers history in win over LA Clippers,2021,https://www.bbc.co.uk/sport/basketball/56783443,Norman Powell,0.2091017316017316,0.588863213857015,0.5823965867360433,0.6231723427772522,
New Year Honours 2021: Reading scoutmaster appointed MBE,2021,https://www.bbc.co.uk/news/uk-england-berkshire-55459829,Norman Powell,0.1363636363636363,0.5765103101730347,0.5973790884017944,0.6231723427772522,
NBA: LeBron James stars against Oklahoma City as Los Angeles Lakers win six in a row,2021,https://www.bbc.co.uk/sport/basketball/56022204,Norman Powell,0.1366522366522366,0.5828135212262472,0.5959969957669576,0.6231723427772522,
NBA: Kevin Durant and debutant James Harden star in Brooklyn Nets win,2021,https://www.bbc.co.uk/sport/basketball/55694101,Norman Powell,0.1015316205533596,0.6046348015467325,0.5960951844851176,0.6231723427772522,
NBA: Stephen Curry shines for Golden State Warriors in win over leaders Utah Jazz,2021,https://www.bbc.co.uk/sport/basketball/56398838,Norman Powell,0.2471170033670034,0.558893159031868,0.5894373059272766,0.6231723427772522,
Cleveland Cavaliers 125-113 Brooklyn Nets: Collin Sexton shines again to lead Cavs to victory,2021,https://www.bbc.co.uk/sport/basketball/55778820,Norman Powell,0.1811188811188811,0.6136122107505798,0.5220390200614929,0.6231723427772522,
NBA: Kevin Durant leads Brooklyn Nets to victory with 20 points against Golden State Warriors,2021,https://www.bbc.co.uk/sport/basketball/56060272,Kevin Huerter,0.227511961722488,0.6208890080451965,0.5370463132858276,0.6330984234809875,
Kobe Bryant formally inducted into Hall of Fame in postponed ceremony,2021,https://www.bbc.co.uk/sport/basketball/57133452,Kevin Huerter,0.3116071428571428,0.5542728106180826,0.6219479242960612,0.6330984234809875,
NBA: Joel Embiid makes Philadelphia 76ers history in win over LA Clippers,2021,https://www.bbc.co.uk/sport/basketball/56783443,Kevin Huerter,0.2091017316017316,0.5638812581698099,0.6192715962727865,0.6330984234809875,
NBA: Utah Jazz beat Philadelphia 76ers to enhance league's best record,2021,https://www.bbc.co.uk/sport/basketball/56061283,Kevin Huerter,0.1342105263157895,0.6226286292076111,0.5911296804745992,0.6330984234809875,
NBA All-Star Game: Giannis Antetokounmpo MVP as Team LeBron beat Team Durant 170-150,2021,https://www.bbc.co.uk/sport/basketball/56318297,Kevin Huerter,0.1743215118215117,0.578552762667338,0.5610485970973969,0.6330984234809875,
NBA: James Harden inspires Brooklyn Nets to win against Phoenix Suns,2021,https://www.bbc.co.uk/sport/basketball/56095264,Kevin Huerter,0.2388888888888888,0.5746545940637589,0.5837671756744385,0.6330984234809875,
NBA: Los Angeles Lakers beaten by Philadelphia 76ers to end away streak,2021,https://www.bbc.co.uk/sport/basketball/55838170,Kevin Huerter,0.2477431881843646,0.6137164980173111,0.5826764702796936,0.6330984234809875,
NBA: Dallas Mavericks 'do not plan' to play national anthem again before games,2021,https://www.bbc.co.uk/sport/basketball/55988763,Kevin Huerter,0.2152968711505297,0.5570321440696716,0.6231227517127991,0.6330984234809875,
LeBron James: NBA superstar's evolution from high school prodigy,2021,https://www.bbc.co.uk/sport/basketball/56186430,Kevin Huerter,0.1856344306893758,0.5810643362998963,0.5647211122512817,0.6330984234809875,
"NFL play-offs super wildcard round: Saints, Browns & Ravens advance",2021,https://www.bbc.co.uk/sport/american-football/55612657,Kevin Huerter,0.1004422532200309,0.545448192528316,0.543772850717817,0.6330984234809875,
NBA: Stephen Curry sets record for most three-pointers in a month,2021,https://www.bbc.co.uk/sport/basketball/56884822,Devonte' Graham,0.1238782051282051,0.5469088157018026,0.5318349401156107,0.6145673990249634,
LaMelo Ball: Charlotte Hornets rookie becomes youngest player in NBA history to score triple-double,2021,https://www.bbc.co.uk/sport/basketball/55608161,Tyler Herro,0.0913720538720539,0.591132178902626,0.5315742790699005,0.6290643811225891,
NBA: Joel Embiid stars as Philadelphia 76ers beat Miami Heat; LeBron James guides LA Lakers to win,2021,https://www.bbc.co.uk/sport/basketball/55643741,Tyler Herro,0.1200617283950617,0.6014219721158346,0.59958283106486,0.6290643811225891,
Green Bay Packers beat Los Angeles Rams; Buffalo Bills overcome Baltimore Ravens,2021,https://www.bbc.co.uk/sport/american-football/55692981,Tyler Herro,0.0954456438222671,0.5504388128008161,0.6018938762801034,0.6290643811225891,
Tom Brady's Tampa Bay Buccaneers to face Patrick Mahomes' Kansas City Chiefs in Super Bowl 55,2021,https://www.bbc.co.uk/sport/american-football/55791239,Tyler Herro,0.2503757518609004,0.5975786050160726,0.5875514878167046,0.6290643811225891,
LaMelo Ball: Charlotte Hornets rookie becomes youngest player in NBA history to score triple-double,2021,https://www.bbc.co.uk/sport/basketball/55608161,Lonzo Ball,0.0913720538720539,0.6451439708471298,0.614170029759407,0.6295530200004578,
NBA: James Harden inspires Brooklyn Nets to win against Phoenix Suns,2021,https://www.bbc.co.uk/sport/basketball/56095264,Lonzo Ball,0.2388888888888888,0.5678752511739731,0.5832590758800507,0.6295530200004578,
NBA: LeBron James helps LA Lakers beat Golden State Warriors,2021,https://www.bbc.co.uk/sport/basketball/56411872,Lonzo Ball,0.2326936026936026,0.5615624586741129,0.574728786945343,0.6295530200004578,
LeBron James: NBA superstar's evolution from high school prodigy,2021,https://www.bbc.co.uk/sport/basketball/56186430,Lonzo Ball,0.1856344306893758,0.5781452107429504,0.5606969857215881,0.6295530200004578,
Super Bowl 2021: Tom Brady wins seventh title as Tampa Bay Buccaneers beat Kansas City Chiefs,2021,https://www.bbc.co.uk/sport/american-football/55975394,Lonzo Ball,0.1569504942952147,0.581283375620842,0.5943705290555954,0.6295530200004578,
Tom Brady's Tampa Bay Buccaneers to face Patrick Mahomes' Kansas City Chiefs in Super Bowl 55,2021,https://www.bbc.co.uk/sport/american-football/55791239,Lonzo Ball,0.2503757518609004,0.582025514708625,0.573891109890408,0.6295530200004578,
Hege Riise: Who is Team GB's new women's football coach?,2021,https://www.bbc.co.uk/newsround/56346813,Lonzo Ball,0.1363636363636363,0.5405473709106445,0.555685818195343,0.6295530200004578,
NBA: Utah Jazz thrash depleted Brooklyn Nets 118-88,2021,https://www.bbc.co.uk/sport/basketball/56521016,Kyle Lowry,0.106784188034188,0.6047381361325582,0.5675916870435079,0.6208141446113586,
NBA: Brooklyn Nets beat Toronto Raptors to seal Easter Conference play-off spot,2021,https://www.bbc.co.uk/sport/basketball/56911906,Kyle Lowry,0.2177685950413223,0.5179481506347656,0.6027296185493469,0.6208141446113586,
Irish Premiership: Jimmy Callacher grabs vital win for Linfield over Crusaders with injury-time header,2021,https://www.bbc.co.uk/sport/football/55965355,Kyle Lowry,0.0562274531024531,0.5920193791389465,0.5423549860715866,0.6208141446113586,
NBA round-up: Stephen Curry helps Golden State Warriors beat Los Angeles Lakers,2021,https://www.bbc.co.uk/sport/basketball/55701354,Kyle Lowry,0.0648760330578512,0.5838844378789266,0.5737417141596476,0.6208141446113586,
Irish Premiership: Jonny Frazer double helps Carrick Rangers to 3-1 win at Crusaders,2021,https://www.bbc.co.uk/sport/football/56056918,Kyle Lowry,0.1050587845669813,0.5733109414577484,0.5592361887296041,0.6208141446113586,
Kevin Durant: Brooklyn Nets forward taken off because of coronavirus protocols,2021,https://www.bbc.co.uk/sport/basketball/55961257,Kyle Lowry,0.0776515151515151,0.5778330415487289,0.5809207707643509,0.6208141446113586,
NFL draft 2021: Meet the top 10 prospects,2021,https://www.bbc.co.uk/sport/american-football/56893930,Kyle Lowry,0.1657866231892206,0.5802428796887398,0.5640528500080109,0.6208141446113586,
Pro14: Ulster battle past Connacht in bruising inter-provincial derby,2021,https://www.bbc.co.uk/sport/rugby-union/55452744,Kyle Lowry,0.1750992063492063,0.5549042906079974,0.5835228902953011,0.6208141446113586,
NBA: Los Angeles Lakers lose again with LeBron James and Anthony Davis,2021,https://www.bbc.co.uk/sport/basketball/56494497,Anthony Davis,0.0408574380165289,0.559886117776235,0.6645280122756958,0.6271916627883911,
NBA: Anthony Davis injured as LA Lakers lose to Denver Nuggets,2021,https://www.bbc.co.uk/sport/basketball/56067667,Anthony Davis,0.0857142857142857,0.595936119556427,0.5253162384033203,0.6271916627883911,
NBA: LeBron James and Anthony Davis shine as Lakers top Western Conference,2021,https://www.bbc.co.uk/sport/basketball/55556627,Anthony Davis,0.1618686868686868,0.5109447638193766,0.5876449346542358,0.6271916627883911,
NBA: Anthony Davis leads Los Angeles Lakers to seventh straight win over Memphis Grizzlies,2021,https://www.bbc.co.uk/sport/basketball/56052423,Anthony Davis,0.1857954545454545,0.5754594405492147,0.629349946975708,0.6271916627883911,
"Fight Talk: Chris Eubank Jr, Anthony Joshua, Tyson Fury, Ryan Garcia, Gervonta Davis",2021,https://www.bbc.co.uk/sport/boxing/55619889,Anthony Davis,0.0790508200719468,0.6046235039830208,0.5729088336229324,0.6271916627883911,
NBA: LeBron James ties Christmas Day wins record in Los Angeles Lakers victory,2021,https://www.bbc.co.uk/sport/basketball/55451518,Anthony Davis,0.1407114624505928,0.6455425918102264,0.5587123185396194,0.6271916627883911,
Handel's Messiah from English National Opera,2021,https://www.bbc.co.uk/programmes/m000tzdt,Anthony Davis,0.0,0.6363651752471924,0.654184877872467,0.6271916627883911,
NBA: James Harden inspires Brooklyn Nets to win against Phoenix Suns,2021,https://www.bbc.co.uk/sport/basketball/56095264,Anthony Davis,0.2388888888888888,0.5632599741220474,0.6060713529586792,0.6271916627883911,
'Very dangerous' Plymouth man jailed for grooming girls on Snapchat,2021,https://www.bbc.co.uk/news/uk-england-devon-56184708,Anthony Davis,-0.78,0.7307583689689636,0.5333568453788757,0.6271916627883911,
"Bellator 258: Report, highlights and full replay",2021,https://www.bbc.co.uk/sport/mixed-martial-arts/57035667,Anthony Davis,0.1365508365508365,0.5922741666436195,0.5648177564144135,0.6271916627883911,
"Preston sign Stoke's Lindsay, Liverpool's Van den Berg & Everton's Gordon on loan",2021,https://www.bbc.co.uk/sport/football/55896334,Anthony Davis,0.2053571428571428,0.6288694441318512,0.5609812140464783,0.6271916627883911,
"NBA: LA Lakers and LA Clippers win, Boston Celtics v Miami Heat called off",2021,https://www.bbc.co.uk/sport/basketball/55615129,Anthony Davis,0.0863636363636363,0.5419431328773499,0.6175689399242401,0.6271916627883911,
NBA: Kevin Durant leads Brooklyn Nets to victory with 20 points against Golden State Warriors,2021,https://www.bbc.co.uk/sport/basketball/56060272,Justin Holiday,0.227511961722488,0.5732107758522034,0.5904641350110372,0.6250399947166443,
Grounded with Louis Theroux: 20. Justin Theroux,2021,https://www.bbc.co.uk/programmes/p091pg69,Justin Holiday,0.0,0.7510201930999756,0.6530337929725647,0.6250399947166443,
Multi Story: Within The Rules,2021,https://www.bbc.co.uk/programmes/p09h8q4q,Justin Holiday,0.0,0.516682505607605,0.7381523847579956,0.6250399947166443,
NFL draft 2021: Meet the top 10 prospects,2021,https://www.bbc.co.uk/sport/american-football/56893930,Justin Holiday,0.1657866231892206,0.5835638716816902,0.5712921395897865,0.6250399947166443,
Green Bay Packers beat Los Angeles Rams; Buffalo Bills overcome Baltimore Ravens,2021,https://www.bbc.co.uk/sport/american-football/55692981,Justin Holiday,0.0954456438222671,0.5664754850523812,0.6449576786586216,0.6250399947166443,
"Woman's Hour: Lockdown Hair, 'Red Wall' Mums, Greek Goddesses",2021,https://www.bbc.co.uk/programmes/m000sqr6,Justin Holiday,0.0,0.7044897079467773,0.7351993918418884,0.6250399947166443,
NBA: Andre Drummond injured on debut as LA Lakers lose to Milwaukee Bucks,2021,https://www.bbc.co.uk/sport/basketball/56599927,Justin Holiday,0.2182479557479557,0.6016215980052948,0.6140206456184387,0.6250399947166443,
You and Yours: Disabled Jobs; Housing Market; Haircuts,2021,https://www.bbc.co.uk/programmes/m000twgz,Justin Holiday,-0.2,0.6393710970878601,0.5594818592071533,0.6250399947166443,
NBA: LeBron James returns from 20-game absence but LA Lakers lose to Sacramento Kings,2021,https://www.bbc.co.uk/sport/basketball/56954626,Tyrese Haliburton,0.2022058823529411,0.5562212467193604,0.5482044219970703,0.6210810542106628,
Caris LeVert: Brooklyn Nets to Indiana Pacers trade could have saved his life,2021,https://www.bbc.co.uk/sport/basketball/55730153,Caris LeVert,0.1749090909090909,0.6062638163566589,0.5422232747077942,0.6160933375358582,
